"","cityurl","subcl","post_id","post_link","post_data_id","post_date_raw","post_title","post_price","post_subcl","post_subcltype","post_loc","post_text","post_date","post_last_update","post_pics","post_type"
"197","http://eastnc.craigslist.org","ppp","4668768310","http://eastnc.craigslist.org/cas/4668768310.html","4668768310","Sep 15","nsa fun",NA,"cas","casual encounters","swansboro,richlands,jacksonville","Simple as that, just like the title says, I know you see so many posts like this. There is a variety of posts you can chose from. So what makes this one any different? Guess only one way to find out, more details when you write. What I can say is that it is possible to be lonely even when you are not lonely physically. If this is you, and you want to change that and just have fun and let go, hit me up. I am married so prefer you be too, but not necessary, I will give you stats when I get an email and exchange pics when we both feel comfortable, not looking to rush anything, nor am I desperate, if it happens it happens, but it has to be a mutual feeling and understanding. Good luck to everyone on here and stay safe....Race doesn't matter and I don't mind curves and a thick girl that doesn't disqualify you lol :) Put your eye color in the subject line so I know you are real, thank you.","2014-09-15T09:13:22-0400","2014-09-15T16:00:00-0400","2","m4w"
"198","http://eastnc.craigslist.org","ppp","4668773430","http://eastnc.craigslist.org/cas/4668773430.html","4668773430","Sep 15","Looking around 2","24","cas","casual encounters","Greenville","Bottom needed looking for good mouth possibly ass to pound. Be white and tell me what uo would do to big cock.  No one over 40. Pics to the front will be looking until 2 hurry hurry. I rim mutual blow so let's do this","2014-09-15T09:17:40-0400","2014-09-15T09:17:40-0400","0","m4m"
"199","http://eastnc.craigslist.org","ppp","4668773825","http://eastnc.craigslist.org/cas/4668773825.html","4668773825","Sep 15","Mouth wet n ready","35","cas","casual encounters","Greenville/stokes","Very chill discrete. Brotha horney ass fuck needing a nice hard dick to suck you host your stats n pics get minds it's 9am","2014-09-15T09:17:59-0400","2014-09-15T10:49:09-0400","0","m4m"
"200","http://eastnc.craigslist.org","ppp","4668783309","http://eastnc.craigslist.org/cas/4668783309.html","4668783309","Sep 15","Tight ass","26","cas","casual encounters","New Bern","26 yo wm looking to get my ass pounded. Versatile as well if interested. Looking for an average or better white guy under 40. I'm 6 feet tall, 290lbs and my ass is tight. Safe play only, in New Bern","2014-09-15T09:25:32-0400","2014-09-15T09:25:32-0400","0","m4m"
"201","http://eastnc.craigslist.org","ppp","4668797970","http://eastnc.craigslist.org/cas/4668797970.html","4668797970","Sep 15","Who needs some head ?",NA,"cas","casual encounters","New bern","I am in new bern today would love to find a few cocks to suck.  I can't host will be in town and free all day.  No opposed to car head or if you know a spot.  Prefer married men who need NSA relief.  I can come to you little talking and service you and go.  Hit me up with stats or cock pic.  Looking long as ad is up.","2014-09-15T09:36:40-0400","2014-09-15T09:36:40-0400","0","m4m"
"202","http://eastnc.craigslist.org","ppp","4668800882","http://eastnc.craigslist.org/cas/4668800882.html","4668800882","Sep 15","Morning fun for hung","3138","cas","casual encounters","Washington NC","38m/31f bi MWC and a bi wm friend. Were looking for a hung bi guy to make her squirt.
We have a few requirements so read below before you reply please.
1) Reply with 'morning' in subject heading. (If you don't I will assume you are a bot and we won't reply.
2) Send a body and cock pic in your first reply. (We don't want to waste our time. Were not models and not looking for any, but there needs to be some attraction)
3) Be cool. (seriously, no crazies please)
4) Be hung at least 8 1/2"" and thick, white, and at least orally bi.
We are hosting at our house on almost any weekday morning and want to make this a regular weekly thing. so hurry it up with a response!!","2014-09-15T09:38:47-0400","2014-09-15T09:38:47-0400","2","mw4m"
"203","http://eastnc.craigslist.org","ppp","4668801217","http://eastnc.craigslist.org/cas/4668801217.html","4668801217","Sep 15","BBW Fantasy","43","cas","casual encounters","Pitt","OK, I am just venting I suppose at this point!  I am a normal middle-aged MWM.  I have a longstanding fantasy of making love to a BBW.  I have posted before and gotten afew replies, but so far nothing serious that I can tell.  I am not interested in a prostitute or anyone other than a caucasian lady.  Sorry, that is just my preference.  So, I suppose I am ""retiring"" from the search, but here is one last plea.  If there are any lovely larger ladies out there who might be interested in a roll in the hay, I would be honored to try and make you moan and scream.  Please reply with your favorite color in the subject line.  Thanks!","2014-09-15T09:39:01-0400","2014-09-15T09:39:01-0400","0","m4w"
"204","http://eastnc.craigslist.org","ppp","4668816085","http://eastnc.craigslist.org/cas/4668816085.html","4668816085","Sep 15","Hung Male","28","cas","casual encounters","New Bern","Have a couple days off and looking to have a little fun during the mournings/ afternoon 
I'm 28, 160lbs and well endowed as you can see! 
Not looking for a particular age or race, just looking for us to have some fun 
Send some pictures and maybe we can meet, only looking for females!","2014-09-15T09:49:27-0400","2014-09-15T09:49:27-0400","0","m4w"
"205","http://eastnc.craigslist.org","ppp","4668821655","http://eastnc.craigslist.org/cas/4668821655.html","4668821655","Sep 15","bubble booty for bbc","25","cas","casual encounters","rky mt, rr, enfield","wassup fellas sexy blk male here looking for those big dick sexc men to come over in the morning and stroke this boy pussy. love tall men. love a man who smells gud. when you get here ill be wearing red/pink fishnets waiting on daddy. you must leave your cum on me or in me ur choice. looking for several guys to cum over. in order to be invited and receive my pics guys u must send pics of your body and dick and face to twofivetwo - fivefiveseven- ninesixseveneight. u wont be disappointed. white guys are welcome if ur sexy and have a big cock,ive never had a white cock but I wanna try it. thugs are welcome and bring alone a friend if u wanna gangbang. i wanna meet guys who are fresh outta jail or prison and looking for a nice tite hole to leave full of cum. ill be hosting so im not coming to pick you up","2014-09-15T09:53:14-0400","2014-09-15T09:53:14-0400","0","m4m"
"206","http://eastnc.craigslist.org","ppp","4668827138","http://eastnc.craigslist.org/cas/4668827138.html","4668827138","Sep 15","lets meet","35","cas","casual encounters","kinston","Hi black male looing to meet a sweet down to earth female 
laid back and handsome man with a lot to share just need a true partner race not a issue.","2014-09-15T09:56:51-0400","2014-09-15T09:56:51-0400","0","m4w"
"207","http://eastnc.craigslist.org","ppp","4668827862","http://eastnc.craigslist.org/mis/4668827862.html","4668827862","Sep 15","Looking for a Friend","40","mis","missed connections","Cape Carteret","Hello! 
 My name is John. I'm a white male who enjoys life. I have achieved most all of my goals in life. I am very positive (optimistic) at all times. I enjoy being outside fishing, flying (I'm a pilot), golfing (goofing..lol), walks on the beach, and so much more. But . . ... I enjoy the simple moments snuggling while watching a movie. 
 I'm 5'8, tan skin, 6.5 cock that is shaved (I don't like hair) cut and very clean. I don't drink, smoke or do drugs of ANY kind. I'm disease free. I am professional individual who's not into drama. Hygiene is very important to me. I am looking for a ""WHITE"" (not prejudice, just a preference) friend who I can ease off with from ""time to time"" and enjoy each other. I am new to this and this would only be the 2nd time with another male. I'm versatile and enjoy most anything (holding, kissing, rubbing. . .esc.) I'm open to new ideas. If you are interested, please reply with a pic. If pic is not included in reply, it is trashed, immediately. I cannot host because I am married. I do have another place on the river (about 45 miles from here) we could go. 
 You must be willing to get to know my wife, which will make it easier to get away. There is a chance that ""in time"", she'd want to join in. But for now, just us!!","2014-09-15T09:57:20-0400","2014-09-15T09:57:20-0400","0","m4m"
"208","http://eastnc.craigslist.org","ppp","4668830765","http://eastnc.craigslist.org/m4w/4668830765.html","4668830765","Sep 15","Looking For My Better Half",NA,"m4w","men seeking women","Eastern NC","would love to find that special someone. A good woman that knows how to love and treat a real man. I am a single black man that has his own car, house, etc and would love to find someone to share these things with. If you feel you are that good woman, please don't hesitate to contact me. Hear from you soon.","2014-09-15T09:59:16-0400","2014-09-15T09:59:16-0400","0",NA
"209","http://eastnc.craigslist.org","ppp","4668833709","http://eastnc.craigslist.org/m4m/4668833709.html","4668833709","Sep 15","Looking for a Friend","40","m4m","men seeking men","Cape Carteret","Hello! 
 My name is John. I'm a white male who enjoys life. I have achieved most all of my goals in life. I am very positive (optimistic) at all times. I enjoy being outside fishing, flying (I'm a pilot), golfing (goofing..lol), walks on the beach, and so much more. But . . ... I enjoy the simple moments snuggling while watching a movie. 
 I'm 5'8, tan skin, 6.5 cock that is shaved (I don't like hair) cut and very clean. I don't drink, smoke or do drugs of ANY kind. I'm disease free. I am professional individual who's not into drama. Hygiene is very important to me. I am looking for a ""WHITE"" (not prejudice, just a preference) friend who I can ease off with from ""time to time"" and enjoy each other. I am new to this and this would only be the 2nd time with another male. I'm versatile and enjoy most anything (holding, kissing, rubbing. . .esc.) I'm open to new ideas. If you are interested, please reply with a pic. If pic is not included in reply, it is trashed, immediately. I cannot host because I am married. I do have another place on the river (about 45 miles from here) we could go. 
 You must be willing to get to know my wife, which will make it easier to get away. There is a chance that ""in time"", she'd want to join in. But for now, just us!!","2014-09-15T10:01:09-0400","2014-09-15T10:01:09-0400","0",NA
"210","http://eastnc.craigslist.org","ppp","4668838361","http://eastnc.craigslist.org/cas/4668838361.html","4668838361","Sep 15","Looking for a Friend","40","cas","casual encounters","Cape Carteret","Hello! 
 My name is John. I'm a white male who enjoys life. I have achieved most all of my goals in life. I am very positive (optimistic) at all times. I enjoy being outside fishing, flying (I'm a pilot), golfing (goofing..lol), walks on the beach, and so much more. But . . ... I enjoy the simple moments snuggling while watching a movie. 
 I'm 5'8, tan skin, 6.5 cock that is shaved (I don't like hair) cut and very clean. I don't drink, smoke or do drugs of ANY kind. I'm disease free. I am professional individual who's not into drama. Hygiene is very important to me. I am looking for a ""WHITE"" (not prejudice, just a preference) friend who I can ease off with from ""time to time"" and enjoy each other. I am new to this and this would only be the 2nd time with another male. I'm versatile and enjoy most anything (holding, kissing, rubbing. . .esc.) I'm open to new ideas. If you are interested, please reply with a pic. If pic is not included in reply, it is trashed, immediately. I cannot host because I am married. I do have another place on the river (about 45 miles from here) we could go. 
 You must be willing to get to know my wife, which will make it easier to get away. There is a chance that ""in time"", she'd want to join in. But for now, just us!!","2014-09-15T10:04:10-0400","2014-09-15T10:04:10-0400","0","m4m"
"211","http://eastnc.craigslist.org","ppp","4668843864","http://eastnc.craigslist.org/cas/4668843864.html","4668843864","Sep 15","Jack off and cum in my mouth","46","cas","casual encounters","RM Wilson","Is there anyone that likes to jack off while getting their cock liked and sucked and then coming in my mouth and on my face? I'm looking someone that can meet or I can come to you. I am unable to host. I am not into uncut cocks but thick cut mushroom heads are a plus. I am looking now.","2014-09-15T10:07:42-0400","2014-09-15T10:07:42-0400","0","m4m"
"212","http://eastnc.craigslist.org","ppp","4668858551","http://eastnc.craigslist.org/cas/4668858551.html","4668858551","Sep 15","looking to suck","40","cas","casual encounters","Eastern nc","Looking to play with a man or group of men I'm a white male hwp ddf 7 in cut 40 yrs old can't host but can travel. Be real if you want this to many fakes on here that want to play games. Put wanting to be sucked in the subject box to weed out the fakes and bots looking for white guys only that are hung and hwp ddf as well.","2014-09-15T10:17:06-0400","2014-09-15T10:17:06-0400","0","m4mm"
"213","http://eastnc.craigslist.org","ppp","4668872200","http://eastnc.craigslist.org/cas/4668872200.html","4668872200","Sep 15","suck my dick please","41","cas","casual encounters","rocky mount","mwm, 41, 6', 175lbs, ddf, very clean, smooth shaved balls, nicely trimmed
7.5inch, uncut, thick
I will be naked and hard when the door opens.  You start sucking and suck me until you can't suck anymore.  Then leave with NSA.
looking for man or woman or couple.
age and race not an issue
just be clean
please put HARD as subject to weed out spam","2014-09-15T10:25:14-0400","2014-09-15T10:25:14-0400","0","m4m"
"214","http://eastnc.craigslist.org","ppp","4668873483","http://eastnc.craigslist.org/m4m/4668873483.html","4668873483","Sep 15","Hand Job",NA,"m4m","men seeking men","greenville nc","Do you need a hand job...my hands are soft and ready for the job let me
pleasure you with these hands....lay back and relax","2014-09-15T10:25:59-0400","2014-09-15T16:02:35-0400","0",NA
"215","http://eastnc.craigslist.org","ppp","4668875154","http://eastnc.craigslist.org/cas/4668875154.html","4668875154","Sep 15","Looking to have fun at my place","25","cas","casual encounters","greenville nc","Sup I'm a 25 white male on the DL srt8 acting. I'm 6'2 tall slim body 8ins dick. I'm up for doing just about anything you want to do
 All i'm asking is that you be under 22 do not be chubby. Be in great shape or have a very slim body. And you must be white sorry not into black guys.
Here's a few pics of me.I expect to see your as well or dont even bother","2014-09-15T10:26:59-0400","2014-09-15T10:26:59-0400","2","m4m"
"216","http://eastnc.craigslist.org","ppp","4668878324","http://eastnc.craigslist.org/cas/4668878324.html","4668878324","Sep 15","Rainy Monday, could use some help...",NA,"cas","casual encounters","252","It's raining outside here in the 252 area, would love to be inside something warm! Put ""your location"" in subject to weed out the spam.","2014-09-15T10:28:54-0400","2014-09-15T10:28:54-0400","2","m4w"
"217","http://eastnc.craigslist.org","ppp","4668896143","http://eastnc.craigslist.org/cas/4668896143.html","4668896143","Sep 15","ready and sexy now","22","cas","casual encounters","goldsboro","Looking to meet now
Sexy aa female here
Interested in white guys only
Hosting for a limited time only
Massage ang release welcome
D o n a t I o ns required
Contact toofivtoo 3-to-oh ninatenin7","2014-09-15T10:39:04-0400","2014-09-15T10:39:04-0400","0","w4m"
"218","http://eastnc.craigslist.org","ppp","4668932880","http://eastnc.craigslist.org/cas/4668932880.html","4668932880","Sep 15","looking for a big one!!! 8 plus","26","cas","casual encounters","Washington","White guy here looking for a big one. I'm hwp 6' tall and 33 waist. Hit me up with pics and stats in first email.  Really wanting to find someone with a long one!","2014-09-15T10:59:14-0400","2014-09-15T10:59:14-0400","0","m4m"
"219","http://eastnc.craigslist.org","ppp","4668938131","http://eastnc.craigslist.org/m4m/4668938131.html","4668938131","Sep 15","Visiting Tarboro Briefly Tuesday...","35","m4m","men seeking men","Tarboro","Will be visiting Tarboro briefly Tuesday after lunchtime.  Looking for a HUNG top to please while there after my appointment is taken care of.      If interested, let me know ASAP!!!
Stats:  Thirty-5, 152lbs, athletic build, clean cut oral bottom mixed guy here.   
HMU.... (2five2) nine0eight - one3seven4 with complete stats/pics or email before 11AM TUESDAY morning if you want it.  Don't waste either of our time with one word emails or emails without pics and stats. 
No hang ups here and will consider all...   SERIOUS only need respond!  Must be able to host or know a secluded spot...","2014-09-15T11:01:59-0400","2014-09-15T11:01:59-0400","2",NA
"220","http://eastnc.craigslist.org","ppp","4668951320","http://eastnc.craigslist.org/cas/4668951320.html","4668951320","Sep 15","Lunchtime Head Anyone?",NA,"cas","casual encounters","Havelock Area","Anyone needing some lunchtime head? Blow and go only. Close (3 minutes from MCAS CP). Very discrete. HMU first cum, first served.","2014-09-15T11:09:02-0400","2014-09-15T11:09:02-0400","0","m4m"
"221","http://eastnc.craigslist.org","ppp","4668966936","http://eastnc.craigslist.org/cas/4668966936.html","4668966936","Sep 15","Want to feel the excitement Older Women","40","cas","casual encounters","greenville nc","I am looking to have some nsa fun with a late 50 to 60 year.old stay at home mom or grand mom.. I have always found older wonen extremly sezy. And want to bring all the passion you once had. I want to feel your body quiver as you explode for the first.time in so long...I am a nice looking man who.will send pictures if requested.also discression is a must..I am safe a serious..Lets get together","2014-09-15T11:17:12-0400","2014-09-15T13:43:09-0400","0","m4m"
"222","http://eastnc.craigslist.org","ppp","4668977037","http://eastnc.craigslist.org/rnr/4668977037.html","4668977037","Sep 15","RE:  My BFH!",NA,"rnr","rants & raves",NA,"Geez you are immature. 
I'd rather talk to a five year old, it would be a more meaningful conversation.
You are obviously a fool with all of that BS you posted. 
I won't respond to you again, as you are completely useless and are wasting oxygen.
I do hope you grow up before your kids (if sadly you have any); if you don't have kids, please don't plan on having them. 
We don't need more idiots in the world, you are the best village idiot anyone could have.
Have a nice life and grow up soon TROLL. 
(But I won't be feeding you again.)
Adios, asshole.","2014-09-15T11:22:33-0400","2014-09-15T11:22:33-0400","0","37"
"223","http://eastnc.craigslist.org","ppp","4668978041","http://eastnc.craigslist.org/cas/4668978041.html","4668978041","Sep 15","New to this a man looking another guy for play","45","cas","casual encounters","ENC","New to this a man looking another guy for play. Not sure but I find myself looking at some gay porn and wonder how it would feel if I were to play with a guy. I have looked on CL a couple of times and seem to be concern about guys that seem to play a lot. It would be great if the guy was like me and is interested in trying this out. Lets talk and see what happens between two adult men. Maybe be no older than 58 and white.","2014-09-15T11:23:05-0400","2014-09-15T11:24:55-0400","0","m4m"
"224","http://eastnc.craigslist.org","ppp","4669026633","http://eastnc.craigslist.org/cas/4669026633.html","4669026633","Sep 15","Straight guy for jerk buddy","34","cas","casual encounters","Nash/Edgecombe Rocky Mount","So I'm a straight white guy. The all american average guy you see at the store, at the office or at the bar.   I date girls and don't plan on changing that. 
Which brings me to my search.  I am lookin another straight or bi-cur white guy around my age and in good shape.  Maybe once a week get together, have a few beers and blow a load or two while watching some porn or telling about the hot piece of ass one of us has had the previous weekend.   
I'm picky and am looking a specific kinda guy.  20-40. Masc and considers himself straight or at most bi-cur (no gay men). White only.  No weirdos or fat guys.  You don't have to be a gym guy, but if your waist is more than 36"", you're probably not what I'm looking.  Just being honest.  Married or single doesn't matter.  And be in/near rocky mount and willing to travel to me.  If you're close enough I can come to you some also. 
Pics are something about what I have in mind.  I have some of my own I can share as well. 
Thanks.","2014-09-15T11:47:34-0400","2014-09-15T11:47:34-0400","2","m4m"
"225","http://eastnc.craigslist.org","ppp","4669033419","http://eastnc.craigslist.org/m4w/4669033419.html","4669033419","Sep 15","Single mixed black guy for a single female (White, black, Hispanic)",NA,"m4w","men seeking women",NA,"Hey!
Hope your having a great day!Â 
My name is Daniel but everyone calls me Danny or D. I'm 25, but don't let that push you way since I am very mature for my age since people think I'm 30 (do to my job which I love). College graduate, I have two jobs, and my own car.
I love to try new things in life and will like to spend some quality time with a woman that looking for same things as I am :)
Email me back with a little bit about yourself and a pic or two.
I'm 25, 6ft tall not long lol, average built and the rest is for your eye's to see. I'm goofy, sarcastic, understanding, and caring.Â 
If you have kids it's cool since I work with kids also. A believe a women should not be misjudged do to having a child but rather more appreciated for having one...that just my two sentences.Â 
Age is not an issue either...
-D.","2014-09-15T11:50:56-0400","2014-09-15T11:50:56-0400","2","."
"226","http://eastnc.craigslist.org","ppp","4669049983","http://eastnc.craigslist.org/cas/4669049983.html","4669049983","Sep 15",".....And ACTION","24","cas","casual encounters","Greenville nc","Hey guys, regular kid here wanting some fun. I'm only looking for a guy that's clean and safe to make out with, suck on his nipples, and to RIM. And of course, hott sex. I'm a top here, HIV neg and ddf. You MUST be HIV neg and ddf. I can't host :( but I can travel :). I hope you're interested. If so, put ""Action"" in the subject to know you're real. I have more pics and stats to share. Let's have some fun.","2014-09-15T11:59:09-0400","2014-09-15T11:59:09-0400","0","m4m"
"227","http://eastnc.craigslist.org","ppp","4669069722","http://eastnc.craigslist.org/mis/4669069722.html","4669069722","Sep 15","Best Buy",NA,"mis","missed connections","morehead city","You came in last night looking so beautiful in that dress. We locked eyes for more than a quick second. If it was more than just a look let me know. Reply back with the color of your dress so I know it's you.","2014-09-15T12:08:50-0400","2014-09-15T12:08:50-0400","0","m4w"
"228","http://eastnc.craigslist.org","ppp","4669076460","http://eastnc.craigslist.org/cas/4669076460.html","4669076460","Sep 15","White looking for black","49","cas","casual encounters","Newport","I am a mwm . I am looking a black lady to have as a a friend and playmate.i have never been with a black lady and want to experience it.would like a long time friendship.its ok if you are married we can keep it quiet. Wive knows and is all for me doing this .please be clean as we are clean shaved or trimmed close preferred .Let us know if you have any questions!","2014-09-15T12:12:10-0400","2014-09-15T12:12:10-0400","0","m4w"
"229","http://eastnc.craigslist.org","ppp","4669122157","http://eastnc.craigslist.org/cas/4669122157.html","4669122157","Sep 15","We Need Your Thoughts",NA,"cas","casual encounters","East carolina","Researchers from UNC-Chapel Hill are recruiting participants for an online survey. The goal is to learn more about what some young people think about HIV testing. You may be eligible if you're over age 18, speak English, and have access to the Internet from a computer or a smartphone. All eligible participants who complete the survey will receive a gift card.
For more information, please visit the survey website here: bit [dot] ly [slash] 1gyrEdj","2014-09-15T12:34:29-0400","2014-09-15T12:34:29-0400","0","m4m"
"230","http://eastnc.craigslist.org","ppp","4669133887","http://eastnc.craigslist.org/cas/4669133887.html","4669133887","Sep 15","Regular FWB","35","cas","casual encounters","Goldsboro","Hello, interested in a regular fuck buddy?
Looking for a very discreet sex relationship, if you are already in a relationship that's fine I'm not looking to harm that, just passion and fun!!
I'm good looking and very discreet 
If interested write back, and pics sent will get a pic reply
I'm real today is sept. 15","2014-09-15T12:40:11-0400","2014-09-15T12:40:11-0400","0","m4w"
"231","http://eastnc.craigslist.org","ppp","4669146052","http://eastnc.craigslist.org/cas/4669146052.html","4669146052","Sep 15","Hosting tonight","51","cas","casual encounters","Washington","I'm looking for a bottom tonight. Looking for clean and DDF. Race is not an issue. Would like a well hung friend. Just like to stroke it while I Top.
HWP Latino male. Athletic, clean, well trimmed and clean shaven.
Real here. Not looking for pics but there must be an attraction. I like Twinks and chubs. Feminine is nice as well as masculine. 
Discreet and only play safe.
Contact me for more info...","2014-09-15T12:46:09-0400","2014-09-15T12:46:09-0400","0","m4m"
