"","cityurl","subcl","post_id","post_link","post_data_id","post_date_raw","post_title","post_price","post_subcl","post_subcltype","post_loc","post_text","post_date","post_last_update","post_pics","post_type"
"432","http://eastnc.craigslist.org","ppp","4663774151","http://eastnc.craigslist.org/cas/4663774151.html","4663774151","Sep 11","40 SWM LOOKING A FWB","40","cas","casual encounters","Greenville","Hi ladies I am a 40 SWM that is looking for FWB only, not looking for a relationship right now. I am very down to earth not looking for drama or any bullshit and I am not bringing any drama or bullshit too. I do live alone I can host at my home most of the time. I am DD and Drug free, any ladies interested please contact me I can provide a face pic if as long as you provide one too.","2014-09-11T19:20:53-0400","2014-09-11T19:20:53-0400"," 0","m4w"
"433","http://eastnc.craigslist.org","ppp","4663791335","http://eastnc.craigslist.org/cas/4663791335.html","4663791335","Sep 11","Hung?",NA,"cas","casual encounters","enc","Professional M/F couple would like to find a playmate for the wife.  Would prefer you to be respectably endowed, DDF, professional, clean, white, 30-50, hwp and comfortable having sex with the wife in front of the husband.  This not a 3-way situation - he would just be in the room at times.  She is screening replies.  Yes this is very real - lot of rain is getting ready hit the area.  Please put your location in the subject line.  Thanks for reading!","2014-09-11T19:33:21-0400","2014-09-11T19:33:21-0400"," 0","mw4m"
"434","http://eastnc.craigslist.org","ppp","4663805857","http://eastnc.craigslist.org/cas/4663805857.html","4663805857","Sep 11","here in goldsboro,nc tonight i can host","46","cas","casual encounters","goldsboro","46   8inches no stds looking for a ladie that knows how to be a whore in the bed  couples welcum","2014-09-11T19:44:08-0400","2014-09-11T19:44:08-0400"," 2","m4w"
"435","http://eastnc.craigslist.org","ppp","4663814787","http://eastnc.craigslist.org/cas/4663814787.html","4663814787","Sep 11","Searching",NA,"cas","casual encounters","Greenville","Looking to get a quick blow. Don't have much time. Would like to find a FWB in the area","2014-09-11T19:50:58-0400","2014-09-11T19:50:59-0400"," 0","m4w"
"436","http://eastnc.craigslist.org","ppp","4663823379","http://eastnc.craigslist.org/cas/4663823379.html","4663823379","Sep 11","Eating your creampie or sucking some cock","46","cas","casual encounters","Eastern NC Rocky Mount Wilson","I am a married white male that is looking for a couple that is interested in letting me eat her cream pie. I would really enjoy eating some pussy after being fucked or suck a mushroom cut cock. I am a clean cut, discreet, attractive 46 male that is ddf. Please let me know if interested and I can send a pic. I can not host but willing to come to you or meet. Looking now or as long as posting is avaIible","2014-09-11T19:57:20-0400","2014-09-11T19:57:20-0400"," 0","m4w"
"437","http://eastnc.craigslist.org","ppp","4663824813","http://eastnc.craigslist.org/cas/4663824813.html","4663824813","Sep 11","Jacuzzi Blow Job","48","cas","casual encounters","Morehead area","Hey guys!  Looking for a nice young white dude that would like to come over and relax in the jacuzzi with a couple drinks tonight and get an awesome blow job as well...Recip not required, but welcomed if you would like to... I am a white guy, very fit, masculine, clean cut, discreet, clean, d'd free...Friendly, easy going, caring, and considerate type guy with no bs or games... If interested, hit me back with stats and pic so I know you are not spam... I have a very private and discreet place to host, or will come to you if not too far...","2014-09-11T19:58:28-0400","2014-09-11T19:58:28-0400"," 0","m4m"
"438","http://eastnc.craigslist.org","ppp","4663827324","http://eastnc.craigslist.org/cas/4663827324.html","4663827324","Sep 11","vers student seeking fun tonight or this weekend","21","cas","casual encounters","greenville nc","I am bored and horny. Just seeing whats out there. You must be clean and somewhat attractive.  Im white, vers, in shape and smooth. Reply if u are interested with stats and a body pic if you want one back. I most likely cant host","2014-09-11T20:00:18-0400","2014-09-11T20:00:18-0400"," 0","m4m"
"439","http://eastnc.craigslist.org","ppp","4663843379","http://eastnc.craigslist.org/cas/4663843379.html","4663843379","Sep 11","DESCRETE AFFAIR WANTED",NA,"cas","casual encounters","lake gaston area, littleton","any legal age is ok,petite to medium build, regular visits, can meet at any safe location,can pick you up but prefer that are mobile,i am ddf hiv neg no drama, no bs , do not want to change your current situation,just give you what your missing at home. school soon, i wont let you be bored,hmu change the subject line to 69, so i know your real, my home is very private","2014-09-11T20:12:44-0400","2014-09-11T20:12:44-0400"," 0","m4w"
"440","http://eastnc.craigslist.org","ppp","4663853064","http://eastnc.craigslist.org/cas/4663853064.html","4663853064","Sep 11","come fwm im vers",NA,"cas","casual encounters","clinton","Supp I'm clean STD and attractive if interested you must be STD free im verse and I know some tricks so hmu serious guys only","2014-09-11T20:20:14-0400","2014-09-11T20:20:14-0400"," 0","m4m"
"441","http://eastnc.craigslist.org","ppp","4663853913","http://eastnc.craigslist.org/cas/4663853913.html","4663853913","Sep 11","Mutual Jo",NA,"cas","casual encounters",NA,"Please read this fully. Alot of people keep asking me what im looking when i explain it fully here. I understand some people want more than just to jo. At this time that's all im looking for so please only reply if your kool with this also. So as long as you slim, under 30 and std free hit me up. kik id atlboi30132
          ****************Mutual Jo with Masc Guys Only*******************","2014-09-11T20:20:52-0400","2014-09-11T20:20:52-0400"," 2","m4m"
"442","http://eastnc.craigslist.org","ppp","4663859995","http://eastnc.craigslist.org/cas/4663859995.html","4663859995","Sep 11","Eat your ass","24","cas","casual encounters",NA,"Let me eat your ass until you are fully satisfy am std free and drug free, send pic of who am going to be eating, I'll reply back as soon as I get your email, everything is discrete","2014-09-11T20:25:32-0400","2014-09-11T20:25:32-0400"," 0","m4w"
"443","http://eastnc.craigslist.org","ppp","4663862985","http://eastnc.craigslist.org/cas/4663862985.html","4663862985","Sep 11","Got a sausage for me tonight?","29","cas","casual encounters","Morehead Beaufort Havelock on 101","Looking to suck some cock be under 35 ddf masculine white or hispanic. You must host unless you want to travel to me.  To know your real put ""Thursday"" on subject line.  If ad is up I'm still looking","2014-09-11T20:27:48-0400","2014-09-11T20:27:48-0400"," 0","m4m"
"444","http://eastnc.craigslist.org","ppp","4663878845","http://eastnc.craigslist.org/w4m/4663878845.html","4663878845","Sep 11","Big beautiful woman needs a real man!!","35","w4m","women seeking men","new bern nc","I am looking for a real man that knows how to treat a woman. And is ready for a real relationship. 
  Not a hook up, a friend with benfits, or a one night stand. If thats what you want dont waste your breath. 
 I have a busy schedule thats the only reason why im here. Dont go to bars, or have alot of time to waste looking for all the wrong guys. I have kids and I have them fulltime so I can only get out on the weekends  usually so if that foesnt work for you im sorry. I am not the one for you. 
 I hope there are some good guys that do search these ads because im tired of the liers on the dating sites saying there looking for something serious and just want a hook up. 
 If you think this is you please message me and lets talk..","2014-09-11T20:40:14-0400","2014-09-11T20:42:17-0400"," 0","w4m"
"445","http://eastnc.craigslist.org","ppp","4663887208","http://eastnc.craigslist.org/cas/4663887208.html","4663887208","Sep 11","wanna come and chill😉😉",NA,"cas","casual encounters",NA,"Searhing for a gay or bi male that would love to come over and have some fun:) no older then 42 and have to be clean n shaved.
My husband 37  bi curious 5""9 160pound mixed white n philipino n 7"" cock.. he is a top but trying to talk him into trying bottom. I will b involved only with my husband... also looking for someone to have a small dick. No mre then 6 inches.... 
ur pics gets his","2014-09-11T20:46:50-0400","2014-09-11T23:41:56-0400"," 0","mw4m"
"446","http://eastnc.craigslist.org","ppp","4663889437","http://eastnc.craigslist.org/cas/4663889437.html","4663889437","Sep 11","nice cock for a fat ass","40","cas","casual encounters","Wilson","Like is says. So woman... man... or cpl. That wants a nice cock to fuck them hmu. Have no time for email tag. I have lube  just need your hole...","2014-09-11T20:48:39-0400","2014-09-11T20:48:39-0400"," 0","m4w"
"447","http://eastnc.craigslist.org","ppp","4663898507","http://eastnc.craigslist.org/cas/4663898507.html","4663898507","Sep 11","idk","21","cas","casual encounters","greenville","I have no idea why I'm doing this, gf back home is a huge bitch, just want someone else to talk to maybe chill with I'm very sane and not a creep haha 21 white student at pitt","2014-09-11T20:56:01-0400","2014-09-11T20:56:01-0400"," 0","m4w"
"448","http://eastnc.craigslist.org","ppp","4663899172","http://eastnc.craigslist.org/cas/4663899172.html","4663899172","Sep 11","discreet bi pirate iso host","23","cas","casual encounters","ecu/Greenville","hi bisexual pirate here. in search of the right partner for tonight. my ideal would be someone crazy sexy and cool. I'm open to lots of things just reply with a picture of your junk and I'll get back to you with mine and we can take it from there. if you have any questions please feel free to ask. vgl masc here expect the same.","2014-09-11T20:56:33-0400","2014-09-11T20:56:33-0400"," 0","m4m"
"449","http://eastnc.craigslist.org","ppp","4663902220","http://eastnc.craigslist.org/cas/4663902220.html","4663902220","Sep 11","Love to Give Oral...","37","cas","casual encounters","Goldsboro","Hello all, I am 37 white male from Goldsboro, disease and drug free.  I love to give oral to woman and I believe in taking my time and making sure they cum; looking the same in return.  I am 5'8"" and have some meat on my bones, but not enough to get in the way.  Drop me a line if your interested in a good licking.....","2014-09-11T20:58:59-0400","2014-09-11T20:58:59-0400"," 0","m4w"
"450","http://eastnc.craigslist.org","ppp","4663938835","http://eastnc.craigslist.org/cas/4663938835.html","4663938835","Sep 11","Tired of dating","35","cas","casual encounters","Jacksonville","Tired of dating...  So many shady women out there.  I am a looking for a FWB situation with a female.  I am a decent, attractive white male.  I am just tired of trying to find that ""one"" and want to take a break for a long while.  My only problem is that I have a huge sexual appetite.  I do not want to jump right in bed, I would like to meet you and get to know you a little.  Maybe this can turn into a friendship.  We will see.
If you are interested, then please shoot me a reply and we can exchange photos.
Thanks for reading.","2014-09-11T21:30:13-0400","2014-09-11T21:30:13-0400"," 0","m4w"
"451","http://eastnc.craigslist.org","ppp","4663945509","http://eastnc.craigslist.org/cas/4663945509.html","4663945509","Sep 11","Any Straight Guys around town NSA wanting there cock sucked","25","cas","casual encounters","greenville nc","Hey im just throwing this post out there im a bi male looking to see if there are any Curious straight guys down for coming over jk off watching straight porn and if u are down I will blow u. You dont have to do anything to me. Im only looking white guys with decent bodys and im very discreet so hit me up and lets get up. If this add is up im still looking im horny come on any straight guys out there and ready","2014-09-11T21:35:59-0400","2014-09-11T21:35:59-0400"," 0","m4m"
"452","http://eastnc.craigslist.org","ppp","4663947222","http://eastnc.craigslist.org/cas/4663947222.html","4663947222","Sep 11","Straight guy looking for a bj","24","cas","casual encounters","Hubert","Hello first off I am very real. I am a straight guy looking for a nice blow job maybe more...my wife really wants to watch this happen and I want it as well. I am looking for a white guy that is fit or skinny","2014-09-11T21:37:26-0400","2014-09-11T21:37:26-0400"," 0","m4m"
"453","http://eastnc.craigslist.org","ppp","4663949195","http://eastnc.craigslist.org/m4m/4663949195.html","4663949195","Sep 11","Cocksucker Resume",NA,"m4m","men seeking men","Rocky Mount","Career Profile
Very skilled cocksucker with over 15 years of experience developing a unique blend of skill and technique in the art of fellatio. Recognized for ability to enhance oral pleasure, enhance quality, and increase erotic arousal. Sucked off a variety of different men in semi-public and private locations. Have given head on the road, in parks, in public restrooms, in high and low class hotels and in the comfort of my home and the home of other men. Provided a very enjoyable service with total discreteness to married men and men in relationships with women. I enjoy having my limits pushed and strive to stretch my skill limits.
Key strengths include:
Edging
Deep throat
Quickie (when needed)
Marathon blowjobs (when desired)
Good hand action
Interpret reactions based on stimulation
Dedicated swallower
Oral Philosophy
In today's competitive world, the best way to ensure oral sex success is to delight the guy or guys that you are sucking off. Today's men and tomorrow's  want eagerness, dedication to their pleasure and high quality head. If a cocksucker does not meet or exceed the guys needs, their competition will.
It's no longer enough for cocksuckers to simply ""embrace"" change: continuous improvement must become a way of giving blowjobs, where cocksuckers actively seek improvements and where desires, skills and technique support and drive better oral stimulation. Trust is the key. The fellatio environment must be such that people suck dick without fear, within a culture that encourages pride in both personal and cock-sucking accomplishments. Fist encounters can be stressing on the part of a first time feeder. I try to deploy a feel of safety while strive to build on the first time experience of the situation at hand.
Examples of Accomplishments
Blowjob improvement
I have worked very hard to develop deep throating skills. I have sucked some rather large cocks and have been know to take over 9 inches all the way to the nuts.
I have strived to improve my skills by reading the reactions of the men that I provide oral pleasure to. This is an effort to give them the service they desire and need. This enhances their oral experience.
Very skilled at screening guys for potential hook-ups so that the oral exchange starts off on the right foot. This helps to insure a better blowjob and happy sucker and feeder relationship","2014-09-11T21:39:11-0400","2014-09-11T21:39:11-0400"," 0",NA
"454","http://eastnc.craigslist.org","ppp","4663949356","http://eastnc.craigslist.org/m4m/4663949356.html","4663949356","Sep 11","MWM looking fuck buddy","50","m4m","men seeking men","Pitt County","I am a mwm looking a fuck buddy to help add some excitement.  I am 5'7"", 225lbs, 6"" cut.  I like mutual oral and someone that can top and bottom.  I would prefer someone that can be a regular playmate but I am pretty horny right now so open to all offers.  I prefer wm's, age is not important but you must be HWP.  Put buddy in the subject line and include a pic.","2014-09-11T21:39:19-0400","2014-09-11T21:39:19-0400"," 0",NA
"455","http://eastnc.craigslist.org","ppp","4663968399","http://eastnc.craigslist.org/cas/4663968399.html","4663968399","Sep 11","Looking For A College Dude in Need of a Daddy","52","cas","casual encounters","MHC JAX NB area","Hey guys...I am looking for a really nice white college age guy that would be interested in a dad/son relationship in which you help me and I help you....I am a wm, nice looking, clean, masculine, discreet, clean-cut, fit, HWP..6'2 185. I am college educated, financially stable, very casual and laid back...Easy going, kind, considerate, caring, and giving type guy with no bs, drama, or games.. If this is something that you might be interested in, then hit me back with stats, location, and pic and let's talk about it and see if we can work out something that would be good for us both...I can host or come to you.  .I do have pics to trade, but do not post here, as I am not out and super discreet....Hope to hear from you!!","2014-09-11T21:56:24-0400","2014-09-11T21:56:25-0400"," 0","m4m"
"456","http://eastnc.craigslist.org","ppp","4663977383","http://eastnc.craigslist.org/cas/4663977383.html","4663977383","Sep 11","looking for nsa friend","21","cas","casual encounters","wilson/rocky mount","Hey. Im a 21 year old college male looking for fwb. Age, race, size doesn't matter to me. Im in all girls, big or small.  I am very respectful and sweet. I like to have fun and I dont pressure girls to do things they dont want.  I can host. I am clean, in ok shape and good looking. Hit me up.","2014-09-11T22:04:27-0400","2014-09-11T22:04:27-0400"," 0","m4w"
"457","http://eastnc.craigslist.org","ppp","4663979555","http://eastnc.craigslist.org/cas/4663979555.html","4663979555","Sep 11","Theropy","37","cas","casual encounters","Goldsboro","I have a funny but serious request. I've been told by a couple women that I'm a terrible lay. I've asked why and get dismissed. I'm not sure if it's the technique or my equipment lol. Listen, I'd like a little direction. Even willing to pay. Let's call it sex theropy. Someone lay me and school me. Be patient and give me some good advice. I don't care what you look like or how old you are as long as you are assertive enough to say""look dude, you're doing it wrong! Do it this way."" Anyone willing to take on a student?  I am 37, white, fit, military, clean and healthy.","2014-09-11T22:06:29-0400","2014-09-11T22:06:29-0400"," 0","m4w"
"458","http://eastnc.craigslist.org","ppp","4663979573","http://eastnc.craigslist.org/cas/4663979573.html","4663979573","Sep 11","Top daddy looking for a new younger boy!",NA,"cas","casual encounters","gville,grftn,adn,etc","Daddy type looking for a younger guy no older than twenty two! I like white and latino skinny to average size twink and emo type boys! Im in my thirties, tall, med body hair, shaved cock. Pretty well hung! Im clean and disease free, you be too!!!!!! 4:20 friendly is a huge plus but not a deal breaker! Im a top, but do switch it up often, i am oral especially if your shaved! I can host! Must be super discreet! Would love to find the right boy to keep around for awhile! And if you have a friend i would be interested in two, never tried.So please be clean and attractive, not to big, except your cock:) Put ""SON"" in subject to weed out spam! And please send a body/cock pic with first msg! I will not send a pic first!","2014-09-11T22:06:30-0400","2014-09-11T22:06:30-0400"," 0","m4m"
"459","http://eastnc.craigslist.org","ppp","4663983164","http://eastnc.craigslist.org/cas/4663983164.html","4663983164","Sep 11","Need a White BBW","39","cas","casual encounters","Grifton/Gvegas/Ayden","I am a 39 yr old, handsome drug and disease free black man. I am looking for a white BBW....the bigger the better for NSA sex. I am 6' 267lbs.......7.5""c with a Mushroom shaped head. Great sex drive......love to please orally....would like a big woman that is looking for sex and maybe become a regular thing. I am looking in the Grifton, Greenville, Ayden area. I have pics upon request.","2014-09-11T22:09:48-0400","2014-09-11T22:11:42-0400"," 0","m4w"
"460","http://eastnc.craigslist.org","ppp","4663985628","http://eastnc.craigslist.org/cas/4663985628.html","4663985628","Sep 11","Lets Meet Up",NA,"cas","casual encounters",NA,"I am a young college girl. 19. Caramel skin tone. Silky hair
 Pretty brown eyes. Biracial. Looking to meet up with a nice guy. No one over 42 years of age please. Please be disease free. I would like to see papers if we're not using protection
. I do like to be spoiled. I'm very energetic so going on and on is not a problem. Race doesn't matter. Please be packing down there. Married is fine. Email me a picture your name age and number I will return the same thing. Looking forward to hearing from you","2014-09-11T22:12:03-0400","2014-09-11T22:12:03-0400"," 0","w4m"
"461","http://eastnc.craigslist.org","ppp","4663987771","http://eastnc.craigslist.org/m4w/4663987771.html","4663987771","Sep 11","Big white booty","34","m4w","men seeking women","Enc","Let's keep this simple! I'm looking for women with an ample backside and a creative imagination.
I do have pics and so should you. Please be ddf as well!","2014-09-11T22:14:00-0400","2014-09-11T22:14:00-0400"," 0",NA
"462","http://eastnc.craigslist.org","ppp","4663988793","http://eastnc.craigslist.org/cas/4663988793.html","4663988793","Sep 11","Rim Jobs","33","cas","casual encounters","enc","Any women in eastern NC looking for a good rim job?
All shapes, sizes, and races welcome.
Must be DDF!!! No exceptions...","2014-09-11T22:14:59-0400","2014-09-11T22:14:59-0400"," 0","m4w"
"463","http://eastnc.craigslist.org","ppp","4663993934","http://eastnc.craigslist.org/cas/4663993934.html","4663993934","Sep 11","Suffolk county bbc","25","cas","casual encounters","Suffolk county li","I'm a 25 year old black male looking for casual NSA sex. I'm home from the military and want to release tension . I wanna cut out all the bullshit and get straight to the point, hopefully I can find that here. I'm muscular handsome 5""7. I drive but cannot host. I'm DDF also. If interested shoot me a message with a pic and we will work the details out. I have plenty of pics just ask","2014-09-11T22:19:47-0400","2014-09-11T22:19:47-0400"," 0","m4w"
"464","http://eastnc.craigslist.org","ppp","4663999991","http://eastnc.craigslist.org/cas/4663999991.html","4663999991","Sep 11","Want to give head to older man with big package",NA,"cas","casual encounters","ENC","I'm a chubby hairy guy. I am turned on by white, Hispanic or Native American men my age (40's) up to about 70 with 7"" or more. That age can change depending on the man. I love hairy, funny, manly, regular guys. You must be a take charge kind of guy. Send replies with ""cream"" in the subject line and a body pic or dick pic. Hoping to meat someone this weekend. DDF here, you be, too. First two pics are types I like. Third one is a fantasy.","2014-09-11T22:25:35-0400","2014-09-11T22:44:23-0400"," 3","m4m"
"465","http://eastnc.craigslist.org","ppp","4664006999","http://eastnc.craigslist.org/cas/4664006999.html","4664006999","Sep 11","Gloryhole fuck",NA,"cas","casual encounters","W. Wilson","Fuck me thru my private gloryhole. Be white and under 45.  Looking now. Be clean and hwp. Love giving bj too","2014-09-11T22:32:20-0400","2014-09-11T22:32:20-0400"," 0","m4m"
"466","http://eastnc.craigslist.org","ppp","4664014059","http://eastnc.craigslist.org/cas/4664014059.html","4664014059","Sep 11","looking 4 older w BIG white dick",NA,"cas","casual encounters","greenville","I am 45 wm. I want to suck off a big white dick. That's it. So, don't ask what I'm into. Two five 2 three two O and three one 14.  Make it happen....soon would be nice.no playing, pvt and ready now.","2014-09-11T22:39:12-0400","2014-09-11T22:39:12-0400"," 0","m4m"
"467","http://eastnc.craigslist.org","ppp","4664018647","http://eastnc.craigslist.org/cas/4664018647.html","4664018647","Sep 11","Need m2m tonight","46","cas","casual encounters","Kinston Hotel","Looking for a clean cut discrete ddf male for a suck session tonight.  Want you to come into my room, strip, tell me you like to suck cock, lay on the bed on your back and head at the foot of bed, I feed you my cock and go from there.  Hope you can make me come more than once.  I am 5'7"" tall, white, 200#,7.5"" cut cock.  If interested, let me know ASAP.","2014-09-11T22:43:51-0400","2014-09-11T22:43:51-0400"," 0","m4m"
"468","http://eastnc.craigslist.org","ppp","4664018686","http://eastnc.craigslist.org/cas/4664018686.html","4664018686","Sep 11","Isn't there at least one out there...","30","cas","casual encounters",NA,"...ladies...I see your posts on ""dating"" sites, and y'all be hatin'!  Doesn't anyone wanna have a real, casual conversation with a REAL human-being?  Start with breaking the ice...what's the harm in talking, sometimes it leads other opportunities.
Send a face pic and I will reply in kind.","2014-09-11T22:43:54-0400","2014-09-11T22:43:54-0400"," 0","m4w"
"469","http://eastnc.craigslist.org","ppp","4664019618","http://eastnc.craigslist.org/cas/4664019618.html","4664019618","Sep 11","Give me a call and listen to me masturbate!","41","cas","casual encounters","Eastern NC","Just as the title says, this is what I will be masturbating with. I will be VERY detailed, I will tell you how it feels, what I am stroking to, and what I'm thinking of. The number is.....Nine one nine-seven zero nine-nine five eight five.....Hope to masturbate for you.","2014-09-11T22:44:48-0400","2014-09-11T22:44:48-0400"," 0","m4w"
"470","http://eastnc.craigslist.org","ppp","4664022713","http://eastnc.craigslist.org/cas/4664022713.html","4664022713","Sep 11","Ready & willing for my ""MATURE"" friend","28","cas","casual encounters",NA,"Looking for NSA with a 40+ sexy, handsome 'MATURE"" man that wants to have some fun.  2 things I want....to taste my sweet wetness & to slide his hard, throbbing dick inside slow at first then pound me until I explode.  Now if you think you can do this, email FACE PIC along with age!!!!","2014-09-11T22:47:53-0400","2014-09-11T22:47:53-0400"," 0","w4m"
