"","cityurl","subcl","post_id","post_link","post_data_id","post_date_raw","post_title","post_price","post_subcl","post_subcltype","post_loc","post_text","post_date","post_last_update","post_pics","post_type"
"203","http://harrisburg.craigslist.org","ppp","4669029724","http://harrisburg.craigslist.org/m4w/4669029724.html","4669029724","Sep 15","can u roll and play female",NA,"m4w","men seeking women","harrisburg","lets chill while u roll and blaze and we chill and get it in!!Downtown hbg love having safe fun!!!!!!!!!!!!","2014-09-15T11:49:04-0400","2014-09-15T11:49:04-0400","0",NA
"204","http://harrisburg.craigslist.org","ppp","4669029769","http://harrisburg.craigslist.org/mis/4669029769.html","4669029769","Sep 15","Cropf Brothers Plumbing...tools never looked so sexy",NA,"mis","missed connections","west shore","Just had some guys from cropf brothers come look at the old pipes.  I was amazed at the service provided.  Gone are the days of dirty old plumbers...hello clean, courteous, and thorough.  Not to mention, a few cracks I wouldn't mind seeing.  If this is the type of service I can expect, I may have to find some things to break.","2014-09-15T11:49:05-0400","2014-09-15T11:49:05-0400","0","m4m"
"205","http://harrisburg.craigslist.org","ppp","4669034214","http://harrisburg.craigslist.org/cas/4669034214.html","4669034214","Sep 15","BJ and More for Monday","34","cas","casual encounters","Hummelstown","Vers/Bottom guy looking for some fun today.  Love oral, bottom, flip flop, anything fun.  five foot ten 158 lbs.  WM. Very discrete, DDF please be also.  Hit me up and let have some fun .  Younger to the front but like to play with any hot cocks.  Pic for trade.","2014-09-15T11:51:20-0400","2014-09-15T11:51:20-0400","0","m4m"
"206","http://harrisburg.craigslist.org","ppp","4669046043","http://harrisburg.craigslist.org/cas/4669046043.html","4669046043","Sep 15","Want to cum in a girl so bad","22","cas","casual encounters","Hershey","Hey, I'm looking for a girl to give a creampie. I never cummed in a girl and have a 4 day load I would love to release inside of you. Please be dd free and send a pic.","2014-09-15T11:57:10-0400","2014-09-15T11:57:10-0400","0","m4w"
"207","http://harrisburg.craigslist.org","ppp","4669047338","http://harrisburg.craigslist.org/cas/4669047338.html","4669047338","Sep 15","Want a younger girl for fwb","22","cas","casual encounters","17078","Looking for a younger girl prefer under 30 for a fwb. I'm 175 slender build with 6.5 inch dick. I'm looking for an 717 ongoing thing and 460also open to couples. Also never been with a girl that is hairy down there and 6614would love to experience it.","2014-09-15T11:57:50-0400","2014-09-15T11:57:50-0400","0","m4w"
"208","http://harrisburg.craigslist.org","ppp","4669053526","http://harrisburg.craigslist.org/cas/4669053526.html","4669053526","Sep 15","Married men only",NA,"cas","casual encounters","Harrisburg","I want to give NSA oral service to married guys who are not getting it at home for whatever reason. I am discreet, private, clean and have a comfortable place to host. You would experience a total and complete relaxation time with no recip expected from you at all, so do not respond if you want to reciprocate. 
Me:  divorced, white, 47 yo guy, HWP, 6'1"", 180#, brown hair, blue eyes, trimmed beard, clean, safe, sane, disease free, handsome type, masculine (not fem) and educated. 
You:  married, HWP (some belly but no obese), 30 - 55 (exceptions with pic and able to maintain hard erection), clean, sane, safe with no STD's. 
Please reply with real stats. Pics are appreciated but not required. However, your pic gets mine.  Put ""M4M"" in subject. Please be real. I'm not looking for game players or endless emails. Let's not waste each other's time. (Just keeping it real). 
I would love to meet a few married guys for regular one on one sessions. I give nice long and slow head or eager blow n go's. You decide. I hope to hear from you and make some good times happen.","2014-09-15T12:00:56-0400","2014-09-15T16:02:32-0400","0","m4m"
"209","http://harrisburg.craigslist.org","ppp","4669057861","http://harrisburg.craigslist.org/cas/4669057861.html","4669057861","Sep 15","Mouthwartering, Ready To Melt In You're Mouth. Yours or Mines","25","cas","casual encounters","Eisenhower Blvd.","Come Spend Sometime With Me.
 I Love All Types Of Freaks.
 Remember You Have To Be Generous,
 The More The Better.","2014-09-15T12:03:05-0400","2014-09-15T12:03:05-0400","4","t4m"
"210","http://harrisburg.craigslist.org","ppp","4669062761","http://harrisburg.craigslist.org/cas/4669062761.html","4669062761","Sep 15","seekin","37","cas","casual encounters","east shore","Hello im seekin a cute young female for a s daddy/fwb arrangement...lookin 18-35 yrs old...if interested email me a few pics and well go from there","2014-09-15T12:05:31-0400","2014-09-15T12:05:31-0400","0","m4w"
"211","http://harrisburg.craigslist.org","ppp","4669076321","http://harrisburg.craigslist.org/cas/4669076321.html","4669076321","Sep 15","want a new experience?","46","cas","casual encounters","harrisburg","Looking for someone who has thought about trying anal sex but never has.
I am experienced, gentle and want to make your first time easy.
Clean, ddf and discreet","2014-09-15T12:12:06-0400","2014-09-15T12:12:06-0400","0","m4w"
"212","http://harrisburg.craigslist.org","ppp","4669078970","http://harrisburg.craigslist.org/cas/4669078970.html","4669078970","Sep 15","Why not have some fun ?","20","cas","casual encounters","harrisburg","I'm a Caucasian male I stand 6'6"" and I love to have a good time. I am looking for something like a fwb to hangout with and meet up with 1 time thing is fine too. I am very low key and have no drama I am looking for a no emotions fun time and would love to get know any1 who wants to chat. I have pics for trade there is no age limit except you must b 18+. Email me for some fun. Ill be waiting (; or 717 you can 450 txt me 7747 for quick response (:","2014-09-15T12:13:27-0400","2014-09-15T12:13:27-0400","0","m4w"
"213","http://harrisburg.craigslist.org","ppp","4669095434","http://harrisburg.craigslist.org/cas/4669095434.html","4669095434","Sep 15","Looking for a fun young couple","22","cas","casual encounters",NA,"Looking for a fun couple prefer between 18-35. I'm into trying anything and never had a 3some before. I'm 175 slender build 6.5 cut dick. I havnt cummed in over a week so717 should be460 a huge 6614 load. Please send a few pics or text.","2014-09-15T12:21:25-0400","2014-09-15T12:21:25-0400","0","m4w"
"214","http://harrisburg.craigslist.org","ppp","4669096240","http://harrisburg.craigslist.org/cas/4669096240.html","4669096240","Sep 15","Could your cock use some attention?",NA,"cas","casual encounters","Harrisburg, Kline Village","I just love cocks...would like to play with yours. Suck it and make it spit! I can host, just let me know your age, cock size, heightand weight and when your free to play!","2014-09-15T12:21:49-0400","2014-09-15T12:21:49-0400","0","m4m"
"215","http://harrisburg.craigslist.org","ppp","4669096817","http://harrisburg.craigslist.org/cas/4669096817.html","4669096817","Sep 15","Looking for first female experience or to be your pillow princess","40","cas","casual encounters","17110","Hi! Looking for my first girl experience. Would prefer ages 30-45 as I am 40. Husband will not be included at all. Willing to travel or meet 1/2 way to meet in person. Need to have an attraction. More about me when you send face pic or at least a body pic w/o face. I enjoy shopping, wineries, traveling, movies, and boating. I would consider myself more of a girlie type, as I like to get dressed up/wear heals/make up and go out dancing or to the casino. Plz put your favorite color in subject line.","2014-09-15T12:22:06-0400","2014-09-15T12:22:06-0400","0","w4w"
"216","http://harrisburg.craigslist.org","ppp","4669119193","http://harrisburg.craigslist.org/cas/4669119193.html","4669119193","Sep 15","Are u looking to be stretched out fisting? ?",NA,"cas","casual encounters","East of Lebanon","Have u ever wondered about being fisted ?..............its very fun and pleasurable If its done the correct way with lots on lube and u take it nice and slow.............. I have successfully Worked ladies from one finger and then 2 all the way up to the fist..............and have played with large water bottles and other toys and objects............. If you'd like to learn more and get together email me with your ?..............","2014-09-15T12:33:04-0400","2014-09-15T12:33:04-0400","0","m4w"
"217","http://harrisburg.craigslist.org","ppp","4669125322","http://harrisburg.craigslist.org/cas/4669125322.html","4669125322","Sep 15","Biz Traveler Seeks Top in My Hotel Room",NA,"cas","casual encounters","Harrisburg","I will be in town tonight & looking for a top who needs serviced. 49 yo MWM, 6 195, blk/hzl, 6"" c., hairy, bottom. Prefer men of color but it's all good.","2014-09-15T12:36:00-0400","2014-09-15T12:36:00-0400","0","m4m"
"218","http://harrisburg.craigslist.org","ppp","4669135125","http://harrisburg.craigslist.org/cas/4669135125.html","4669135125","Sep 15","WM SEEKING BLACK FEMALE ONLY","55","cas","casual encounters","Central PA","I'm a comfortable/Confident  Mature white male seeking a comfortable black female for relaxing sensual times of pleasureable fulfilling moments & uninhibited sexual playtime.
Someone to have good conversation with, long foreplay periods, and the entire carnal pleasure & experience Five ft, 9inches tall One Hundred Ninety pounds, Six inches, cut, shaved smooth, clean, safe, nicely thick.  I'm looking for a confident female who definitely knows what and how she wants to be fulfilled.  I'm not of the ""wham,bam,"" type guy.  I'll definitely make sure you enjoy the entire experience.","2014-09-15T12:40:46-0400","2014-09-15T12:40:47-0400","0","m4w"
"219","http://harrisburg.craigslist.org","ppp","4669135842","http://harrisburg.craigslist.org/cas/4669135842.html","4669135842","Sep 15","Seeking 50's/60's woman","55","cas","casual encounters","Central PA","LOOKING FOR THIS EVENING, DINNER/AND/OR DRINKS, HOT TUBBING, SKINNY DIPPING UNDER THE STARS.....Real caring Gentleman seeking single/married (preferred) uninhibited woman who is in need of intense attention physically/emotionally.  Prefer slim/average discreet lady who wishes to enjoy and receive fulfillment of her needs that she may not be getting.  I'm sincere, sensual, receptive, attentive, clean, fresh, safe, ddf, discreet and only wish to provide what you may be not be fulfilled at your present situation.  Looking for a sincere one-time, or preferred multiple playtime trysts.  Your fulfillment and pleasure is what I also receive my pleasure from.  No ""spammer"" here, no ""wham,bam,thank you maam"" here; rather sensual times of uninhibited pleasure and play as you envision and fantasize about.  I am real.  If you wish to rediscover and enjoy your visions of sensual playtime, do not hesitate to contact me.  Please put 'TRYSTS"" in the subject line.  Do not be shy or timid to ask anything that will make you comfortable and at ease.  At that time we can exchange more information/pics/ phone #'s etc, and plan a meeting place at your comfort.","2014-09-15T12:41:06-0400","2014-09-15T12:41:06-0400","0","m4w"
"220","http://harrisburg.craigslist.org","ppp","4669145125","http://harrisburg.craigslist.org/cas/4669145125.html","4669145125","Sep 15","Have you ever wanted to leave work for lunch and have sex?",NA,"cas","casual encounters","Hershey","If your answer to the question in the title is YES, then I think we might want to get together.  I'm open to age, race, body type and relationship status.  All I ask is that you been D&D free as I am and want to remain that way.  
I am a white male, early 40's, height and weight proportionate, very well mannered and groomed, no piercings or tattoos, VERY oral with a nice thick 8"" package.  If you give me the opportunity to go down on you, I can assure you that you will not be disappointed.
When you reply, please put ""lunch time fun"" in the title.  Thank you for checking out my post.","2014-09-15T12:45:41-0400","2014-09-15T12:45:41-0400","0","m4w"
"221","http://harrisburg.craigslist.org","ppp","4669146239","http://harrisburg.craigslist.org/cas/4669146239.html","4669146239","Sep 15","DL bud wanted","36","cas","casual encounters","Harrisburg","I am 36. I am 5'11"", two zero five pounds 6.5"" cut. I am looking for a bud to hang out with and mess around with in occasion. I need someone that is extremely straight acting so that my wife could be around them and she wouldn't think anything of it. Speaking of my wife, there would never be a 3 some. She would never go for it! Please be around my age (under 40 is a must). I am into fishing, hunting and craft beers. Please be at least into hunting and fishing. I can handle it you drink Bud (or some other nasty beer). 
I am not into hook ups and one time deals. I trust no one... Trust has to be earned.
If this sounds like something you would be interested in give me a shout!","2014-09-15T12:46:14-0400","2014-09-15T14:50:54-0400","0","m4m"
"222","http://harrisburg.craigslist.org","ppp","4669169564","http://harrisburg.craigslist.org/cas/4669169564.html","4669169564","Sep 15","Are you a Dominant woman?","45","cas","casual encounters","HBG","Hello! I am a married, 45 year old who would desperately love to find a dominant woman who loves having her pussy worshiped. Lunch time visits can be a regular thing. Let me spoil you :)","2014-09-15T12:57:30-0400","2014-09-15T12:57:54-0400","0","m4w"
"223","http://harrisburg.craigslist.org","ppp","4669181959","http://harrisburg.craigslist.org/cas/4669181959.html","4669181959","Sep 15","Cheap Sex","36","cas","casual encounters","Harrisburg","I am looking for cheap $ex a$ap.  Provide me a pic and when you can hook up and we can set thi$ up.  A$ i $aid a$ap.  Look$ do not matter ju$t get back to me","2014-09-15T13:03:26-0400","2014-09-15T13:03:26-0400","0","m4w"
"224","http://harrisburg.craigslist.org","ppp","4669187370","http://harrisburg.craigslist.org/cas/4669187370.html","4669187370","Sep 15","Want to have a few drinks?","32","cas","casual encounters","Lititz","Looking for an attractive athletic woman to have a few drinks with and share good conversation. I am new here and don't know very many people. I guess I Miss having good conversation with women. I'm tall dark athletic build and handsome. 
 Shoot me an email! 
Thanks","2014-09-15T13:06:04-0400","2014-09-15T13:06:04-0400","0","m4w"
"225","http://harrisburg.craigslist.org","ppp","4669188654","http://harrisburg.craigslist.org/m4w/4669188654.html","4669188654","Sep 15","looking for ltr","28","m4w","men seeking women","sunbury","hello I am lookin for someone to take to a wedding in Ohio.  everything will be payed for must be willing to share a room.  if interested plz email me.  my name is Chris plz only someone interested.","2014-09-15T13:06:40-0400","2014-09-15T13:06:40-0400","0",NA
"226","http://harrisburg.craigslist.org","ppp","4669196768","http://harrisburg.craigslist.org/cas/4669196768.html","4669196768","Sep 15","oral 4 u only  deep n dry","50","cas","casual encounters","leb-annville","be clean discrete hght/porp dis free 18 50 who wants 2 lay bac n enjoy  with no recrip , i host only   my mth 4 ur pleasure, n yea i swallow,  am 5/6 145 no pic here ur descrip ok 4 me, stghts ok, hey if this is what u like bring it on, ssubmissive c. s. here 4 u to use, ,   am oral provider only","2014-09-15T13:10:36-0400","2014-09-15T13:10:36-0400","0","m4m"
"227","http://harrisburg.craigslist.org","ppp","4669210212","http://harrisburg.craigslist.org/stp/4669210212.html","4669210212","Sep 15","moms of ADHD kid","38","stp","strictly platonic","lower dauphin","I'm divorced dad that could use a hand...not a handout. I changed jobs and waitn for insurance to kick in I can't afford sons meds ( have script for proof) and don't want him start off school year without. Im auto body tech.some mechanical can do work or $ for any help.thanks for undetstanding","2014-09-15T13:17:13-0400","2014-09-15T13:17:13-0400","0","m4w"
"228","http://harrisburg.craigslist.org","ppp","4669223816","http://harrisburg.craigslist.org/cas/4669223816.html","4669223816","Sep 15","Looking to suck or bottom or both.","32","cas","casual encounters","harrisburg","Simple like title says. Looking for discreet fun. 
Ddf btm looking to suck or bottom.
32, 5'9 into safe play. Cant host looking to travel
And play now. 
Put if u want (sucked) to (top) or (both) in subject.
Sends stats n location. Will return stats n we can trade pics","2014-09-15T13:23:50-0400","2014-09-15T13:23:50-0400","0","m4m"
"229","http://harrisburg.craigslist.org","ppp","4669231105","http://harrisburg.craigslist.org/stp/4669231105.html","4669231105","Sep 15","FWB","35","stp","strictly platonic","West Shore","I'm 35. SWM. 5'7"". 150. Looking for a lady under 40 to meet and see if we connect. Let's give it a try.... :) Let's have some fun. I can host.
You pick the time & place to meet.","2014-09-15T13:27:19-0400","2014-09-15T13:27:19-0400","0","m4w"
"230","http://harrisburg.craigslist.org","ppp","4669237819","http://harrisburg.craigslist.org/m4w/4669237819.html","4669237819","Sep 15","FWB to Start","25","m4w","men seeking women","Colonial Park","Hey there, 
I'm looking for a girl I can hang out with and have a good time.  I'm not necessarily looking for sex, but I do miss being able to just cuddle up to a movie or something to that effect.  But just in case please be disease free.  I am open for  more if the chemistry is there.   I'm 25, looking for anyone from 20-28.  I may make exceptions depending on what you write.  Please be educated as I am looking for the friend portion of this as well and I like to be able to actually have a decent conversation.  
I'm 6'1, 190 pds, and I'd classify myself as between athletic and average.  Please reply with a picture of yourself and I will send some in return.  Thanks.","2014-09-15T13:30:42-0400","2014-09-15T13:30:42-0400","0",NA
"231","http://harrisburg.craigslist.org","ppp","4669242178","http://harrisburg.craigslist.org/cas/4669242178.html","4669242178","Sep 15","GET OFF AFTER DULL MONDAY WORK",NA,"cas","casual encounters","HARRISBURG","Any married or other bi guys need to bust a nut after work today beginning around 4:30PM?  Hosting here for your oral, manual or anal (top here) pleasures!  Do NOT ask for any pics cuz I do not have or share pics!  Average  older guy looking for mutual fun!  Or if you just want to blow or suck, that's fine too!  If stats, looks, cock size are of significant importance just for a one-time thing, then maybe you should just move on!!!  Of utmost importance should be legal age, safety, discretion and cleanliness! Not into games and bullshitters!  I trust/respect those who demonstrate these exact traits! An example would be, if I am willing to trust you to share my address and/or cell number, what are you willing to do to demonstrate that same trust??????????  Not a pic, stats or number collector!  Once we meet, all is deleted unless you choose otherwise!  Now keep your mind on your work until done!!!!  :-)","2014-09-15T13:32:44-0400","2014-09-15T13:32:44-0400","0","m4m"
"232","http://harrisburg.craigslist.org","ppp","4669245984","http://harrisburg.craigslist.org/cas/4669245984.html","4669245984","Sep 15","large cock needed","484","cas","casual encounters","westshore","GL Couple looking for sexy male with nice package for adult fun for this weekend.
PLEASE READ: If you reply with out a photo it will not be opened.........
We are looking for a local guy or even a couple that is trust worthy and GL and dependable! 
She is your fantasy come true!!!!
We are late 40's Good looking save and clean. you be the same. if this ad is up we are still looking.
Please reply with Photo....age ...location....text number....
Thanks","2014-09-15T13:34:34-0400","2014-09-15T13:34:34-0400","0","mw4m"
"233","http://harrisburg.craigslist.org","ppp","4669251107","http://harrisburg.craigslist.org/cas/4669251107.html","4669251107","Sep 15","bearded big guy looking for crossdressing guy",NA,"cas","casual encounters","Harrisburg area","I'm a big guy with a beard looking for a fun crossdressing guy.  You don't have to be passable. I want someone who feels confident when they are dressed.  I like bigger and smaller ladies.  I'm a top only.  I like to text.  I'm a biker type.   5'10 300lbs.  In my late 20s. 
Please send a pic.  And put you're favorite color in the subject line so I can weed out the fakes.","2014-09-15T13:37:03-0400","2014-09-15T13:41:58-0400","0","m4t"
"234","http://harrisburg.craigslist.org","ppp","4669252206","http://harrisburg.craigslist.org/cas/4669252206.html","4669252206","Sep 15","Naughty little piss whore???","29","cas","casual encounters","Hbg area","Now i know there are some like minded (kinky) women out there that are into this fetish, I am a 29yo kinky guy, with 8 inches, trying to have some watersports fun with a naughty girl, will do anything to make this happen :)  so get back to me with pix and info if you are serious.","2014-09-15T13:37:35-0400","2014-09-15T13:37:35-0400","0","m4w"
"235","http://harrisburg.craigslist.org","ppp","4669258698","http://harrisburg.craigslist.org/cas/4669258698.html","4669258698","Sep 15","horny bottom looking","43","cas","casual encounters","Gettysburg","Hey Guys I am 43 yo wm hwp ddf looking for the same ages 25 to 45 want a hard horny top who is also into oral can host or travel free all afternoon and evening lets do this","2014-09-15T13:40:41-0400","2014-09-15T13:40:41-0400","0","m4m"
"236","http://harrisburg.craigslist.org","ppp","4669259617","http://harrisburg.craigslist.org/m4w/4669259617.html","4669259617","Sep 15","big and bearded guy looking for bbw for drinks and conversation",NA,"m4w","men seeking women","Harrisburg area","Hey there. I'm 30.  I'm a big guy if you're not in to that then sorry for you.   I have a few tattoos and a beard.  I like motorcycles,  muscle cars, music,  movies and tv.   Im a funny and sweet guy with a tough look if you ask my friends. Im a all around teddy bear lol. I like to talk and enjoy good conversation.  
Im looking for a fun, humorous,  and confident bbw who would like to meet up for drinks. I like thick and bigger women. Im not a weirdo and I'm not looking for just sex. I know that's what ur thinking with all the scummy dudes that lurk  these ads. 
Please reply with a pic. I will send one back.  And put ur favorite movie in the subject so I know ur not fake.","2014-09-15T13:41:07-0400","2014-09-15T13:41:07-0400","0",NA
"237","http://harrisburg.craigslist.org","ppp","4669260172","http://harrisburg.craigslist.org/cas/4669260172.html","4669260172","Sep 15","who wants drained",NA,"cas","casual encounters","u host","Simple as the title says who wants there dick sucked and possibly fucked today im only available for a few hours so hit me up asap with pics or you will deleated not looking for endless emails either your serious or not don't waste my time . Looking forward to hearing from ya. Btw im 27 with a 7"" cock and be dd free. I am 100% real and you be to","2014-09-15T13:41:26-0400","2014-09-15T13:41:26-0400","0","m4m"
"238","http://harrisburg.craigslist.org","ppp","4669260395","http://harrisburg.craigslist.org/cas/4669260395.html","4669260395","Sep 15","dominant bbw","27","cas","casual encounters","Eastshore","looking for a dominant bbw that will sit on my face with her panties on and make me submit to her. We can discuss other activities if you are interested. I'm not looking for sex just a women that will exercise her dominant side. Age and race are not important either is your experience level at something like This.  I'm willing to make it worth your time as well. If you are interested message me and change the subject to dominate so I know
You are real.","2014-09-15T13:41:33-0400","2014-09-15T13:41:33-0400","0","m4w"
"239","http://harrisburg.craigslist.org","ppp","4669261394","http://harrisburg.craigslist.org/cas/4669261394.html","4669261394","Sep 15","service with a smile",NA,"cas","casual encounters","west shore","Looking for a lady who's available between now and 4 today for a quick bit of car fun.
Won't take long and you will help me out big-time.  Don't want to break the bank, though.
If you are available now, up for this and clean/ddf.  Get back to me.","2014-09-15T13:42:02-0400","2014-09-15T13:42:02-0400","0","m4w"
"240","http://harrisburg.craigslist.org","ppp","4669263602","http://harrisburg.craigslist.org/cas/4669263602.html","4669263602","Sep 15","need a bi guy","40","cas","casual encounters","hbg/Carlisle you host","I am looking for a bi guy that is in a relationship with a female. That female has to know about it and would consider joining in from time to time. I am married and curious not positive what all I would do but interested in finding out. The best situation would be all of us there first to see what happens then us males can meet afterwards on a one on one situation. I am looking for an on going thing here. Be under 40 hwp and ddf as I am. Send stats and a picture which I will reply with one if interested. I am not looking for a hair bear must be trimmed or shaven as I am.","2014-09-15T13:43:07-0400","2014-09-15T13:43:07-0400","0","m4m"
