"","cityurl","subcl","post_id","post_link","post_data_id","post_date_raw","post_title","post_price","post_subcl","post_subcltype","post_loc","post_text","post_date","post_last_update","post_pics","post_type"
"134","http://sfbay.craigslist.org","ppp","4669444875","http://sfbay.craigslist.org/sby/m4m/4669444875.html","4669444875","Sep 15","married  tops A MUST READ Post",NA,"m4m","men seeking men","south san jose","Hot laid-back mature.....looking for horny thick dicked macho dominant top guys. I am a passionate bottom who likes to deepthroat nicely and get pounded wild by big cocks with large loads that I swallow. I enjoy that u take control on me and have me do all what u like, inclusively forced use. .I melt for a man that understands sensual touching and the power of a soft massage. Idealy, someone that could be a friend with benefits that would enjoy hanging out, dinner, lots of touching and body contacts and uninhibited sex on me. I am a romantic and sensual guy who enjoys extended periods of foreplay involving touching, kissing, fondling, body contact and edging. How slow can you go, how long can you make it last and how often would you like to have sex is much better than how fast and hard can you fuck a man ! I am open to sharing a warm shower, a soft bed or a passionate afternoon of kissing, sucking n fucking or swallowing that preverbial cum and go to the sofa where you bend me over n fill my ass with warm cum. I like very verbal fuckers as I am also very oral n loves to suck, taste n swallow ur warm cum. I never rule out the opportunity to kneel between a man's legs and suck him dry ! My passion is having my ass probed, rimmed, eaten and fucked nice and slow and deep. The down n dirty is that I want a man to use me, feed me, fuck me as often as possible. I love to service a man and have him use me for his own pleasure. I have a kinky side, enjoy most mild perversions but I don't do excessive pain, scat or fisting. Love edging so much. I like to watch and be watched. I enjoy to make new pictures and videos. Wud be great with u in action on me....Hug me, kiss me, push me to my knees. I'll suck you hard, lick your balls and ass and offer up my hole to let you fucking nail me to the bed. Masculine oral submissive anal bottom. Highly affectionate and tactile when and if appropriate. Also, I enjoy so bad to tease ur taint, probably the most overlooked erogenous zone on a man's body to make u bring some of the most intense pleasure when I latch my mouth onto it and work it.
I love to bury my face in a man's crotch. I like to explore every crevice, tasting, chewing, licking, gnawing, rubbing while smelling ur pure manhood scent (no brought perfumes, plse). How great is for me to press my face into your cock, balls n taint then slapping ur dick all over my face..... Then my dreams come true.
I am an extremely affectionate and submissive cum swallower!!!
I love to kneel down in front of mature men n blow them till I suck them dry. Preferably without reciprocation.
I am really horny to service mature gents n to be their cum slut n treated accordingly. I enjoy verbal humiliation. And wud really like to be treated by a dominant master.
I am a sucker for all cocks which shoot big loads of thick, gooey cum.
I am a passionate bottom/clean/ddf Any age white please ddf will travel can host HOTEL+++ 
If not willing to send a photo...as you expect me to host...Don't waste time applying
THIS IS FOR SOUTH SAN JOSE   BE CLEAN AND DDF","2014-09-15T12:12:49-0700","2014-09-15T12:35:09-0700"," 0",NA
"135","http://sfbay.craigslist.org","ppp","4669445330","http://sfbay.craigslist.org/sfc/cas/4669445330.html","4669445330","Sep 15","New to the San Francisco Area :)","24","cas","casual encounters",NA,"Hi,
My name is Abraham Gracia. I recently moved to the San Francisco Area from Corpus Christi, TX. So far, my time here has been amazing, but I feel like something is missing. That Something I believe is another man in my life that will walk along side of me though my journey in life. I'm interested in meeting someone who I can have fun with, not someone who will settle me down. life is short, no need to be staying in all the time ;) 
 361-seven 2 six-five 3 six 3","2014-09-15T12:13:03-0700","2014-09-15T12:13:03-0700"," 3","m4m"
"136","http://sfbay.craigslist.org","ppp","4669445968","http://sfbay.craigslist.org/eby/cas/4669445968.html","4669445968","Sep 15","looking for a nsa hookup","22","cas","casual encounters","concord / pleasant hill / martinez","hey i am looking for any woman for a lil fun i am younger 22 years old DDF italian/mexican 200# with a 6"" fun stick would love a milf but you dont have to be but i cannot host but am mobile so let me know ladys","2014-09-15T12:13:23-0700","2014-09-15T12:13:23-0700"," 0","m4w"
"137","http://sfbay.craigslist.org","ppp","4669446877","http://sfbay.craigslist.org/eby/cas/4669446877.html","4669446877","Sep 15","young man looking for a milf to please","22","cas","casual encounters","concord / pleasant hill / martinez","hello ladys i am a young guy looking for a milf that wants a younger guy to come over and do whatever you want to do i am 22 years old DDF italian / mexican 200 # with a 6"" boy toy i would love to be your slave and follow your every command so just let me know i am waiting =)","2014-09-15T12:13:49-0700","2014-09-15T12:13:49-0700"," 0","m4w"
"138","http://sfbay.craigslist.org","ppp","4669449312","http://sfbay.craigslist.org/sfc/cas/4669449312.html","4669449312","Sep 15","looking for a sugar daddy or to be a houseboy",NA,"cas","casual encounters",NA,"Hi. i am looking for a more dom top that knows what he wants. i am fairly new to guys but would love to be taught more. i am open minded and up for almost anything.","2014-09-15T12:15:04-0700","2014-09-15T12:15:04-0700"," 5","m4m"
"139","http://sfbay.craigslist.org","ppp","4669454014","http://sfbay.craigslist.org/sfc/cas/4669454014.html","4669454014","Sep 15","Monday Afternoon Play!","35","cas","casual encounters","downtown / civic / van ness","Its Monday afternoon! Party and pleasure... looking for a man that wants to play on this beautiful day...
Im into sensual oral, heavy foreplay, and maybe more...:-}  come over!","2014-09-15T12:17:25-0700","2014-09-15T12:41:14-0700"," 0","t4m"
"140","http://sfbay.craigslist.org","ppp","4669456844","http://sfbay.craigslist.org/sby/cas/4669456844.html","4669456844","Sep 15","Hot massage for Older","24","cas","casual encounters","san jose west","Hey there , fit white stud looking for a clean, professional type. Any age welcome. Must be clean, sane and generous . I can host weekdays, offer a nice touch and release. Email me stats and availability etc and lets set this up.","2014-09-15T12:18:53-0700","2014-09-15T12:18:53-0700"," 0","m4m"
"141","http://sfbay.craigslist.org","ppp","4669458477","http://sfbay.craigslist.org/scz/cas/4669458477.html","4669458477","Sep 15","Suck and swallow.","43","cas","casual encounters","santa cruz","Im looking for an 18-26, std free, height/weight proportionate horny discreet guy who enjoys long sloppy or quick face fuck blowjobs. Or both. Role play ok (No, No, Don't make me suck you- Don't make me swallow) Or just a massive release is fine. No reciprocation required, but who's gonna say no to a blowjob?","2014-09-15T12:19:44-0700","2014-09-15T12:19:44-0700"," 0","m4m"
"142","http://sfbay.craigslist.org","ppp","4669459714","http://sfbay.craigslist.org/nby/rnr/4669459714.html","4669459714","Sep 15","Redbook is truly missed",NA,"rnr","rants & raves",NA,"Hard to find good Service now...........................................................................................................................................","2014-09-15T12:20:23-0700","2014-09-15T12:20:23-0700"," 0",NA
"143","http://sfbay.craigslist.org","ppp","4669462926","http://sfbay.craigslist.org/sby/m4w/4669462926.html","4669462926","Sep 15","Successful Bi Entrepreneur for Mature & Sexy","34","m4w","men seeking women","sf bayarea","Ladies,
Greetings to anyone checking out this ad. I am very new to the area, I'm looking for a fun, mature, sexy lady for friendship and more. If you are bisexual that is a major plus. I am a healthy, fit puerto rican and Jamaican mixed hardworking man. Born in london, moved here from miami. I am bisexual, i much rather be with a woman but I am not the one to denie my interest. If that's a issue move on please. I enjoy life to the fullest, i dont invite BS into my life. I am very confident, secure and up front. Please send your picture when replying. I am far from desperate. Put your ethnicity in the subject line please.","2014-09-15T12:22:01-0700","2014-09-15T12:22:01-0700"," 0",NA
"144","http://sfbay.craigslist.org","ppp","4669471482","http://sfbay.craigslist.org/sby/m4m/4669471482.html","4669471482","Sep 15","Start your week with a nice rub",NA,"m4m","men seeking men",NA,"Should you need a massage today to start your week?
Athletic guy offers relaxing massage to help you relieve your stress and muscle sore. Start your hardworking week by receiving a soothing rub from me.  Good looking guy with a smooth lean body here.","2014-09-15T12:26:23-0700","2014-09-15T12:26:23-0700"," 0",NA
"145","http://sfbay.craigslist.org","ppp","4669477624","http://sfbay.craigslist.org/eby/cas/4669477624.html","4669477624","Sep 15","looking for a perverted young girl","42","cas","casual encounters","berkeley north / hills","I am in my 40s, healthy, clean, average looking, and perverted as hell. looking for a kinky young girl who wants used in every way. ready to open up for me and get nasty. no bs, no games, just tell me what you look like and what you will and will not do. lets get together and do this. I can host in berkeley.","2014-09-15T12:29:29-0700","2014-09-15T12:29:29-0700"," 0","m4w"
"146","http://sfbay.craigslist.org","ppp","4669480299","http://sfbay.craigslist.org/eby/cas/4669480299.html","4669480299","Sep 15","ladies lets hook up tonight. ill be available all night hmu im real","42","cas","casual encounters","berkeley","Whats up? I am 42 year old Fit Indian looking 
For some good clean NSA fun. I luv all 
ladies of all ages, ethnicity and shapes HWP. 
This is for fun I do not charge.  I can host in Berkeley and I also drive.","2014-09-15T12:30:51-0700","2014-09-15T12:30:51-0700"," 0","m4w"
"147","http://sfbay.craigslist.org","ppp","4669485598","http://sfbay.craigslist.org/sfc/cas/4669485598.html","4669485598","Sep 15","Oral Pleasure for You",NA,"cas","casual encounters","SOMA / south beach","Attractive 47yo Caucasian male in downtown looking for a woman who really enjoys receiving oral pleasure...Let me bury my face between your legs and taste your sweet wetness.  I love to kiss, lick, tease, nibble, and suck on your clit until you moan with pleasure.  No reciprocation needed.  Please put ""Lick Me"" as subject so I know you're not spam","2014-09-15T12:33:32-0700","2014-09-15T12:33:32-0700"," 0","m4w"
"148","http://sfbay.craigslist.org","ppp","4669487540","http://sfbay.craigslist.org/eby/cas/4669487540.html","4669487540","Sep 15","Cock Suckers and Deep Throating SLUTS | Big Hung White Cock 4 U","26","cas","casual encounters","walnut creek","***** ***** ***** ***** ***** ***** ***** ***** ***** ***** ***** ***** ***** ***** 
You wanna get treated like a slut. I'm gonna record you sucking & fucking my cock. Making you gag and take facials. You might be a good girl usually but you have this freaky side no one knows about and you want a Young Buck to treat you like the inner slut you see yourself as. I may even smoke a blunt while you choke on my thick cock. 
I will fuck you, and maybe even your friends to. Your gonna reply with pictures and let me know when we can start playing, from that point it's on me. You need to be mobile and have a place to play. I don't care if you have a BF/Husband, your gonna be my slut. You're tired of him sexually and I'm here to make sure that need is met.
Put ""Can I Be Your Slut"" in subject line. Women or secure couples only. Be DDF, std and drama free like myself | m4ww m4mw m4mww","2014-09-15T12:34:33-0700","2014-09-15T13:15:01-0700"," 4","m4w"
"149","http://sfbay.craigslist.org","ppp","4669488884","http://sfbay.craigslist.org/sfc/m4m/4669488884.html","4669488884","Sep 15","like to suck and rim Asian","18","m4m","men seeking men","SF","im white 18
5 foot 6 and 120 pounds
i love to suck and rim and really prefer Asian guys but open to others i guess
im ddf and hiv negative
would be cool to have like a regular but other is cool","2014-09-15T12:35:16-0700","2014-09-15T12:35:16-0700"," 3",NA
"150","http://sfbay.craigslist.org","ppp","4669492597","http://sfbay.craigslist.org/sby/m4w/4669492597.html","4669492597","Sep 15","looking for a breast feeding milk/hr300",NA,"m4w","men seeking women","mountain view","looking a woman for a breast feeding for 300prhur 
 for 3hr in a week for 2 months
 am 43 and living in Los altos
 Mark","2014-09-15T12:37:10-0700","2014-09-15T12:37:10-0700"," 0",NA
"151","http://sfbay.craigslist.org","ppp","4669494951","http://sfbay.craigslist.org/eby/cas/4669494951.html","4669494951","Sep 15","SEXY        OLDER WOMEN WANTED","43","cas","casual encounters","hayward / castro valley","hello ladies i'm a 46yr old good looking Athleticly built very well endowed puerto rican male.5'10 180 pounds blk hair brwn eyes. i  have a very talented tounge and lots of other skills.      and i'm seeking older women that are easy on the eyes. smell good have all there teeth.and have pretty feet, for some  safe discreet  adult freaky fun. one that's ready to let her hair down and have some carefree fun. party and play. will be your friend in and out of bed. i'm for real you must be also.","2014-09-15T12:38:24-0700","2014-09-15T12:38:24-0700"," 0","m4w"
"152","http://sfbay.craigslist.org","ppp","4669497071","http://sfbay.craigslist.org/sby/m4w/4669497071.html","4669497071","Sep 15","East Indian male looking for white or latino friend","32","m4w","men seeking women","san jose/ South bay","East Indian male moved recently here on business trip looking forward to meet married latino or while woman for casual friendship. we can go to movie, dance or hiking, etc. once we go to know each other, then we can take it to next level. I am looking for very discrete and safe fun.
I prefer you to be married. just my preference. write recent movie as subject like so that I know you are real.","2014-09-15T12:39:28-0700","2014-09-15T12:39:28-0700"," 0",NA
"153","http://sfbay.craigslist.org","ppp","4669498566","http://sfbay.craigslist.org/sby/m4m/4669498566.html","4669498566","Sep 15","LOOKING FOR SOME OUT DOORS FUN","36","m4m","men seeking men","SAN JOSE","Delivery guy in the san jose area today, looking to stop by your place suck and fuck.
If you know of a private place where we can play. Sen me the address and we meet there
Slim smooth 37 years old straight, vers six tall,  one sixty , clean ddf 
send stats on first reply very discrete here please no games..LOOKING IF POSTING STILL UP","2014-09-15T12:40:14-0700","2014-09-15T12:40:14-0700"," 0","m4m"
"154","http://sfbay.craigslist.org","ppp","4669500022","http://sfbay.craigslist.org/sby/w4m/4669500022.html","4669500022","Sep 15","people tell me im pretty ...","30","w4m","women seeking men",NA,"But that hasnt got me much. I have a unique personality and even tho people tend to like me, I have trouble finding people I can relate to... I am a bit introverted, but that doesnt mean im anti social or dont want friends or to go out. 
What im looking for: something simple. A cool guy , educated and like minded, whos intensions are good hearted. I dont need a possible candidate for marriage . I simply want to get to know you and enjoy that part of it without worring about the rest. Im a big fan of all things natural and organic . I dont want anything to do with a corporate robot or ""sheeple"", please be ""awake"". I highly respect positions  in art, music, education, advocacy,  environment, natural health, community organizing, science , non profits,  and the self employeed. 
At 30 years old, with life as it is, I find it hard to meet like minded people, make friends, connections or lasting bonds. I dont really think a post on Craigslist is the answer, but hey, its worth a shot. I hate those dating sites.... 
Some stuff about me:  i am 30 years old , natural blonde with blue eyes. I am 5'6"", 140lbs medium build , slightly curvy in good shape eat healthy, stay active, i truly believe my health is my wealth.... 
I have a couple itty bitty businesses, and going back to school .
I am oppinionated , strong, yet very feminin and traditional in many ways.
I enjoy Yoga, pilates , jogging, hiking , camping, reading , writing , art ,  movies , documentaries , I have my shows....maybe we like the same ones? Lets find out! Write me, if i sound interesting. Tell , me all about yourself and if you can, include a pic!! 
I am 420 friendly (its my guilty pleasure)
I love to cook
Im crafty, I like to spend time tinkering and making things when I can. 
Theres a lot to learn about one another. So lets get started!","2014-09-15T12:40:58-0700","2014-09-15T12:40:58-0700"," 0",NA
"155","http://sfbay.craigslist.org","ppp","4669500238","http://sfbay.craigslist.org/sby/m4m/4669500238.html","4669500238","Sep 15","afternoon fun",NA,"m4m","men seeking men","san jose north","Looking for some hot fun today or whenever.  Oral, body contact, make out, nip play and more.  Would love to bottom if we hit it off.
wm, mid-40's, six-one, one65, 7""c, hwp, clean, healthy discreet professional.  
must travel
Send stats and what sort of play you enjoy.  thanks","2014-09-15T12:41:05-0700","2014-09-15T12:41:05-0700"," 0",NA
"156","http://sfbay.craigslist.org","ppp","4669501219","http://sfbay.craigslist.org/sby/cas/4669501219.html","4669501219","Sep 15","Seeking matured fun loving companion...","45","cas","casual encounters","cupertino","Young at heart married  east indian male from south bay & physically in good shape,  interested to get in touch with smart & beautiful lady who wants to explore avenues for fun and excitement. 
Drama free, very discreet and privacy is must.
We can get to gather as time permits and accompany during outdoor activities (Hiking, long drives etc).
Also put 'desi fun' in the subject line when responding through email..","2014-09-15T12:41:35-0700","2014-09-15T12:41:35-0700"," 0","m4w"
"157","http://sfbay.craigslist.org","ppp","4669502421","http://sfbay.craigslist.org/scz/cas/4669502421.html","4669502421","Sep 15","BJ on the DL","55","cas","casual encounters","aptos","i am home alone now, i can host.
blow and go, you wank in, 
watch some porn, i drop to my knees and suck your cock.
no reciprocation needed,
email me!","2014-09-15T12:42:12-0700","2014-09-15T12:42:12-0700"," 0","m4m"
"158","http://sfbay.craigslist.org","ppp","4669506959","http://sfbay.craigslist.org/eby/cas/4669506959.html","4669506959","Sep 15","HOT Dad seeking fem boi, c/d, panties+, heels++!","45","cas","casual encounters","concord / pleasant hill / martinez","Having a thong or high heels is a huge PLUS, not a must, even if you bring them and do not wear them! A true fit gent, guy next door, that has been thinking about this and now ready. I can host near Concord/WC and hoping to find a younger fem boi or c/d++ for safe play! Anything worn that is ""femish"" is a big plus! I am 6'1"", 190, good looking WM, nice package and CLEAN, and well cared for! Looking for now or later but please send stats and a pic and I will return the same. Waiting for the first one that catches my eye!!! Detailed stats and a pic!!! Bring your g/f's high heels! More for now!!!","2014-09-15T12:44:36-0700","2014-09-15T12:44:36-0700"," 0","m4m"
"159","http://sfbay.craigslist.org","ppp","4669512335","http://sfbay.craigslist.org/sfc/cas/4669512335.html","4669512335","Sep 15","BULL looking for hotwife and her pathetic cuck",NA,"cas","casual encounters","laurel hts / presidio","Hello, experienced white bull here looking for a new upscale hotwife and her impotent cuck. I have dated hotwives long term and I am looking for a new long term hotwife. She will eventually become mine, but that is a discussion for us 3 to have as time progresses.
I am 30 years old 6 foot 2 and very fit. I weight 195#. I have a thick 8x6 uncut cock for her to enjoy.
Please email me with your details. No cuck wanabees. Hotwife required.","2014-09-15T12:47:18-0700","2014-09-15T12:47:18-0700"," 0","m4mw"
"160","http://sfbay.craigslist.org","ppp","4669518552","http://sfbay.craigslist.org/eby/stp/4669518552.html","4669518552","Sep 15","Hj free, I got lube,you got place.",NA,"stp","strictly platonic","I'll reply if you're close","I'd like to give a HJ to you.
Be nice,clean,smell good .and have your place.
I'm passable and clean.
Just for now.
Get my attention,you should know how to.
If you're far.lets see how far.","2014-09-15T12:50:29-0700","2014-09-15T12:50:29-0700"," 4","t4m"
"161","http://sfbay.craigslist.org","ppp","4669519200","http://sfbay.craigslist.org/eby/cas/4669519200.html","4669519200","Sep 15","Looking for Hispanic company tonight",NA,"cas","casual encounters","fremont / union city / newark","Hello.  I'm a 43 year old mwm in town for 2 days.  I've never been with a Hispanic woman.  Would love to fill you tonight.
I'm 6 foot 240 lbs.  Shaved head with goatee.  Cock is 6.5 long and thick circumcised and had a vasectomy.  Just had a physical so I know I'm clean too.  
I'm very open minded sexually so if you have a fantasy I'm almost sure to be willing.
I have a hotel room so we are good to go.  I can send pictures if you are real.","2014-09-15T12:50:49-0700","2014-09-15T12:50:49-0700"," 0","m4w"
"162","http://sfbay.craigslist.org","ppp","4669524180","http://sfbay.craigslist.org/eby/cas/4669524180.html","4669524180","Sep 15","Yoga class cancelled","23","cas","casual encounters","hayward / castro valley","hi dear
Yoga class cancelled how do i stretch now
any ideas
any hot papi with nice body there to give me yoga class and then I do lingum massage
no face pic in first email no repsonse","2014-09-15T12:53:26-0700","2014-09-15T12:53:26-0700"," 5","t4m"
"163","http://sfbay.craigslist.org","ppp","4669524641","http://sfbay.craigslist.org/eby/m4m/4669524641.html","4669524641","Sep 15","Book store on Ast and Main at 3","44","m4m","men seeking men","hayward / castro valley","I will be at the book store that's on Ast and Main at 3 til ?   Going to go see porn and see what comes up. I like giving and getting oral.  Top here if you are a bottom. If you want to meet up. Shoot me a Pic and Stats and I will Reply back. Looking if Posted","2014-09-15T12:53:40-0700","2014-09-15T12:54:07-0700"," 0","m4m"
"164","http://sfbay.craigslist.org","ppp","4669526963","http://sfbay.craigslist.org/eby/m4w/4669526963.html","4669526963","Sep 15","Time is only wasting so why wait for eventually","27","m4w","men seeking women","vallejo / benicia","Hi this is my first time trying out this craigslist thingy so bare with me 
Ive been single for the past 2 years and i feel as if im ready to get back on the dating scene, i do miss all the excitement adventures , feelings and emotions for someone 
About me 
Im 27 years old , filipino , a little heavy but ive been working out a lot lately for the past 4 months trying to trim down , i work fulltime , i enjoy the outdoors , love being outside rain or shine, love camping hiking bicycling fishing , i love all kinds of music , i love my sports 49ers warriors and sf giants baby lol 
If you'd like to know more about me drop me a line","2014-09-15T12:54:50-0700","2014-09-15T12:54:50-0700"," 0",NA
"165","http://sfbay.craigslist.org","ppp","4669528162","http://sfbay.craigslist.org/sby/cas/4669528162.html","4669528162","Sep 15","Looking for a Beautiful Mind (just for the night)","40","cas","casual encounters","sunnyvale","What's a brilliant, sexy, amorous 40-year-old woman to do who is not looking for anything long-term right now? I'm posting this ad to see if a fun, brilliant, creative Craigslist reader has any suggestions*. :)
I'm partial to intelligent, open-minded or creative men. Looks are relatively unimportant, however taking care of yourself is mandatory.
*Suggestions include:
Dinner and drinks at a romantic outdoor cafe followed by animal sex.
A nice, long hike in Shoreline Park followed by a quickie in your car.
A matinee (we cannot keep our hands off each other) followed by a stop at my favorite ice cream shop?","2014-09-15T12:55:28-0700","2014-09-15T12:55:28-0700"," 0","w4m"
"166","http://sfbay.craigslist.org","ppp","4669529658","http://sfbay.craigslist.org/sfc/m4w/4669529658.html","4669529658","Sep 15","Older Male Seeks Younger Female","51","m4w","men seeking women",NA,"Hi. Are you a younger girl who is tired of younger guys who don't listen to you, won't talk to you, don't respect you and don't take their time pleasing you in bed? Try an older guy who is patient, caring, living and will take his time pleasing you and focusing on your pleasure. Send e-mail.","2014-09-15T12:56:15-0700","2014-09-15T12:56:15-0700"," 0",NA
