"","cityurl","subcl","post_id","post_link","post_data_id","post_date_raw","post_title","post_price","post_subcl","post_subcltype","post_loc","post_text","post_date","post_last_update","post_pics","post_type"
"1","http://austin.craigslist.org","ppp","4622847753","http://austin.craigslist.org/cas/4622847753.html","4622847753","Sep 15","SHOW ME TOUR TITS","53","cas","casual encounters","close","I love em all big or small I don't care who you are I just like tits so come on and show them to me heck you don't even have to show me your face now that's a SWEET DEAL","2014-08-16T19:30:25-0500","2014-09-15T17:02:49-0500"," 0","m4w"
"2","http://austin.craigslist.org","ppp","4622865840","http://austin.craigslist.org/m4m/4622865840.html","4622865840","Sep 15","Erotic rub needed","41","m4m","men seeking men","ATX","Masculine athletic guy looking for an erotic rub with mutual touch. Monday and looking for soon. Please reply back with rates, pics, and stats. Thank you","2014-08-16T19:47:11-0500","2014-09-15T17:56:25-0500"," 0",NA
"3","http://austin.craigslist.org","ppp","4623104848","http://austin.craigslist.org/cas/4623104848.html","4623104848","Sep 15","Any Couples Playing ?","34","cas","casual encounters","North","Single hispanic seeks a fun couple this evening will travel to you,or will do half on a room,or host host.Not looking for nothing gay just to play with the female half .Me Str8 clean cut no facial hair,uncut cock,DDF will respect her boundries on what she likes.single females/wives who play alone are welcome.Lets email first then voice verify.will travel to you","2014-08-17T01:10:25-0500","2014-09-15T16:57:55-0500"," 2","m4mw"
"4","http://austin.craigslist.org","ppp","4625897792","http://austin.craigslist.org/m4w/4625897792.html","4625897792","Sep 15","The Most Amazing Fucking Ad Ever",NA,"m4w","men seeking women","Austin","Welcome savvy lady reader! Although... apparently men also browse here and try their luck in sending messages. I'm afraid, fellow man, that I am not bi or gay. But, please, cry not! I'm sure the proper category will be much more useful.
Now! Laaaaadies... *wink* *wink* No, no, pick yourself up from the floor. Leave the discarded clothes. Trust me. It's a side effect of my intense, smoldering smokey stare. It's sexual. And HOT. Want to join the fun? Be local and amazing and Thick to HWP-ish.
But, now, on to the story...
I know what you ladies are saying: ""But, John Doe,"" you ask. In the kitchen, barefoot and naked except for your apron and a freshly made sandwich in one hand. Your voice is a submissive half-moan as your eyes are inexorably drawn to my beardlly jaw, down to my round belly, further down to my man-rocket straining against the cruel boundaries of my fashionable but not ""too"" fashionable blue jeans and finally to the floor where they belong - daring not to look up. You reach out to hand me the sandwich and your hand shakes in repressed sexuality and barely restrained womanly emotions.
I eat the sandwich. It's not that bad. Good job, anonymous lady.
""But... but... but..."" You stutter. I frown momentarily but I can't decide if it's because of your stuttering or for finding a vegetable in my sandwich. I chew more. And then some more, my brows furrowing. No, definitely the sandwich. There's a piece of vegetable in my sandwich. That's wrong. And the side boob you're showing on the edges of your apron aren't really making up for the strange green thing tarnishing the taste of the roast beef, bison, dinosaur shark meat sandwich. I'm temporarily mystified at the greenery but I chalk it up to the dinosaur perhaps being a herbivore and having the lettuce between its teeth when it was murdered.
I grunt and you shudder, rambling nearly incoherently in your need to tell me what your cute little womanly brain thinks is worth saying before the sheer weight of my vocalizations bring you to your knees in a massive orgasm. ""Buthowdoiknowthisisthemostamazingfuckingdadever?"" You manage to spit the words out in a rush before collapsing against the door frame, wave after wave of electric shocks storming through your lower belly as you cum from the sound of me masticating the seared shark meat. Mental images of my powerful jaw masticating at your vagina nearly brings you to your knees and you masticate your lower lip to keep from moaning too loud. You don't want to distract me from my sandwich, after all.
I shove the rest of the sandwich into my mouth and fix you with a powerful stare. The full force of my manliness slams against you, ripping apart your apron, baring your naked body to manly soul-searching eyes. I find your naked soul sexy and triple-boobed and pleasing. And, thankfully, your actual physical bi-boobness is fairly pleasing to behold as well. The shockwave from the man-quake rolls through the house, turning the stereo onto a Marvin Gaye song while lighting candles with pure raw firey explosive studliness ... power... stuff...
I step towards you and my clothes fly off in different directions. Horny naked ladies on the sidelines dash out to fight to the death over my shirt and pants, rolling in the musky scent of my garments like a puppy joyfully rolling around in poop. Sweet, sweet wonderful poop. I nearly accidentally gouge your eye out with my erection. It's so thick, long and hard that Nasa keeps calling me to try to use me as a sexy space elevator. A sexy penis space elevator. The thought of an elevator riding my cock all the way to the moon and back temporarily distracts me. I briefly ponder the imagery of a lubed, technologically advanced elevator riding my cock up and down but I put that aside as I lean in to you.
""Because,"" I whisper. The other women are wailing, gnashing their teeth and pulling out their hair at how lucky you are to receive my full and undivided attention. ""I have a penis.""","2014-08-18T19:16:24-0500","2014-09-15T16:59:49-0500"," 0",NA
"5","http://austin.craigslist.org","ppp","4626273797","http://austin.craigslist.org/cas/4626273797.html","4626273797","Sep 15","I'll fuck and fill you","30","cas","casual encounters","Austin","I'm tired of fucking girls with condoms. I want to know that you can feel every load I pump into your tight, wet pussy. 
I'm 6' tall, long black hair, dark eyes, Mediterranean descent. Thick, uncut cock, I know how to use my hands, fingers, and mouth too. I'm also intelligent, so we can talk about anything and have a lot of fun before and after you're laying back hugging your legs in the air so your womb fills with every drop of my cum.
Just writing this out has me hard. I have pics to exchange and you should send a few when you reply. Of course, I'm tested and clean, you should be too. 
Austin City Limits coming up next week. Title your reply ""Fill me"" so I know you're real.","2014-08-19T02:48:59-0500","2014-09-15T17:12:30-0500"," 0","m4w"
"6","http://austin.craigslist.org","ppp","4627106125","http://austin.craigslist.org/cas/4627106125.html","4627106125","Sep 15","Any woman traveler bored or lonely in your hotel room?",NA,"cas","casual encounters","Austin","I am looking for a woman who is traveling and bored or lonely in her hotel room.  Let me visit you... for some pleasant TLC for you.  I can can give you an intimate massage and foreplay... I can give you oral.  This don't have to be full sex or anything risky... just you laying back and letting me please you with my hands and tongue. 
I will pamper you and indulge you however you want. 
I will gladly meet you in public first... maybe the bar or lobby of your hotel.  You can decide if you are comfortable with me.  This will be completely discreet and anonymous.  No one will ever know and I don't need to know anything about you. 
I am 50, 6'2"" tall, 240lbs.  I am an educated professional, very easy going, safe and disease free.  
I am free during the work day or evenings. 
thanks","2014-08-19T14:20:41-0500","2014-09-15T17:20:20-0500"," 0","m4w"
"7","http://austin.craigslist.org","ppp","4628799082","http://austin.craigslist.org/cas/4628799082.html","4628799082","Sep 15","MOMMY SON ROLEPLAY... IM A NAUGHTY BOY MOMMY","35","cas","casual encounters","Austin","Any women on here ever secretly fantasize about their sons?
Something about the idea of grown women secretly fantasizing about getting fucked by their son that is so hot. Have you ever masturbated while thinking about your son? If so send me a reply and put the words ""I WANT MY SON"" in the subject line
keywords: roleplay role play taboo incest siblings sis bro milf bbw uptown discreet mom mommy mother son sister brother incest milf cougar brunette busty rough submissive","2014-08-20T14:23:04-0500","2014-09-15T16:59:35-0500"," 3","m4w"
"8","http://austin.craigslist.org","ppp","4629043891","http://austin.craigslist.org/cas/4629043891.html","4629043891","Sep 15","PRIVATE GLORY HOLE","24","cas","casual encounters","Mopac and Braker","Location easy to find. Gh in my apt. Goodlooking, ddf and talented here. 100% Discreet. Be clean, ddf, and in shape. Send stats and body pic for address.","2014-08-20T16:39:39-0500","2014-09-15T15:50:54-0500"," 0","m4m"
"9","http://austin.craigslist.org","ppp","4629137526","http://austin.craigslist.org/cas/4629137526.html","4629137526","Sep 15","DOMAIN PRIVATE GLORY HOLE","24","cas","casual encounters","Mopac and Braker","Location easy to find. Gh in my apartment.Goodlooking, ddf and talented here. 100% Discreet, dimmed lights. Be clean, ddf, and in SHAPE. Send stats and BODY pic for address.","2014-08-20T17:41:10-0500","2014-09-15T17:34:27-0500"," 3","m4m"
"10","http://austin.craigslist.org","ppp","4629165772","http://austin.craigslist.org/m4m/4629165772.html","4629165772","Sep 15","DOMAIN PRIVATE GLORY HOLE","24","m4m","men seeking men","Mopac and Braker","Location easy to find. Gh in my apartment.Goodlooking, ddf and talented here. 100% Discreet, dimmed lights. Be clean, ddf, and in shape. Send stats and body pic for address.","2014-08-20T17:59:52-0500","2014-09-15T17:37:18-0500"," 2","quick bj and go. Straight welcomed"
"11","http://austin.craigslist.org","ppp","4629203859","http://austin.craigslist.org/m4w/4629203859.html","4629203859","Sep 15","Looking for a curvy woman FWB",NA,"m4w","men seeking women","south central austin","I am looking for a FWB. You can be attached , or not.  Not here to judge or be judged. We all do what we do. I am pretty much attracted to curvy women. You should also have a big booty too ;-) I included a couple pics so you have a general idea what I mean. Age isn't really an issue to me either. I just want to meet someone who is craving some intamacy and hot lovemaking from someone who is hot for you. Ideally we would talk a bit first, and meet. There should be chemistry. Lets talk, and exchange pictures and see if we want to take it any further. Please put the phrase curvy girl in the subject line. Helps to weed out the spam. Thanks ladies.","2014-08-20T18:26:34-0500","2014-09-15T17:00:05-0500"," 2",NA
"12","http://austin.craigslist.org","ppp","4630729045","http://austin.craigslist.org/cas/4630729045.html","4630729045","Sep 15","Looking for an Asian woman for oral fun","49","cas","casual encounters","Austin","I'm looking for an Asian woman from 20-50 who would like to receive oral... I want to lick your pussy and make you cum. I won't push for more... just let me lick you. I'm very discreet... no one will know and I'll leave when you are done.
I'm 49, 6'1"", HWP, clean, safe, DDF. Email soon and I can come over right away or meet you.","2014-08-21T17:07:05-0500","2014-09-15T15:51:19-0500"," 0","m4w"
"13","http://austin.craigslist.org","ppp","4630921523","http://austin.craigslist.org/m4m/4630921523.html","4630921523","Sep 15","Looking For Best Buddy For BROmance","45","m4m","men seeking men","North Austin","Hi, I am looking for other another guy who wants to hangout. I am white, 5'10"", 175 pounds, disease free brown hair, blue eyes. Tend to like lean and somewhat younger guy. If you see this posting I am still interested.  Please tell me about yourself and include a pic.","2014-08-21T19:36:42-0500","2014-09-15T16:02:48-0500"," 0",NA
"14","http://austin.craigslist.org","ppp","4631174708","http://austin.craigslist.org/cas/4631174708.html","4631174708","Sep 15","want to get off? let's get together... I can give you great head",NA,"cas","casual encounters","south austin","Hoping for something this afternoon. I can host since I live alone or come to your place. We can watch porn and get off and stroke each others cock. Be clean cut and masculine. I want to suck your cock and swallow your load. Top if it comes to it. Send me your picture. Be in good shape.","2014-08-22T01:04:41-0500","2014-09-15T16:58:53-0500"," 0","m4m"
"15","http://austin.craigslist.org","ppp","4632609918","http://austin.craigslist.org/cas/4632609918.html","4632609918","Sep 15","Relax and let this chubby cocksucker make you cum","30","cas","casual encounters","35 and well branch","Quick in and out or longer suck session. Relax in your favorite chair and watch tv or porn. Suck you and service you however you like and then go. be around my age and under 40. will not meet without a face pic and please have your stats in your first message. Can host or travel","2014-08-22T20:34:20-0500","2014-09-15T15:42:29-0500"," 0","m4m"
"16","http://austin.craigslist.org","ppp","4633398988","http://austin.craigslist.org/cas/4633398988.html","4633398988","Sep 15","kik fun","24","cas","casual encounters","Austin","Hispanic 24 yr old male straight females only mikerey23 let's have fun female any legal age.","2014-08-23T12:08:55-0500","2014-09-15T17:32:47-0500"," 0","m4w"
"17","http://austin.craigslist.org","ppp","4633789887","http://austin.craigslist.org/cas/4633789887.html","4633789887","Sep 15","Looking to give BJ","26","cas","casual encounters","South Lamar","Looking for hung dominate guys to swing by for a bj. Love aggressive kinky guys. Hisp here please send pic and stats in the first email.","2014-08-23T15:45:37-0500","2014-09-15T16:25:32-0500"," 0","m4m"
"18","http://austin.craigslist.org","ppp","4634545110","http://austin.craigslist.org/m4m/4634545110.html","4634545110","Sep 15","top en busca de bottom","22","m4m","men seeking men","your host","En busca de chavo pasivo con lugar y foto. De cara para un rato. Agradable. Yo 22 limpio 
100% activo. Hispano.","2014-08-24T09:03:26-0500","2014-09-15T17:18:01-0500"," 3",NA
"19","http://austin.craigslist.org","ppp","4635259995","http://austin.craigslist.org/m4m/4635259995.html","4635259995","Sep 15","seeking a skinny younger bottom","35","m4m","men seeking men","35","i am an attractive dom., 100% top, ddf
seeing bottom aged 18 to 25 & skinny 
must reply with picture, height and weight","2014-08-24T16:59:24-0500","2014-09-15T16:03:27-0500"," 0",NA
"20","http://austin.craigslist.org","ppp","4635563293","http://austin.craigslist.org/m4m/4635563293.html","4635563293","Sep 15","Big Bro/Dad for 18","37","m4m","men seeking men","South Austin/Del Valle","You be 20 years old or younger...in south Austin or Del Valle...
You be ready for a horny bear to use your body...
I would love to have some casual, discreet, naked, hot fun with a younger guy...prefer you be under 22 years old and into having an older brother/daddy type make you his pleasure toy...can be a quick cum and go or we can spend some time making each other feel good...
Either we do this at your place or my place in southeast Austin...
If you are into big bro type cubs or mid-30's bears, then I'm your guy...I want you to be super horned up and ready to take my thick dick into your young, eager mouth...if you're a good little boy slut, maybe Daddy will slide it into your tight, boi pussy...
I am 37 years old...bi-sexual...Hispanic, but highly Americanized...I am 5 foot 7 inches tall with black hair and eyes...I have a hairy, stocky build...a hairy and broad chest...I do have extra meat on my bones but it is proportional so it looks OK on me...I have a short and well kept beard as well...my cock is about 6 and a half inches long and is thick...it is a nice cock and I think you'll love it... 
I get into oral and stroking...lots of body contact...I like for a younger guy to please me with his young mouth...to let me rub my thick, hard cock in his ass crack...we'll both get off... 
Let me know if you are interested in making me feel good, boy...","2014-08-24T21:00:23-0500","2014-09-15T15:59:30-0500"," 2","NOW!!!"
"21","http://austin.craigslist.org","ppp","4635762473","http://austin.craigslist.org/cas/4635762473.html","4635762473","Sep 15","any ladies want to have some  NSA fun tonight?","28","cas","casual encounters","north austin","Looking for a girl to have some fun with tonight, I can host or come to you.  I'm 28, athletic build, on the north side of town.","2014-08-25T01:39:12-0500","2014-09-15T16:48:26-0500"," 0","m4w"
"22","http://austin.craigslist.org","ppp","4636064531","http://austin.craigslist.org/cas/4636064531.html","4636064531","Sep 15","i want to watch a str8 guy jack and shoot","45","cas","casual encounters","2222/ mopac","i want to watch a str8 guy jack and shoot 
 5 foot 7   165 pounds == 
hiv neg and disease free for same 
safe discreet nsa
send pic and stats if u want to come by","2014-08-25T09:43:43-0500","2014-09-15T16:23:26-0500"," 0","m4m"
"23","http://austin.craigslist.org","ppp","4636124675","http://austin.craigslist.org/cas/4636124675.html","4636124675","Sep 15","safe   discreet bttm looking","45","cas","casual encounters","northwest austin","5 foot 7   165 pounds 
 hiv neg and disease free for same 
just looking to get topped while i jack 
safe only
 nsa 
come by   -- top and go 
send pic and stats if interested","2014-08-25T10:16:14-0500","2014-09-15T17:06:02-0500"," 2","m4m"
"24","http://austin.craigslist.org","ppp","4636265146","http://austin.craigslist.org/cas/4636265146.html","4636265146","Sep 15","b/j 4 hiv neg and disease free str8 guys","45","cas","casual encounters","2222/mopac","looking for hiv negative and disease free straight guys that want a discreet b/j
must have good hygene
 nsa
send pic and stats if interested 
looking to host","2014-08-25T11:25:25-0500","2014-09-15T17:33:45-0500"," 0","m4m"
"25","http://austin.craigslist.org","ppp","4636330428","http://austin.craigslist.org/m4m/4636330428.html","4636330428","Sep 15","any top guys looking?","45","m4m","men seeking men","2222/mopac","just looking to get toped while i jack
safe only ..discreet ..nsa
 5 foot 7   165 pounds
hiv neg and disease free for same
come by -- top and go
send pic and stats if u want to come by","2014-08-25T11:56:45-0500","2014-09-15T17:33:26-0500"," 2",NA
"26","http://austin.craigslist.org","ppp","4636925574","http://austin.craigslist.org/cas/4636925574.html","4636925574","Sep 15","Dl bottom for top fb","23","cas","casual encounters","Austin","What up 23145 6ft black ddf n discrete you be able up host and clean.. Don't be to old send number for faster response","2014-08-25T17:06:47-0500","2014-09-15T17:40:58-0500"," 2","m4m"
"27","http://austin.craigslist.org","ppp","4637228977","http://austin.craigslist.org/cas/4637228977.html","4637228977","Sep 15","little dicked bttm seeking a REAL man","41","cas","casual encounters","NW or S","Good little bitch looking to supply some good head and perhaps fuck if told to! I am Little dicked,  submissive, masc bttm,,,VGL,,,6ft,,,205,,muscualr,, 5c. Looking for a Hung Top who would like to show me what a REAL man is packing. Like to party, can host at my office or travel, disease free. Like to be on my knees,,,poppers,,,roleplay, good safe fun. looking for soon, so no waiting!!! Black Men, dominant or verbal guys are especially welcome. Safe only if it gets to that!!  If you are interested send a pic and put Hung in the heading so i know you are real. Have more pics if we are on the same page. Telll me what you like?
You have to send a pic, stats, and more than one sentance to get a reply!! 
send # for faster reply","2014-08-25T20:33:16-0500","2014-09-15T16:58:43-0500"," 0","m4m"
"28","http://austin.craigslist.org","ppp","4638756426","http://austin.craigslist.org/m4m/4638756426.html","4638756426","Sep 15","Looking for top fuckbuddy","23","m4m","men seeking men","Austin","What's up black guy 145 23 6ft  ddf n discrete you b clean also and able to host send a pic and a number for faster respone put Top
 in subject so i knw your real","2014-08-26T18:36:04-0500","2014-09-15T17:41:16-0500"," 2",NA
"29","http://austin.craigslist.org","ppp","4639006750","http://austin.craigslist.org/cas/4639006750.html","4639006750","Sep 15","Ginger for and average woman or a BBW","21","cas","casual encounters","South Austin","Hey there, I'd like to begin by saying that if you're a man, don't reply. There's a reason I posted looking for a woman, and I'm not that desperate, so please respect what I'm looking for.
That being said, I'm a white, fit, DDF, 5'11, clean and hygienic redhead who lives in south Austin, am 21 years old, and am easy to get along with. I'd love to meet up with an average or larger woman to have sex with. I don't mind meeting up with a skinny girl, but I've found that the most enjoyable company I've had was with women who are comfortable with every aspect about themselves.
Your age doesn't matter to me, nor does your ethnicity, though I tend to be more attracted to white and Spanish women. What DOES matter to me is that you're disease and hard drug free (I really plan to stay disease free, so please be honest with me), and you respect that I do not want to be around drug usage of any kind.
If you're interested, and you'd like to meet up, send a picture with your hair color as the subject. My picture has been posted to the ad. I will not send you another one. If you want to see what my face looks like, you must send me a picture of your face. I work in a professional environment and can't afford to send pictures of my face without seeing who I'm sending to first. IF I know you in person, I'll politely let you know.
Have a good night!","2014-08-26T21:56:08-0500","2014-09-15T17:36:28-0500"," 2","m4w"
"30","http://austin.craigslist.org","ppp","4640245573","http://austin.craigslist.org/m4m/4640245573.html","4640245573","Sep 15","bttm and verse top","21","m4m","men seeking men","Atx - central north","hey yng men..looking for another top to tag friend hmu for details must be clean, ddf discr and in shape/goodlooking
looking for this wk/wknd we host no pic no aaa","2014-08-27T16:53:11-0500","2014-09-15T17:46:50-0500"," 0",NA
"31","http://austin.craigslist.org","ppp","4640249260","http://austin.craigslist.org/m4m/4640249260.html","4640249260","Sep 15","looking for nsa fun discr chill","28","m4m","men seeking men","Austb","i've got a smooth and athletic body. seven and half uncut thick and clean, i'm greenery friendly and very laid back chill
HIt me up with pics and stats under 35 only be in shape and good looking","2014-08-27T16:55:33-0500","2014-09-15T17:46:39-0500"," 0",NA
"32","http://austin.craigslist.org","ppp","4640276817","http://austin.craigslist.org/cas/4640276817.html","4640276817","Sep 15","I won't pull out!!","30","cas","casual encounters","Austin","I'll bury all 9 inches in you and stretch you around it.   And when I'm about to cum I'll grab your hips slam in deep and hold you on my dick till you are full of my hot cum. 
I'm 6 foot.  Athletic build.  Heavy cummer and thick 9 inches of dick.","2014-08-27T17:13:17-0500","2014-09-15T16:24:52-0500"," 3","m4w"
"33","http://austin.craigslist.org","ppp","4640579689","http://austin.craigslist.org/cas/4640579689.html","4640579689","Sep 15","Bear Horny for Dirty Older Man","37","cas","casual encounters","Austin","I'm looking for that dirty old man who enjoys using a younger man's body and cock for his pleasure. . .I'm not interested in a guy younger than 45 or a fit guy. . .I want to find a regular older man with a little weight on him and who is lusting for the company of a naked and horny guy. . .hoping to stay in close to central or south Austin or Del Valle...you must host...don't reply if you are in Round Rock, Pflugerville, Leander, or Cedar Park...
I'm Hispanic. . .37 years old. . .I have a hairy chest with black hair and eyes. . .I am a bear so I have a stocky build on a 5' 7"" frame. . .I have a thick 6 1/2"" circumcised cock and I shave my balls. . .I'm ready to play now...
The type of scenario I am looking for is for you to invite me to your place .. .I strip naked for you and you have your way with me. . .I don't mind kissing. . .I am experienced with oral but have limited anal experience. . .I'm open to it though if you make me really horny. . .
If you're interested, reply back with your stats, location, availability to have me over, and pics. . .thanks. . .","2014-08-27T21:05:47-0500","2014-09-15T16:23:28-0500"," 0","m4m"
"34","http://austin.craigslist.org","ppp","4642245994","http://austin.craigslist.org/cas/4642245994.html","4642245994","Sep 15","Looking for a Busty/voluptuous/bbw","30","cas","casual encounters","Austin","I absolutely love a woman with curves. I'm a well mannered, tall, handsome man and very well endowed. I'm looking to make a play date today and if we like, more play dates in the future. I have real current pictures, not just ones of my junk. Please have pictures too.","2014-08-28T22:45:24-0500","2014-09-15T16:37:52-0500"," 0","m4w"
