"","cityurl","subcl","post_id","post_link","post_data_id","post_date_raw","post_title","post_price","post_subcl","post_subcltype","post_loc","post_text","post_date","post_last_update","post_pics","post_type"
"1","http://sfbay.craigslist.org","ppp","4623692816","http://sfbay.craigslist.org/sfc/m4w/4623692816.html","4623692816","Sep 15","Single guy looking for a cuckold relationship","33","m4w","men seeking women","mission district","This isn't something you can bring up on a first date so here I am....  I know this is a highly unusual type of relationship but there must be some woman out there who would like to be in a cuckold relationship.  In case you don't know what this is, well you may want to just close this ad now.  But if you are curious keep reading.
A cuckold relationship is where a guy and girl date (or are married) and the male partner remains monogamous but the woman can sleep with others.  It's quite unusual I know.  And no I am not looking to use this as an excuse to cheat.  I would remain faithful but you could have all the fun you wanted.  
I know it's different but I do want this and I want this in the context of a relationship.  I'd love to find an openminded partner who'd be just as comfortable spending the night in, going out on the town, and still having a lover on the side.  So yes you could have your cake and eat it too.
So about me.  33, white, and I have a graduate degree and I'm a professional.  I don't want to say much more in public because of my job but I'll gladly share more if you email me.  I am openmided as to my partner's age/race but I do want a connection with someone.","2014-08-17T11:26:38-0700","2014-09-15T13:21:38-0700"," 0",NA
"2","http://sfbay.craigslist.org","ppp","4623780385","http://sfbay.craigslist.org/eby/cas/4623780385.html","4623780385","Sep 15","ALL I WANT IS REALLY BIG LOOOOONG NIPPLES","35","cas","casual encounters","ANYWHERE","Im looking for a girl who has really long round huge nipples. The bigger the better!! I dont care what your age is or what size your breast are. We dont have do do anything more than breast play and suckleing. It turns me on more than anything. 
Im a clean, tall, in great shape good looking white male. I have my own house to host in. I will send my pics when you reply. But to not waste anyones time, you must send a pic of your huge nipples. 
If you like your breast and nipples sucked, miss nursing and breast feeding, then Im here to help both of us. 
Very serious post here not spam. 
PUT THE WORDS HUGE NIPPLES IN THE SUBJECT LINE AND SEND YOUR NIPPLE PICS OR NO REPLY. THANKS :)","2014-08-17T12:20:04-0700","2014-09-15T13:16:03-0700"," 0","m4w"
"3","http://sfbay.craigslist.org","ppp","4626697046","http://sfbay.craigslist.org/eby/cas/4626697046.html","4626697046","Sep 15","im seeking",NA,"cas","casual encounters","hayward / castro valley","someone into extrem assplay, im only, more or less loooking for that today,i can host until 330 or go out, i have hep,,,,,so safe,or if any is vac, for it or had it.","2014-08-19T08:58:40-0700","2014-09-15T13:15:02-0700"," 0","m4m"
"4","http://sfbay.craigslist.org","ppp","4626924362","http://sfbay.craigslist.org/pen/cas/4626924362.html","4626924362","Sep 15","Thick White Cock Needs Wet Indian Pussy",NA,"cas","casual encounters","palo alto","I'm a nice Caucasian with a clean, thick dick and excellent oral talents.
I'm looking to find a fun, sexy Indian women for some uncomplicated physical fun.
It's fine if you're attached, discretion and privacy will be key for us both.
If you're Indian and always wanted to sleep with an educated, respectful white guy here's your chance!
Or perhaps you already know what you like then you can help me out because I respect Indian women so much for being intelligeny, classy, and of course INCREDIBLY SEXY. :)
Email me, let's chat.","2014-08-19T10:50:00-0700","2014-09-15T13:26:07-0700"," 0","m4w"
"5","http://sfbay.craigslist.org","ppp","4628762563","http://sfbay.craigslist.org/nby/cas/4628762563.html","4628762563","Sep 15","Seeking a third...ladies only","29","cas","casual encounters",NA,"We are a highly sexually charged couple looking for a girlfriend to hang out with. Preferably both in and out of the bedroom. The Mrs is definitely craving more girl on girl time. Mr is down to watch and participate as desired. We like intelligent people who take care of themselves. Both of us right are attractive and around 30 years old, and likely will fit with a cutie probably less then ten years away in either direction. We live in the North Bay...hang out in the city sometime... but don't want to travel to far other then that. Maybe we meet for drinks, no sexpectations, see how it goes?
Looking forward to meeting you!","2014-08-20T12:04:01-0700","2014-09-15T13:32:31-0700"," 0","mw4w"
"6","http://sfbay.craigslist.org","ppp","4630608877","http://sfbay.craigslist.org/eby/m4m/4630608877.html","4630608877","Sep 15","Horny for a TOP",NA,"m4m","men seeking men","pittsburg / antioch","Looking for a horny smooth and muscular top guy who can host. Would love to just get fucked. Horned up bad n needin some breeding, 5'11"" brn/brn, 180#, masculine white/latin guy, discrete, respectful, lookin for top guys who like to drill deep n hard, ned/ddf, prefer to do it natural and open to guys who've got some strong seed saved up...
hit me up if interested,","2014-08-21T13:53:30-0700","2014-09-15T13:28:48-0700"," 0",NA
"7","http://sfbay.craigslist.org","ppp","4631169171","http://sfbay.craigslist.org/sfc/m4w/4631169171.html","4631169171","Sep 15","Long Term FWB and Lots of Creativity","28","m4w","men seeking women","SfBay","I know that I am posting in the LTR section but I am absolutely looking for a long-term friendship. Someone, out there that is in the same boat as I am perhaps?
First, all cards on the table... I'm single, no kids, I am really missing the hot sizzling fun of a relationship, but without any strings attach. 
I am in shape and take good care of myself. Attractive, tall and I also make for great arm candy. If you like a nice smile, you're in for a special treat.
If you are interested there needs to be a maturity in handling this kind of friendship. I am looking for a LONG-TERM friendship and not looking for a quick one-night romp.
I am looking for someone who wants something fun, hot and uninhibited. On the washing machine, in the kitchen on the counter, facing the mirror... What ever your fancy might be. Including a few pictures as ideas.
If you'd like to make a new friend that will not BS you, maintains a fun adult friendship with you and is safe with you, then send me an email and let's chat. I would love to get to know you.","2014-08-21T22:53:23-0700","2014-09-15T13:21:46-0700"," 0",NA
"8","http://sfbay.craigslist.org","ppp","4637512890","http://sfbay.craigslist.org/sby/m4w/4637512890.html","4637512890","Sep 15","small curvy gal/no kids",NA,"m4w","men seeking women","milpitas","I want a woman who is faithful and loyal and looking for a potential relationship. I am hoping to find a woman who is compatible with me, a woman who has a high sex drive just like I do and does new things. A woman who does not cheat or sleep around. Someone who wants to hang out or watch movies, talk whatever. If this is you, send me a full picture and lets talk. I wont respond without a picture because it may be spam","2014-08-26T01:45:56-0700","2014-09-15T13:23:44-0700"," 0",NA
"9","http://sfbay.craigslist.org","ppp","4638093372","http://sfbay.craigslist.org/eby/m4m/4638093372.html","4638093372","Sep 15","kink and fun",NA,"m4m","men seeking men","hayward / castro valley","first and foremost,i have hep b,so im looking for 1 or 2 that has had it and got over it,or that  has been given vacc. for it,,,,,,,if so,it would be great to get into some mild to kinkyyyyyyyyyyyyyyyyyyy fun, even tho having vacc for hep,i still perfer condoms or gloves,,i dont pnp,or bb. Im open to as when, Let me know.","2014-08-26T10:22:35-0700","2014-09-15T13:16:15-0700"," 0",NA
"10","http://sfbay.craigslist.org","ppp","4638162334","http://sfbay.craigslist.org/sfc/cas/4638162334.html","4638162334","Sep 15","MWM looking for big tits on the side","27","cas","casual encounters","San Francisco","My wife has small tits and I absolutely crave big tits. I'm well-educated, friendly, horny, D/D free, and I commute into the city for work. So you'll have to host or we'll have to use my car or yours, or arrange other accommodations for our play time. If you just love the idea of having your big tits worshiped, or if you like the idea of helping a married man cheat to get the big tits he craves, then please reply. Send a pic and I will reciprocate. And type ""big tits"" into the subject line so I know you're real. Thank you!","2014-08-26T10:56:50-0700","2014-09-15T13:08:50-0700"," 0","m4w"
"11","http://sfbay.craigslist.org","ppp","4638460100","http://sfbay.craigslist.org/sby/cas/4638460100.html","4638460100","Sep 15","Lets get drunk at fuck","48","cas","casual encounters","mountain view","married and frustrated! if you are too or just want to get drunk and fuck, email me.","2014-08-26T13:32:55-0700","2014-09-15T13:21:06-0700"," 0","m4w"
"12","http://sfbay.craigslist.org","ppp","4640608936","http://sfbay.craigslist.org/eby/cas/4640608936.html","4640608936","Sep 15","Get your pussy eaten discreetly","38","cas","casual encounters","fremont / union city / newark","Looking to eat a yummy pussy. discreet pussy hungry MWM. I will stop by and you have me take care of you how ever you wish. you can lay back, ride my face or grab hold of my head and fuck my mouth. cum squirt and gush as many times as you wish then send me on my way. Good looking safe sane discreet guy looking for nothing in return. Only looking to service your personal oral needs.
you must be clean safe and std free. discretion assured","2014-08-27T19:33:54-0700","2014-09-15T13:15:58-0700"," 3","m4w"
"13","http://sfbay.craigslist.org","ppp","4641826589","http://sfbay.craigslist.org/scz/m4m/4641826589.html","4641826589","Sep 15","you're a nicely hung guy who needs a b/j, i'm hosting",NA,"m4m","men seeking men","scotts valley","older guy here...std free...bi...cool...considerate....like sports, outdoors, etc...
i'm looking for a man who wants someone who'll give you
some awesome oral attention...suck your cock, lick your balls, etc...
put on some porn if you want, while i work up an intense release for you...
prefer hung cut cock caucasian guys...discreet local and drug free...
prefer friendly, clean and sober guys...
these pics are me, send me a pic if you can...
i can host today until 4pm...thanks","2014-08-28T14:48:11-0700","2014-09-15T13:17:39-0700"," 2",NA
"14","http://sfbay.craigslist.org","ppp","4642317042","http://sfbay.craigslist.org/sby/cas/4642317042.html","4642317042","Sep 15","eating ass and deep throating dick",NA,"cas","casual encounters","san jose downtown","I'll swing by for an awesome deep throat blow job and an amazing rim. You can suck me too if  thats what you want. Just be under 30, clean and in good shape. Any race. +++ for twinks, college ... Younger the better. Quickie, blow and go.","2014-08-28T22:38:26-0700","2014-09-15T13:14:56-0700"," 0",NA
"15","http://sfbay.craigslist.org","ppp","4642377270","http://sfbay.craigslist.org/sby/cas/4642377270.html","4642377270","Sep 15","You host i suck","33","cas","casual encounters","san jose west","Hey cl guys over in ssj today and seeing if anyone can use a bj. If you like to meet up get back to me.","2014-08-29T01:47:20-0700","2014-09-15T13:30:12-0700"," 2","m4m"
"16","http://sfbay.craigslist.org","ppp","4643983069","http://sfbay.craigslist.org/sby/m4m/4643983069.html","4643983069","Sep 15","Blow your juicy cock!","30","m4m","men seeking men","san jose downtown","if u like getting sucked and you can host, hit me up! Asian here with hot mouth! Got poppers here to get things hot!","2014-08-30T05:02:02-0700","2014-09-15T13:03:15-0700"," 0",NA
"17","http://sfbay.craigslist.org","ppp","4644434870","http://sfbay.craigslist.org/eby/cas/4644434870.html","4644434870","Sep 15","Elegant Sexplorations",NA,"cas","casual encounters","berkeley","Imagine yourself and your lover dressed in your most suggestive yet classy wear........surrounded by scores of other sexy scantily clad people
Now stop imagining and join us. We are seeking select couples to join us. If you would like to be considered please send us CLEAR pictures of the BOTH of you. Face and body shots are appreciated. We understand some people can not send face pictures because of high profile jobs. If you must blur the pictures, please don't blur the whole thing.","2014-08-30T10:24:06-0700","2014-09-15T13:32:17-0700"," 0","mw4mw"
"18","http://sfbay.craigslist.org","ppp","4645693020","http://sfbay.craigslist.org/sfc/m4m/4645693020.html","4645693020","Sep 15","I'll take your str8 load","28","m4m","men seeking men","haight ashbury","Kick back and enjoy while I suck and swallow that load. Are you a Total Top? let's fuck! Just looking for a good time. Nice hairy buns here if you like that.","2014-08-31T09:38:05-0700","2014-09-15T13:23:22-0700"," 0",NA
"19","http://sfbay.craigslist.org","ppp","4646874389","http://sfbay.craigslist.org/pen/stp/4646874389.html","4646874389","Sep 15","Gym Buddy? Mutual Motivation? Thats what i Need! You?","30","stp","strictly platonic",NA,"So...
If you opened it you are obviously in the same boat. 
Let's get fit together. 
- Early Morning Runs?
- Late Afternoon/Night Gym workouts?
- weekend hikes? 
I could use someone nearby that really wants to get on it. 
I'm not fat, nor ugly, nor am I using this as an excuse to date or fool around. 
I'm genuinely looking for a workout buddy. 
I'm not even out of shape, I play soccer and I feel like I need to get toned, work on my upper body. I already have thick/muscular legs from soccer and I will like someone someone to motivate each other And workout together. 
We could trade pictures, meet somewhere in public before we start anything. 
I'm in San Carlos, member of the 24hrs fitness. 
If you are in great shape and like motivating/helping people get fit, and want to give me some tips, exchange others, eating habits, things that have worked for you and don't mind sharing. That would be great. 
I played college level soccer, so I'm very competitive and like a challenge. 
Lets get started!!! ;)","2014-09-01T07:49:27-0700","2014-09-15T13:21:41-0700"," 0","m4w"
"20","http://sfbay.craigslist.org","ppp","4647914952","http://sfbay.craigslist.org/sby/cas/4647914952.html","4647914952","Sep 15","CD SLUT looking for well endowed men/other cd, couples for pnp, rolepl","40","cas","casual encounters","san jose east","Hi, i am a semi passable cd slut here in san jose looking for cd's who want to dress and play together or to double a well endowed males pleasures.please let me know asap and include a recent pic, so if you want to have some kinky fun  let me know  thank you","2014-09-01T18:26:49-0700","2014-09-15T13:08:12-0700"," 3","t4m"
"21","http://sfbay.craigslist.org","ppp","4648732570","http://sfbay.craigslist.org/sfc/cas/4648732570.html","4648732570","Sep 15","?..? .ANY STR8, Bi curious GUY like EDGING TORTURE ? ???????",NA,"cas","casual encounters","San Francisco","m4m
Str8 edge torture -
ANY straight, white/latin/middle eastern, fit 20 to 40's guy have fantasy to explore
intense edging or milking.  I'm looking for a man who is comfortable and being lubed up and
edged slowly stroking and finally released. Hands only and nothing anal.
Performed by late 30's smooth/lean/slender, easy going discreet only asian guy.
Please be the real deal, discreet and send pic. for response. Please provide stats. ( no minors please...must state age..!!)
Put ""edging"" on headline. One liners or no stats will be deleted and assumed as spam.
If you had responded before and not follow through..please don't waste time.","2014-09-02T10:01:22-0700","2014-09-15T13:11:43-0700"," 2","m4m"
"22","http://sfbay.craigslist.org","ppp","4649024229","http://sfbay.craigslist.org/eby/m4m/4649024229.html","4649024229","Sep 15","seeking some butt play.","49","m4m","men seeking men","san leandro","Looking for someone that is into and would like to do some vers, fisting,,,seeking small and exper. hands  safe and no fluid exchange,everything condomed and or gloves.Can host before 4,otherwise travle,or meet somewhere.Hep b here, so seeking sfe,someone that had it,,,vacc for it.","2014-09-02T12:23:56-0700","2014-09-15T13:14:44-0700"," 0",NA
"23","http://sfbay.craigslist.org","ppp","4649025203","http://sfbay.craigslist.org/eby/m4m/4649025203.html","4649025203","Sep 15","seeking strech( read post)","49","m4m","men seeking men","hayward / castro valley","Looking for some mild to extrem, your choice butt play, mutal!,i have gloves and lube, not looking for anything that involves fuild exchange.Cannot host. seeking thos that  have had vacc for hep b ,","2014-09-02T12:24:28-0700","2014-09-15T13:14:54-0700"," 0",NA
"24","http://sfbay.craigslist.org","ppp","4649563451","http://sfbay.craigslist.org/sby/m4m/4649563451.html","4649563451","Sep 15","older for younger ...","35","m4m","men seeking men","San Jose","Looking for young asian boys/men 18-25... Im very oral and love to suck, deep throat, rim, make out... Im a top but perhaps i can bttm for the right one. You must be slim, hygienic, and have good/decent looks. Cut or uncut doesnt matter to me. All races welcome as well. Please be real and serious. 
My stats are posted. I am very chill, easy going and am very serious. I am smooth naturally and and am very hygienic. Ill be looking till i find a match..
Thanks for reading.","2014-09-02T17:49:00-0700","2014-09-15T13:13:13-0700"," 0",NA
"25","http://sfbay.craigslist.org","ppp","4650848158","http://sfbay.craigslist.org/sfc/m4m/4650848158.html","4650848158","Sep 15","Daddy Bear  For White/Hispanic Men.",NA,"m4m","men seeking men",NA,"Masc goodlooking Wm 54  Muscled thick lil beefed  but fit built big strong nice..worksout a lot. 6'3 265..blu collar .cleancut type..not a body builder and not a big burly bear guy...medium hairy...blu collar guy...single gay..more jock type. DD free/no pnp, nice normal stable grounded guy. Very sweet. Educated  sucessfull career guy. Lives in EB...in SF/EB  NB all the time.
35/36w  medium hairy cleancut big nice rocked hard legs, calves..nice arms, rocked back..big hands..sise 12 boot/shoe....good self care. No issues..dd free non smoker, no pnp/no 420 etc...i like good beer. lol.
Seeking a friendship buddy thing...FWB's is cool. More if we like it too. Not out for a one time anony random hookup at all. Not happening.
Looking for a gl stable  WM or Hispanic guy...over 24.....up  prefer men to 40ish..seems 30 somethings are great....I tend to like cubs, cubbies, jocks, blu or wht collar and mid west corn studs,preppy, military guys professional guys..closeted or out..no matter..etc.... Gay..guy guy/masc  butched  etc
Lots of intrests to share if that catches your eye too.
Must be Gay..not into newbies, curious or Bi....questioning guys. No pnp/no 420  dd free and non smokers please.
Up to hangout sometime, watch baseball....football, eats, beers etc too.","2014-09-03T13:31:39-0700","2014-09-15T13:22:47-0700"," 0",NA
"26","http://sfbay.craigslist.org","ppp","4650994920","http://sfbay.craigslist.org/eby/m4m/4650994920.html","4650994920","Sep 15","Hey Needy College Guy or Skater Boy... Can I Pull Down Your Pants?","46","m4m","men seeking men","berkeley","Looking to host a horny young guy this evening for some oral fun. I have a very nice private place and total discretion is assured, open to a regular thing, too, if we click. I am helpful and generous. You just drop by, relax and let me do the rest. Totally chill and NSA, nothing too wild, maybe a shoulder rub (I'm really good!), some stroking, and sucking. I can go slow or fast, edge you, and can swallow! Looking for a young guy, like 18-30 and std free, HIV neg as I am. Gay, Str8, Shy, Bi-, inexperienced, small cock, big cock, smooth, hairy, its all fine by me. I prefer guys who are thin, buff, lean, or skinny. Nonsmokers, unshaven, and circumcised preferred.
Please send a pic and stats in your first email. Please put something interesting in the subject line. We'll talk and set something up. Hope to hear from you soon!","2014-09-03T14:58:43-0700","2014-09-15T13:33:12-0700"," 0",NA
"27","http://sfbay.craigslist.org","ppp","4650995629","http://sfbay.craigslist.org/eby/m4m/4650995629.html","4650995629","Sep 15","Massage Sought","45","m4m","men seeking men","berkeley","I am looking for a massage from a younger man. I am a clean white guy in my forties with good hygiene and a massage table.
Please have strong hands. Please send a pic and stats.","2014-09-03T14:59:10-0700","2014-09-15T13:30:50-0700"," 0",NA
"28","http://sfbay.craigslist.org","ppp","4651324675","http://sfbay.craigslist.org/eby/m4m/4651324675.html","4651324675","Sep 15","Looking for a Muscular Guy",NA,"m4m","men seeking men","concord / pleasant hill / martinez","I'm a nice guy, bottom looking for a hot muscular athletic top guy. Looking to take things to the bedroom. Love kissing and hot sex. I am only compatible with a very masculine total top. Strong preference for smooth chests, big feet and go tees but open to all, and guys in good shape and bigger/stronger than me. Love a guy with silky smooth skin. Perhaps drink some wine, food, start off with a nice massage, grinding cocks, kissing, rolling all over the bed. Love that intense moment where we are just fucking like bunnies and love it when a guy stares into my eyes as he is cumming. Love romantic guys and romantic evenings with candles, wine and kissing, spooning. Sleep over would be fun.
Me: Good looking 33 year old guy guy. 5'11"", 175, nice ass (have been told:), friendly, able to carry a conversation, wine drinker and love mixed drinks too, make dinner too, HIV-. I am looking to meet guys who are tops, fit, masculine, muscular, like smooth bodies but some hair is fine. Send me an email and we'll take it from there. Sleep over is ideal:) Last but not least, you must host, thanks.","2014-09-03T18:55:27-0700","2014-09-15T13:21:37-0700"," 0",NA
"29","http://sfbay.craigslist.org","ppp","4651515683","http://sfbay.craigslist.org/nby/cas/4651515683.html","4651515683","Sep 15","at your service...","29","cas","casual encounters","santa rosa","I would love to meet up with a fun open minded couple today. I'm a respectful massage therapist and my sexual range spans from mild play to super kinky fuck-a-thons...depending on what you want. I love being invited into other people's fantasy worlds and helping them realize the desires that live there. Shoot me an email with a bit about you guys and i'll do the same.","2014-09-03T22:39:41-0700","2014-09-15T13:31:49-0700"," 0","m4mw"
"30","http://sfbay.craigslist.org","ppp","4651520170","http://sfbay.craigslist.org/sby/stp/4651520170.html","4651520170","Sep 15","Naked Photography Art Project: Female Model Needed","32","stp","strictly platonic","san jose south","Hello! I'm a professional photographer of over eight years, shooting abandoned subjects such as hospitals, jails, military facilities, railways, desert landscapes, and historic locations. I've shot both informal nudes and non-nudes of friends in the past.
I am looking for one or two on-going female friends/models to help with my next photography project I've been visioning for a while now. The photos shown above are examples of the various locations and styles I'm wanting to shoot, but the primary focus will be of the location and not so much of the model.
Your name/identity will remain anonymous and will have the option to not show your face (although I discourage this, but respect your privacy and can work around that). The locations are in areas where it will be safe, indoors or outdoors, away from public view, and are located around the SF and Monterey Bay Areas. -- Above everything, I always place personal respect and safety as my priorities when shooting in locations like these.
I welcome anyone of any shape, size, skin tone, and within the age of 18-40 please. I cannot pay for your time, but can provide copies of the originals for your portfolio or private collection.
Photos will only be published on my Flickr account (with permission/review) and will be age-restricted per Flickr Terms of Use. No photos will be publically displayed or be offered for sale online or offline without the express permission and agreement of both myself and you (the model).
Any questions or to request to meet in person and discuss the project, please send me a message! If you have samples of photos from past projects you've done, I welcome you to send them.
Hope to hear from you soon! -- Have a great day!
=====================================
Please Note: This ad is only intended to find people willing to pose fully naked or semi-naked in an artistic fashion at abandoned locations and natural landscapes and to expand their portfolio. This is not an ad for sex nor will there be any opportunities as such. This is strictly a photo shoot with one model and one photographer. Model may bring a friend to the shoot if they wish. -- Any responses with links to sex sites or credit check systems will be reported to CL as spam and blocked.
The photos shown in this ad are examples of what I'm looking for with this project, and are indexed from Google Image Search (GIS).
This ad conforms to the Craigslist TOU in full. Any questions regarding the ad, please contact directly before flagging. Thanks.
**I do not claim any credit for the photos taken above.**","2014-09-03T22:48:36-0700","2014-09-15T13:02:20-0700","15","m4w"
