"","cityurl","subcl","post_id","post_link","post_data_id","post_date_raw","post_title","post_price","post_subcl","post_subcltype","post_loc","post_text","post_date","post_last_update","post_pics","post_type"
"90","http://utica.craigslist.org","ppp","4657762679","http://utica.craigslist.org/m4w/4657762679.html","4657762679","Sep 14","Older guy looking for younger woman to date","38","m4w","men seeking women","Upstate, NY","Looking for a woman 18-25 to date and have a friendship with and possible long term relationship not just looking for hookups only.  I love the outdoors, staying in, talking, texting whatever you want to do im good with.    BBW ok, shy ok Im a little also but not much anymore I overcame it over the years but I do know it can be terrifying meeting someone new of the opposite sex not knowing what to do.  Disease and Drug free, 420 friendly.   Send pic and I will send one back.","2014-09-08T08:28:39-0400","2014-09-14T08:48:19-0400"," 0",NA
"91","http://utica.craigslist.org","ppp","4658209115","http://utica.craigslist.org/cas/4658209115.html","4658209115","Sep 14","No Prince Charming",NA,"cas","casual encounters","20 mile radius of Utica","I'm definitely not a handsome prince, but I bet I can wake your big dick up with a kiss. OK, it'll be a bit more than a kiss, but let me give it a try.","2014-09-08T13:01:10-0400","2014-09-14T16:12:19-0400"," 0","m4m"
"92","http://utica.craigslist.org","ppp","4658827524","http://utica.craigslist.org/m4w/4658827524.html","4658827524","Sep 15","Chocolate Gentleman Seeking Lunch Date 9/16","40","m4w","men seeking women","Utica/Rome/Syracuse","Ladies thank you for taking the time to read my posting. What I'm seeking is truly innocent without any strings or expectations. Are you interested in a lunch date with an attractive black male without expectations? I'm interested in a lunch date this week at a place of your choosing for drinks and conversation. Do you have something you'd like to vent about? Home, work, possibly family? I'd like to dine with a woman at least 30 years of age, open to any race or relationship status.
I am a 40 year old gainfully employed black male in Utica area. I'm athletic, attractive and just looking for a lunch date. Lunch is my treat just be willing to engage in mature, playful conversation.
Please enclose face pic and a little about you with your email. I'm very real and this is not a ploy for sex. Life has been a little hectic and I'm looking for a caring ear. Looking forward to chatting. I'm not interested in your relationship status so married, attached are welcome no drama here.","2014-09-08T18:34:45-0400","2014-09-15T09:57:54-0400"," 0","m4w"
"93","http://utica.craigslist.org","ppp","4659456822","http://utica.craigslist.org/m4m/4659456822.html","4659456822","Sep 14","Lonely Herkimer College Male seeks Male lunch/hangout friend/partner.","20","m4m","men seeking men","Herkimer College","I am a 20 year-old college student attending Herkimer College this fall and I'm looking for new friends! I'm a very interesting person and I try my best to be thoughtful and nice to others, as all of my friends bring out the best in me.
I am a Communication Arts-New Media Major, I switched over to that from Teaching, because I decided I no longer want to work in a classroom, but on television. I want to be the next Ellen or Oprah because they make people happy and inspire a ""pay-it-forward"" attitude.
I'm relationship oriented, and I'm quite honestly looking for a partner. Let's have lunch or something on campus! :)","2014-09-09T08:52:29-0400","2014-09-14T19:52:09-0400"," 0",NA
"94","http://utica.craigslist.org","ppp","4659654670","http://utica.craigslist.org/cas/4659654670.html","4659654670","Sep 14","female friend looking to enjoy the company of a few guys",NA,"cas","casual encounters","Uitca","I have a very nice female friend that wants to full fill a fantasy of being taken care of by a group of guys. This will be done in a motel and hoping to schedule this on a every half hour schedule so she can enjoy. if interested reply with pic, stats, cell to move this along faster. This will be done soon. If information that is asked is not in reply, you wont be answered back. She is fun, clean, nice looking and not heavyset. That's all you need to know.","2014-09-09T11:08:00-0400","2014-09-14T19:31:57-0400"," 0","w4mm"
"95","http://utica.craigslist.org","ppp","4660068173","http://utica.craigslist.org/cas/4660068173.html","4660068173","Sep 15","Seek woman to service orally on a regular basis",NA,"cas","casual encounters","rural utica rome","Seek naughty sensual fun.
Be open about your situation, interests, and needs. 
Clean, discreet white married male age 56.
Looking for a clean, discreet female to service orally during the day.
All ages, race, and body types OK. Non smoker preferred.
Cannot host but can travel most weekdays and some Saturdays before 4 pm
Casual meetings first for coffee, lunch. No pressure of any kind. Nothing required in return.
Looking for someone to meet with on a regular basis. I'm Turned on by the naughtiness of it.
Secrecy required. No phone calls, no face pictures, sorry. Feel free to ask questions.
Thank you for reading this posting","2014-09-09T14:42:47-0400","2014-09-15T09:07:51-0400"," 0","m4w"
"96","http://utica.craigslist.org","ppp","4660527449","http://utica.craigslist.org/cas/4660527449.html","4660527449","Sep 14","sex and blow","50","cas","casual encounters","Canastota","Looking for an attractive BBW, Average, or Slender  woman to come to my place for some hot fun! I want to make love to you and would love a blow-job to completion,,, i would of course return the favor, i have never had a b-j to completion,  i am single and will host at my place, prefer a local girl that can spend a few hrs having fun and not worry about rushing home. I am d&d free, you be d&d free as well, please send pics and a little info about yourself and a time you would like to come, Hope to hear from you soon.","2014-09-09T19:14:49-0400","2014-09-14T12:54:11-0400"," 0","m4w"
"97","http://utica.craigslist.org","ppp","4660529847","http://utica.craigslist.org/m4w/4660529847.html","4660529847","Sep 14","Looking for my soulmate","50","m4w","men seeking women","Canastota","Hi Ladies, i am looking for a faithful, big hearted, loving woman. Must be faithful-no liars or cheaters, i'm to old to be playing games, age is not important-its just a number to me, i am a very nice loving caring man, i like holding hands, cuddling, kissing, { even in public }, i cook, clean, i'll even watch chick flics with you, lol, i'll treat you like my queen. I am looking for a long-term relationship - in other words "" the rest of our lives "", so please be serious when u reply. I am 6ft 1in tall, 200 lbs., wear my hair cut very short and wear a hat most of the time, lol, would like a woman who is open minded in the bedroom and not afraid to be as sexual as you want. I know i'm forgetting a lot of things so if u have any questions please feel free to ask. send pics and i will send mine, thank you very much and hope to find my angel soon.","2014-09-09T19:16:32-0400","2014-09-14T12:53:54-0400"," 0",NA
"98","http://utica.craigslist.org","ppp","4660532861","http://utica.craigslist.org/cas/4660532861.html","4660532861","Sep 14","BBW, Slender, or average bodied female wanted","50","cas","casual encounters","Canastota","Looking for an attractive submissive female for hott sex tonight! must like anal creampie and pussy creampied or let me dump my load in your mouth!?? I am drug and disease free - u b 2, no prosti-tots and no i will not pay,,, send pics and a way to contact, looking for asap tonight! thank you and hope to hear from u soon. ,,, P.S.  put your favorite color in the subject line or i will delete, thanks.","2014-09-09T19:18:39-0400","2014-09-14T12:53:37-0400"," 0","m4w"
"99","http://utica.craigslist.org","ppp","4660539536","http://utica.craigslist.org/cas/4660539536.html","4660539536","Sep 15","In need of a BJ","47","cas","casual encounters","Utica area","In need of a BJ, we can work something out, you take care of me and I will take care of you! No guys!  Reply with pic and when available. You must be able to host.","2014-09-09T19:23:26-0400","2014-09-15T17:14:09-0400"," 0","m4w"
"100","http://utica.craigslist.org","ppp","4661135318","http://utica.craigslist.org/cas/4661135318.html","4661135318","Sep 14","Insertion",NA,"cas","casual encounters","Utica","I am looking for a girl that has s fetish for extreme insertion.  Specifically I would like a girl that can fist her asshole of pussy.  I don't care about how you look or age, just be thin.  Respond with pics please.","2014-09-10T09:35:10-0400","2014-09-14T09:24:47-0400"," 0","m4w"
"101","http://utica.craigslist.org","ppp","4661373019","http://utica.craigslist.org/cas/4661373019.html","4661373019","Sep 13","Need bbc","33","cas","casual encounters","Casino","My wife needs a real bbc to stuff u white pussy. I will not be involved just watch and listen. Ur pic gets hers. Please be real. Put real as subject. She really need a great fucking!","2014-09-10T11:55:34-0400","2014-09-13T19:00:03-0400"," 0","mw4m"
"102","http://utica.craigslist.org","ppp","4661373400","http://utica.craigslist.org/cas/4661373400.html","4661373400","Sep 13","Petite Younger guys in Old Forge","48","cas","casual encounters","Old Forge","Hey boys... Work in the area a lot and seeking a younger slim hang bud/ playmate. HWP guy who can carry on a conversation/chill and have some fun. Can host or travel and seeking locally only. But seeking someone playful, open minded that's wants more than a blow and go. I have pics to share and lets talk. Me..48/masc./m 5'7"" 150 br and br 7 cut slim build..petite guys to the front of the line!","2014-09-10T11:55:46-0400","2014-09-13T18:34:50-0400"," 0","m4m"
"103","http://utica.craigslist.org","ppp","4661572600","http://utica.craigslist.org/cas/4661572600.html","4661572600","Sep 15","Spanking Fun","56","cas","casual encounters","Rural Utica","Discreet retired married male, age 56. Clean, non smoker.
Looking for a naughty minded female interested in traditional type spankings. 
Nothing vicious or extreme, fun, role play or discipline.
No pressure of any kind. Casual discussion first, then possibly meet.
All limits totally respected.
Other ""fun"" is also of interest, but not required.
Days best before 4pm. Discretion required and assured. No face pictures, texts or phone calls. Correspondence, then meet casually for lunch, coffee. As previously stated, No pressure of any kind.","2014-09-10T13:36:11-0400","2014-09-15T10:21:12-0400"," 0","m4w"
"104","http://utica.craigslist.org","ppp","4661744213","http://utica.craigslist.org/cas/4661744213.html","4661744213","Sep 15","travelling today...you host I blow..more",NA,"cas","casual encounters","utica areas","I'm going to be in the Utica area today from about 1 PM - 6 PM or so.  Any clean guys want a fantastic bj... hit me up. If your a top I might consider bottoming!!. I'm 36 and very clean and give very good head. Not into endless emails or drama. Prefer 19-35, HWP.  Please be clean and ddf.  I'll stop, play, and leave...  Thanks.","2014-09-10T15:05:23-0400","2014-09-15T12:46:23-0400"," 0","m4m"
"105","http://utica.craigslist.org","ppp","4662287777","http://utica.craigslist.org/cas/4662287777.html","4662287777","Sep 15","Big Thick Cock  Wanted....","44","cas","casual encounters","Rome/Utica","Looking for guys 18 to 40 with nice big Thick cocks.....I love to suck and fuck.....versatile masc man here.......can host.....send pic and stats in first email or no reply","2014-09-10T20:49:39-0400","2014-09-15T07:50:26-0400"," 0","m4m"
"106","http://utica.craigslist.org","ppp","4662294960","http://utica.craigslist.org/cas/4662294960.html","4662294960","Sep 14","Need a sweet tight man pussy, must come to me.","19","cas","casual encounters","South of utica a bit","Im 20, 8.5 inches. Have a spot to meet,  im horny with a big load, need any bottom that wants to take a big thirsty cock . send ass pic, or some kinda pic, ill respond with a pic.","2014-09-10T20:55:18-0400","2014-09-14T22:07:34-0400"," 0","m4m"
"107","http://utica.craigslist.org","ppp","4662733647","http://utica.craigslist.org/mis/4662733647.html","4662733647","Sep 14","Don't let your dick control you",NA,"mis","missed connections","Utica","You used to say ""Control your dick, don't let your dick control you"" but you had amazing control over yours & could even make it move around in circles. Last time I saw you was in the men's room at the State Bldg, years ago. I don't even know if you're still in the area, but would really like to see you again. You told me your name was Ron.","2014-09-11T09:09:08-0400","2014-09-14T16:11:09-0400"," 0","m4m"
"108","http://utica.craigslist.org","ppp","4662900639","http://utica.craigslist.org/cas/4662900639.html","4662900639","Sep 14","wanna do a gang bang",NA,"cas","casual encounters","any","I have a group of guys that love to do gang bangs.   If you are willing ti do a gang bang we will take care of you with what ever you need.  Please put your cup size in the subject line and send a pic and a number to text makes things go faster","2014-09-11T11:03:04-0400","2014-09-14T15:00:58-0400"," 0","mm4w"
"109","http://utica.craigslist.org","ppp","4663887006","http://utica.craigslist.org/cas/4663887006.html","4663887006","Sep 14","first time","24","cas","casual encounters","utica","Looking for my first experience with a couple. I am nervous and a little shy but would love for a couple to break me out of my shell. Once I'm comfortable pretty much anything goes with me, no pain though. Can be a one time thing or an ongoing thing if we click. Little about me I am 6'2 , brown hair, brown eyes, around 7"" cut. Also be drug and disease free, be discreet. I am bi curious but would only explore with a couple so no single guys. So if interest text me at three one five five three four eight two six eight and lets talk and see where it go. Please don't waste my time and I will not waste yours","2014-09-11T20:46:40-0400","2014-09-14T00:50:12-0400"," 0","m4mw"
"110","http://utica.craigslist.org","ppp","4663894051","http://utica.craigslist.org/cas/4663894051.html","4663894051","Sep 14","college student","23","cas","casual encounters","utica","hey whats up im a 23 year old college student, im 6'2ft, 180 lbs and 7.5 in uncut. I'm looking for a FWB, age or race doesnt matter. Please be clean and disease free. I love eating a girl out and just looking to please you and have fun. So if interested please text three one five five three four eight two six eight. Please dont waste my time cuz I wont waste yours","2014-09-11T20:52:28-0400","2014-09-14T00:50:04-0400"," 0","m4w"
"111","http://utica.craigslist.org","ppp","4664139741","http://utica.craigslist.org/cas/4664139741.html","4664139741","Sep 14","Sub Bttm For Late Night","20","cas","casual encounters","Colgate","submissive bottom looking for dominant masculine top to take over and make me his bitch. do whatever you want to me, i'm yours to order around. looking for tonight. me: 6'2"", 185, 6"" cut, white, semi hairy","2014-09-12T01:24:23-0400","2014-09-14T02:22:41-0400"," 2","m4m"
"112","http://utica.craigslist.org","ppp","4664330547","http://utica.craigslist.org/cas/4664330547.html","4664330547","Sep 15","Office Fun !!!",NA,"cas","casual encounters","315/Cny","Clean, Discreet, private male...looking for ddf fun female for office fun.
Secratary roll play! Or co worker.....!
Female must be clean and fun...discreet and private....
Put ""office"" in subject and a few pics if you are serious about the job..;)
Be willing to meet, not looking for long emails..Jst some fun...","2014-09-12T09:04:06-0400","2014-09-15T08:06:41-0400"," 0","m4w"
"113","http://utica.craigslist.org","ppp","4664334738","http://utica.craigslist.org/cas/4664334738.html","4664334738","Sep 15","Discreet Bull for her","42","cas","casual encounters","Cny/upstate","Str8, DDF, dominate White male 6'3"", 230lbs. Bull for discreet female. 
No games and no male to male..
Your pics and location on first email..see if we can start something mutual.
Cny are...willing to travel for right female ..
Have her beg me to do her..
maybe long term relationship..
not spam..real male...
no bi males need to reply...!!!
Put ""10"" in subject..","2014-09-12T09:07:52-0400","2014-09-15T08:07:04-0400"," 0","m4mw"
"114","http://utica.craigslist.org","ppp","4664536123","http://utica.craigslist.org/cas/4664536123.html","4664536123","Sep 14","any clean woman want her ass or pussy licked?","52","cas","casual encounters","Herkimer","i see others on here offering this, so i figure, why not? Not being licked lately or enough? Maybe can help. Be freshly showered and discreet. Married preferred. Will lick anyplace you want including ass.
other stuff too, just ask","2014-09-12T11:19:59-0400","2014-09-14T12:26:46-0400"," 0","m4w"
"115","http://utica.craigslist.org","ppp","4664835538","http://utica.craigslist.org/cas/4664835538.html","4664835538","Sep 15","Seek Ass for quickie fun DAYS","56","cas","casual encounters","Utica","Clean, older male Looking for a discreet bottom person for anal quickie. All ages and body types ok.
I can not host, out doors, van  etc needed.
Days before 4 pm.
Safe only, no bare backing.
No pics. sorry","2014-09-12T13:53:26-0400","2014-09-15T09:08:55-0400"," 0","m4m"
"116","http://utica.craigslist.org","ppp","4665879963","http://utica.craigslist.org/cas/4665879963.html","4665879963","Sep 15","HUGE COCK FOR YOU",NA,"cas","casual encounters",NA,"EMAIL ME! im interested in meeting today! im sexy and fit! i have a webcam too and i love mfm","2014-09-13T08:10:12-0400","2014-09-15T15:43:51-0400"," 0","m4mw"
"117","http://utica.craigslist.org","ppp","4665883144","http://utica.craigslist.org/cas/4665883144.html","4665883144","Sep 15","HUGE COCK FOR YOU",NA,"cas","casual encounters",NA,"FREE ALL DAY EMAIL ME! ill come over im huge email me with a pic or no response!!!!!!!!!!!","2014-09-13T08:14:58-0400","2014-09-15T16:01:14-0400"," 0","m4w"
"118","http://utica.craigslist.org","ppp","4665940102","http://utica.craigslist.org/cas/4665940102.html","4665940102","Sep 15","Twofer",NA,"cas","casual encounters","Utica area","I'm looking for two friends/partners who would like to get sucked together. I want to put both your dicks in my mouth at once. Tried it one time, but one of the guys couldn't stay hard, so it's important that you are relaxed with each other and don't mind your dicks rubbing together. I can host. I am older, prefer younger. Just from a logistical point of view, it would probably work better if you both have long dicks and/or don't have big bellies.","2014-09-13T09:19:44-0400","2014-09-15T14:02:48-0400"," 0","m4mm"
"119","http://utica.craigslist.org","ppp","4666619687","http://utica.craigslist.org/cas/4666619687.html","4666619687","Sep 13","looking for friends","49","cas","casual encounters","Oneida","Looking for friends to email an maybe text would like younger than me email me let's chat","2014-09-13T16:03:10-0400","2014-09-13T16:03:10-0400"," 0","m4m"
"120","http://utica.craigslist.org","ppp","4666717939","http://utica.craigslist.org/cas/4666717939.html","4666717939","Sep 13","Nice big dick","39","cas","casual encounters","New Hartford Ny","U have a thick dick that needs a good sucking can host private discreet bi wm real guy rain finally stopped ha","2014-09-13T17:04:51-0400","2014-09-13T17:04:51-0400"," 0","m4m"
"121","http://utica.craigslist.org","ppp","4666720995","http://utica.craigslist.org/cas/4666720995.html","4666720995","Sep 13","new to town.... make each other cum","21","cas","casual encounters","utica","College student.Verse. Black. Horny and freaky. looking for somebody to get off with. 6'5, 170, ddfree. no games. At least have a dick pic. Looking for today.","2014-09-13T17:06:53-0400","2014-09-13T17:06:53-0400"," 0","m4m"
"122","http://utica.craigslist.org","ppp","4666788917","http://utica.craigslist.org/cas/4666788917.html","4666788917","Sep 13","Sex and more sex",NA,"cas","casual encounters","Utica","Hi there looking for a great time in the bedroom with a man with nice thick cock sixoneninethreeeightthreethreethreefourone","2014-09-13T17:53:20-0400","2014-09-13T17:53:20-0400"," 0","w4m"
"123","http://utica.craigslist.org","ppp","4666800224","http://utica.craigslist.org/cas/4666800224.html","4666800224","Sep 13","young cub looking for hung bear","22","cas","casual encounters","new hartford","I'm a bottom looking for a hung bear to make me his bitch...I'm a 22 yo cub...your pic gets mine...be hung and horny","2014-09-13T18:01:17-0400","2014-09-13T18:01:17-0400"," 0","m4m"
"124","http://utica.craigslist.org","ppp","4666812279","http://utica.craigslist.org/cas/4666812279.html","4666812279","Sep 13","Bottom seeking top at hotel tonight","30","cas","casual encounters","Microtel/Turning Stone","Hey guys,
In town from Toronto and craving cock. Would love to suck and bottom.
I'm straight/bi and would prefer someone the same and clean. Under 35 please.","2014-09-13T18:09:53-0400","2014-09-13T18:09:53-0400"," 0","m4m"
"125","http://utica.craigslist.org","ppp","4666824093","http://utica.craigslist.org/cas/4666824093.html","4666824093","Sep 13","i just need a blow job please","23","cas","casual encounters","New Hartford","I will be clean and shaved and I can return the favor if you wish but that's it.
I would appreciate it if you can reply with a photo but its optional.","2014-09-13T18:18:35-0400","2014-09-13T18:18:35-0400"," 0","m4w"
"126","http://utica.craigslist.org","ppp","4666829866","http://utica.craigslist.org/cas/4666829866.html","4666829866","Sep 13","chubby crossdresser","44","cas","casual encounters","utica","single back male wanted to know is their any chubby crossdresser or female guy bear that like to wear latex gloves and that wear sexy outfit","2014-09-13T18:22:47-0400","2014-09-13T18:22:47-0400"," 0","m4m"
"127","http://utica.craigslist.org","ppp","4666848573","http://utica.craigslist.org/cas/4666848573.html","4666848573","Sep 13","Suck my cock","27","cas","casual encounters","Utica","Looking for a woman to suck my cock. 
I love it more than anything. Please be between ages of 18-35. Curvy girls are just fine (even preferred) but you know if you're curvy or just big. 
Must be discreet. 
Send a pic with face in it. 
Put ""brownie recipe"" in the subject.","2014-09-13T18:36:54-0400","2014-09-13T18:36:54-0400"," 0","m4w"
"128","http://utica.craigslist.org","ppp","4666867932","http://utica.craigslist.org/cas/4666867932.html","4666867932","Sep 13","Bored and Hosting at my hotel","35","cas","casual encounters","Oneida","Hosting at my Hotel this weekend.
Just an easy going passionate guy looking for some company and fun. Up for anything really, even just chatting, or getting sweaty, sucking down a hot load. Very passionate, luv to make out, luv to get a guy off, sucking(tasty), getting sucked, into almost anything, mostly bottom here. Into all types, young, old, experienced, inexperienced. Discreet here and expect the same. Can host. Must see a face pic. Once viewed, will delete. So, hit me up, u never know....
35, 6'3"", br, br, 310lbs(wear it well), sicilian/english, masc, handsome, drug and disease free(is 420 a drug?)talented lips and tongue. Have many pics, just ask and return the favor.","2014-09-13T18:51:40-0400","2014-09-13T18:51:40-0400"," 2","m4m"
"129","http://utica.craigslist.org","ppp","4666871931","http://utica.craigslist.org/cas/4666871931.html","4666871931","Sep 13","pampering for a cute honey","40","cas","casual encounters","Utica","He so looking for a cool girl who is thinking if I had my wish I would be getting a massage on a table being caressed and gave my whole body rejuvenated my the hands and ... Of man that is putting some effort into his craft.   Good conversation good shape and hed be pretty easy on the eyes and he would not pressre me to do anything and we could lay naked and just get all cozy all day and who knows what could happen.  Well if you think that sounds kinda cool .  I'm that guy and I have a pretty cool place to host .  I'm also really easy to be around and always respectful and polite .  I'm 420 friendly and heck there are always a few treats on the shelf here . Looking for someone  tween 22-40ish preferealy not 22 ish unless idk make that 25 .   Fit comfortable in your own skin kind if thing .  Preferably non smoker but ya know and must like to be cozy or touchy and comfortable .","2014-09-13T18:54:47-0400","2014-09-15T18:39:15-0400"," 2","m4w"
"130","http://utica.craigslist.org","ppp","4666873229","http://utica.craigslist.org/cas/4666873229.html","4666873229","Sep 13","need my cock sucked",NA,"cas","casual encounters","utica","like it says I need my cock sucked you must host put fun in the title so I know your real","2014-09-13T18:55:48-0400","2014-09-13T18:55:48-0400"," 0","m4m"
"131","http://utica.craigslist.org","ppp","4666873530","http://utica.craigslist.org/cas/4666873530.html","4666873530","Sep 13","Massage relief","52","cas","casual encounters","rome utica","Let me come over. I'm clean & disease free you also be. 
I would like to give your cut cock a nice massage. 
Stats in reply! Will not join web site. 
Send a email address to contact you or no reply.","2014-09-13T18:56:03-0400","2014-09-13T18:56:03-0400"," 0","m4m"
