"","cityurl","subcl","post_id","post_link","post_data_id","post_date_raw","post_title","post_price","post_subcl","post_subcltype","post_loc","post_text","post_date","post_last_update","post_pics","post_type"
"209","http://austin.craigslist.org","ppp","4669731053","http://austin.craigslist.org/m4w/4669731053.html","4669731053","Sep 15","Looking for something new on the side",NA,"m4w","men seeking women","North austin","I've been in a stagnant relationship for the past 4 years. I have remained faithful while being pretty sexually unsatisfied. I'm looking for someone in a similar situation for--let's just be real here--an affair. I'm pretty open minded so I'm not going to start rattling of specifics...just email me and let's chat. Not in a hurry at all. 
Look forward to hearing from you. 
P.S. Save the judgmental emails","2014-09-15T16:49:08-0500","2014-09-15T16:49:08-0500"," 0",NA
"210","http://austin.craigslist.org","ppp","4669731225","http://austin.craigslist.org/cas/4669731225.html","4669731225","Sep 15","Peeing","30","cas","casual encounters","near Cedar Park","I have always wanted to watch a woman pee, I have seen videos online but would love to be there live.  Is there any woman who would like to met up and help me out?  Not looking for a golden shower or anything like that.  I was thinking more of just watching you on the toilet or peeing outside if your really adventurous and want to.  Respond and we can work out details and maybe something we can trade for you to do this.","2014-09-15T16:49:14-0500","2014-09-15T16:49:14-0500"," 0","m4w"
"211","http://austin.craigslist.org","ppp","4669731709","http://austin.craigslist.org/mis/4669731709.html","4669731709","Sep 15","H&M Monday Afternoon smiles",NA,"mis","missed connections","Domain","Hiya, Not sure if your worked there or were only shopping at H&M on Monday afternoon.
I was having a nice day out with my mother and on our way out of the store we exchanged smiles with you. You had the best smile! If you find this get a hold of me.
You: Long brown hair and glasses wearing a pretty, colorful, pattern dress.
Me: Tall, red and white striped long sleeve shirt, blonde hair and generic baseball hat.","2014-09-15T16:49:30-0500","2014-09-15T16:49:30-0500"," 0","m4w"
"212","http://austin.craigslist.org","ppp","4669731943","http://austin.craigslist.org/cas/4669731943.html","4669731943","Sep 15","A Simple BJ","51","cas","casual encounters",NA,"This ought to be easy, right?
Me, 51 year old white professional, tall, safe, ddf, HWP
You, woman, of any size or race, safe, clean, and good at giving head.
Let's talk! Happy to give in return. 
Can host in my office or come to you. 
Put SOON in subject line, please.","2014-09-15T16:49:38-0500","2014-09-15T17:36:22-0500"," 0","m4w"
"213","http://austin.craigslist.org","ppp","4669734308","http://austin.craigslist.org/cas/4669734308.html","4669734308","Sep 15","looking for someone to chat with...","33","cas","casual encounters",NA,"Im bored and looking to chat with someone on Kik.
Must be between 25 - 33 years old.
White
Athletic build
Open minded
And not creepy!
Email me a picture and your kik username in the subject so that i know you are real and ill respond with a pic and my username if i want to chat!
Its monday and almost 5 pm.. to verify im real and just want to have fun! ;)","2014-09-15T16:51:07-0500","2014-09-15T16:51:07-0500"," 0","w4m"
"214","http://austin.craigslist.org","ppp","4669736839","http://austin.craigslist.org/cas/4669736839.html","4669736839","Sep 15","Pleasure","37","cas","casual encounters","North","For soothing relaxing touch for your sensual and pleasure release
5'10, 160lbs. Smooth 7cut Asian CMT
For more info
512-five-five-zero-2-five-five -2","2014-09-15T16:52:36-0500","2014-09-15T16:52:36-0500"," 0","m4m"
"215","http://austin.craigslist.org","ppp","4669741134","http://austin.craigslist.org/cas/4669741134.html","4669741134","Sep 15","FWBs LOOKING FOR A THIRD!",NA,"cas","casual encounters","NW Austin","Hello and happy Monday!  We're a white couple, married FWBs, mid-30s, attractive, very clean, and both fixed.  We're both very sexually open, and we're looking for a like-minded woman to join us.  You can be married as well, or dating, but it would be awesome if you could host. 
I love the cool weather we had Sat.  I didn't love seeing the Horns lose at the last minute.  Please reply with ""unicorn"" in the subject so we know you're not a bot.  We're serious, and you should be, too.  Thanks for reading!","2014-09-15T16:55:14-0500","2014-09-15T16:55:14-0500"," 0","mw4w"
"216","http://austin.craigslist.org","ppp","4669741953","http://austin.craigslist.org/m4m/4669741953.html","4669741953","Sep 15","Masculine guy","25","m4m","men seeking men","Austin","Looking for friends, drinking buds/fwb or relationship. Into outdoors, golf, working out and going out for drinks. Vers 5'10, muscular white/latin mix 175ibs. Hit me up","2014-09-15T16:55:44-0500","2014-09-15T16:55:44-0500"," 2",NA
"217","http://austin.craigslist.org","ppp","4669744837","http://austin.craigslist.org/w4m/4669744837.html","4669744837","Sep 15","LTR in mind, just need a partner in crime :)","23","w4m","women seeking men","north austin","Alright, I'm going to try something a little different, but first let me get some of the basics out of the way.
I'm:
-23
-white
-mother of two
-employed(part time for now)
-some college education(i DO plan on returning once I have a stable home environment and both kiddos are in school)
-not gonna lie, still a little overweight, but at 5'10"" I carry it well, and I've already lost 8lbs since making my health a priority again
-former college athlete so I do value an active lifestyle and as much outdoor time as possible(but I can definitely spend an entire day indoors watching Netflix all day after a couple long weeks)
-I have my own car but not my own place(staying with my mom until I can get back on my feet)
The picture attached is my 'before' picture from the first of the month. I'm 8lbs down from that but I'll be taking progress pictures probably once a week or so from here on out in case you are interested but want to make sure I'm not still going to be a cow if we pursue a relationship. (And should we exchange more than a couple e-mails I'll gladly include pictures from before my health issues so you can kinda see what I'm working towards)
I'm not looking for anyone to be a personal ATM in exchange for maintaining a household and keeping my man happy-I enjoy working and have professional and personal goals and dreams that I look forward to completing in the future, but at this point in my life financial stability is not something I am able to fully provide for my family, so of course someone who is a little more established is always a plus. (And for those that view this as a 'must know' before jumping into a possible relationship with someone, my monthly income right now is only around $700 plus the food assistance I receive for myself and my children. The only problem is a good chunk of that is currently going to gas and childcare)
Anyway, I've just been doing a lot of soul searching the last few weeks after the series of unfortunate events that threw everything off balance for a while, and I've realized that although I have enjoyed being single the last 2 years, I miss having a companion. I have grown a lot over the last couple of years and I definitely think I'm at a point where I would like to settle down and settle into the housewife-y role with someone I can enjoy spending time with. Maybe it's the weather that has me thinking like this, I've always loved Fall/Winter and it would be really nice to have someone to spend the cool days and even colder nights with. Not to mention having a home to decorate and fill with love and delicious food during the holiday season. 
I'm not sure if I believe in love anymore, at least not the way everyone around me seems to think of it, but I do think two people can truly care for each other even after only a short time, and nearly any two people can make a relationship last if they are willing to put in a little effort and a lot of fun along the way.
Ah, well, I'm rambling now. I was going to add some tidbits about myself but I'll save that for another conversation.
Hope to hear from you soon. 
Happy Monday!!!","2014-09-15T16:57:30-0500","2014-09-15T16:57:30-0500"," 0",NA
"218","http://austin.craigslist.org","ppp","4669746019","http://austin.craigslist.org/m4m/4669746019.html","4669746019","Sep 15","Drinks/Date","26","m4m","men seeking men","Austin","Just looking for a cool masc. guy 21-29, athletic/avg build, preferrably white or latino to go on a date and see where it goes from there. 
Im 26 six foot 190 gl masc. guy. Blonde/blue. 
Some of my interests are running, watching football, hanging with friends, driving, tennis, gym, movies, music, going downtown, dinner, townlake, travel.
Shoot me an email if your interested. We can chat, exchange pics, and see what happens.","2014-09-15T16:58:13-0500","2014-09-15T17:01:13-0500"," 0",NA
"219","http://austin.craigslist.org","ppp","4669746072","http://austin.craigslist.org/m4m/4669746072.html","4669746072","Sep 15","CUM on over ...",NA,"m4m","men seeking men","South","and let's play...NAKED...j/o oral 69 rimming bodycontact...5ft 5 165 brn brn good looking clean cut 6 1/2 uncut...tXXXt me...5one,2/four...23;eight8nine...1
YOU BE 18-30...GOOD SHAPE","2014-09-15T16:58:15-0500","2014-09-15T16:58:15-0500"," 0",NA
"220","http://austin.craigslist.org","ppp","4669748386","http://austin.craigslist.org/cas/4669748386.html","4669748386","Sep 15","Seeking a BBW","58","cas","casual encounters","NW Austin/183","Feeling horny and want to play with an older man this evening?  I'd enjoying playing with young.  Your age or body type is not important.  Let's start off with some passionate kissing and touching, and maybe some fingering and oral.  I can host tonight or come to you.","2014-09-15T16:59:40-0500","2014-09-15T16:59:40-0500"," 0","m4w"
"221","http://austin.craigslist.org","ppp","4669751092","http://austin.craigslist.org/m4m/4669751092.html","4669751092","Sep 15","Whos got some cock for me?","30","m4m","men seeking men","Georgetown","Married guy here, just looking to suck a nice cock till it explodes in my mouth.
 No chit chat, just me sucking, you moaning and shooting a big load down my throat.
 You cum, I leave, very discrete here.
 Thirty years, five eight, one hundred fifty five pounds....clean and fit..
Anyone in the surround area hosting?","2014-09-15T17:01:22-0500","2014-09-15T17:01:22-0500"," 0",NA
"222","http://austin.craigslist.org","ppp","4669752183","http://austin.craigslist.org/m4w/4669752183.html","4669752183","Sep 15","Just Another Manic Monday...","47","m4w","men seeking women","Austin Area","Hello, I hope you having a great day so far.I am a SWM looking to chat and meet someone.Your race and body type are not important.Let's chat.Thanks, for reading.","2014-09-15T17:02:02-0500","2014-09-15T17:02:02-0500"," 0",NA
"223","http://austin.craigslist.org","ppp","4669754439","http://austin.craigslist.org/m4m/4669754439.html","4669754439","Sep 15","Experienced Cocksucker looking","48","m4m","men seeking men","south","I am a submissive cocksucker that loves pleasuring and worshipping DICK. Do you need to kick back and have an experienced sub slut milk a creamy load from your hard cock with nothing but my mouth? I am a total bottom looking for fun. Clean and healthy here, party friendly, m4m, m4w, mm4m mw4m kink are all cool too.  I cannot host","2014-09-15T17:03:24-0500","2014-09-15T17:03:24-0500"," 0",NA
"224","http://austin.craigslist.org","ppp","4669754711","http://austin.craigslist.org/cas/4669754711.html","4669754711","Sep 15","Discreet encounter fun","40","cas","casual encounters","northwest austin","looking for  a white couple who are professional and DDF with no drama, that would like to hook up with a clean professional BBC  for some fun. I am a straight guy, with 8inch package and handsome. Seen me a pic and email and lets chat to see if we can connect. I am real Texas lost 20 -17 on Saturday","2014-09-15T17:03:35-0500","2014-09-15T17:03:35-0500"," 0","m4mw"
"225","http://austin.craigslist.org","ppp","4669755189","http://austin.craigslist.org/cas/4669755189.html","4669755189","Sep 15","bad daddy looking for his babygirl","49","cas","casual encounters","south","Horny daddy wants a hot young thing that likes to be ravished and manhandled.  I just want to have a good time with a girl that wants to party.  And have some nasty fun.  HMU and lets exchange info and get started.","2014-09-15T17:03:53-0500","2014-09-15T17:03:53-0500"," 0","m4w"
"226","http://austin.craigslist.org","ppp","4669757432","http://austin.craigslist.org/rnr/4669757432.html","4669757432","Sep 15","For those considering killing and burying your kid",NA,"rnr","rants & raves",NA,"Don't. Someone will take them. Hell, I'd take them. Same goes for abuse. If you hate having a kid so much that you're punching them, burning them, neglecting them, locking them up, for fucks sake, stop! Do them a favor and drop them off somewhere public, a police station, a fire station. SOMETHING. 
My heart breaks for that little boy in southeast Austin. That could have been prevented if people would just man up and admit they can't parent. Or stop breeding altogether.","2014-09-15T17:05:15-0500","2014-09-15T17:05:15-0500"," 0",NA
"227","http://austin.craigslist.org","ppp","4669758599","http://austin.craigslist.org/cas/4669758599.html","4669758599","Sep 15","Are You Lactating? Curious?","41","cas","casual encounters","Austin","This might be a little out of the norm but I would like to find a lactating woman to see on a regular occasion.
Age and race are not important but hygiene and being d&df is important. I am an attractive professional and work a little north of UT. I am HWP, safe and sane. I have had this yearning for some time but have never had an opportunity to act on it. I hope that changes with this posting. I am not even sure if there is a woman out there that is interested in this type of thing or not. I truly hope someone is out there.
To make matters a bit more difficult I need to be discreet. No need to read between the lines on that one. What I am seeking is very hard to find. I hope to find a woman that is also in need or just curious. If you are out there please contact me. I promise no pressure, games or drama.
Email me and we can discuss further.","2014-09-15T17:05:59-0500","2014-09-15T17:05:59-0500"," 0","m4w"
"228","http://austin.craigslist.org","ppp","4669758870","http://austin.craigslist.org/cas/4669758870.html","4669758870","Sep 15","Regular Black Master","46","cas","casual encounters","s A TX - Kyle","I'm Wm 225 Fit Ddf 46 yo looking for a Master that might want to use and abuse me anyway you want and even pimp me out love sacking fat cocks and taking loads in all my holes lots of it somewhat of a virgin had a 9"" black cock first time out he buried to the balls I love it guess you could say it spoiled me I want to fuck","2014-09-15T17:06:10-0500","2014-09-15T17:06:10-0500"," 0","m4m"
"229","http://austin.craigslist.org","ppp","4669759056","http://austin.craigslist.org/m4w/4669759056.html","4669759056","Sep 15","Experienced wants a youthful companion","40","m4w","men seeking women","NorthWest","I am a 40 something successful entrepreneur and I seek a 20 something youthful looking companion.. The ideal match is someone just finishing college and needing help with starting the life.. Looks wise I prefer tall Blondes.. I can properly take care of their desires..","2014-09-15T17:06:17-0500","2014-09-15T17:06:17-0500"," 0",NA
"230","http://austin.craigslist.org","ppp","4669760231","http://austin.craigslist.org/cas/4669760231.html","4669760231","Sep 15","Seeking normal everyday woman who needs oral","40","cas","casual encounters","North Central or NW","Hi, I am an attractive guy looking for a cool woman that is in need of some oral. Not looking for Miss America or a Barbie. Just a cool woman that is in need. I have been told I am nice looking but that is up to you to decide. All I want to do is give you oral. Not looking for more. I am d&df, safe and sane. I enjoy pleasing. If you are interested and can host I would love to hear from you. Ask any question you wish. I promise to be open and honest. 
Hope this reaches someone. 
Please put the temperature in the subject line so I know you are real. 
Thanks.","2014-09-15T17:06:57-0500","2014-09-15T17:06:57-0500"," 0","m4w"
"231","http://austin.craigslist.org","ppp","4669760420","http://austin.craigslist.org/cas/4669760420.html","4669760420","Sep 15","strapon fun and maybe mutual rimming","25","cas","casual encounters","lago vista","ive recently started playing in my ass and i love it, the only problem is im only attracted to woman fml lol so i need a sexy lady to come over and fuck my tight ass with a strap on we can have standard sex too if you want im excellent at cunnilingus and have a standard penis in length and girth. so email me back and lets have some fun oh i can host most of the time, i dont have any kids, im single i like to drink and smoke so we can do that too. ill send a pic with a reply put party time in the subject line or ill still answer","2014-09-15T17:07:05-0500","2014-09-15T17:07:05-0500"," 0","m4w"
"232","http://austin.craigslist.org","ppp","4669760432","http://austin.craigslist.org/cas/4669760432.html","4669760432","Sep 15","Any farwest /mesa joggers?","45","cas","casual encounters","nw hills","Horned up today and wanted to suck/swap on a nice gl fit dude if out jogging today. Swing by and let's have some fun. Stats?  me 5'11"" 178 discreet 45 hot guy. Discreet for same. Any pics?","2014-09-15T17:07:05-0500","2014-09-15T17:07:05-0500"," 0","m4m"
"233","http://austin.craigslist.org","ppp","4669760606","http://austin.craigslist.org/cas/4669760606.html","4669760606","Sep 15","planet fitness fun in showers in pflugerville","24","cas","casual encounters","Pflugerville","Hey guys Hispanic good looking guy gonna be at play fitness for a workout then if someone wants to join me for a shower and play around a bit.
I'm six ft 18Olbs seven un gl clean. 
Let me know what's up?","2014-09-15T17:07:12-0500","2014-09-15T17:07:12-0500"," 0","m4m"
"234","http://austin.craigslist.org","ppp","4669761250","http://austin.craigslist.org/cas/4669761250.html","4669761250","Sep 15","I want to watch my man with another guy","28","cas","casual encounters","lakeline mall","hey we are a late 20's white married couple I want to watch my hubby with another guy hes 6ft2 250 6cut and thick i would like to find another guy around our age to come over tonight and let me watch while you please each other. He has never been with another man but is very excited to try looking for the whole package so i guess a vers guy is what we need let us know we will host in out home tonight.","2014-09-15T17:07:36-0500","2014-09-15T17:07:37-0500"," 0","mw4m"
"235","http://austin.craigslist.org","ppp","4669762173","http://austin.craigslist.org/cas/4669762173.html","4669762173","Sep 15","dress me up","25","cas","casual encounters",NA,"Dress me up in ladies clothing with makeup and all.   After that let's see what happens.","2014-09-15T17:08:12-0500","2014-09-15T17:08:12-0500"," 0","m4m"
"236","http://austin.craigslist.org","ppp","4669762289","http://austin.craigslist.org/cas/4669762289.html","4669762289","Sep 15","ISO passable","22","cas","casual encounters","south austin","ISO discreet passable ts 
D&D free condoms are a must 
I am top only 
You must host 
Reply with pics or you will be deleted","2014-09-15T17:08:15-0500","2014-09-15T17:08:15-0500"," 0","m4t"
"237","http://austin.craigslist.org","ppp","4669764720","http://austin.craigslist.org/cas/4669764720.html","4669764720","Sep 15","I want to watch my husband with another man","28","cas","casual encounters","183/45","hey we are a late 20's white married couple I want to watch my hubby with another guy hes 6ft2 250 6cut and thick i would like to find another guy around our age to come over tonight and let me watch while you please each other. He has never been with another man but is very excited to try looking for the whole package so i guess a vers guy is what we need let us know we will host in out home tonight.","2014-09-15T17:09:49-0500","2014-09-15T17:09:49-0500"," 0","m4m"
"238","http://austin.craigslist.org","ppp","4669765073","http://austin.craigslist.org/cas/4669765073.html","4669765073","Sep 15","masc bottom  lookung for a masc TOP!!!","50","cas","casual encounters","nw/crntral austin","contact for a pic &  more info.....I will send u a # if you send a  pic & it appeals to me...I must talk by phone (not text)to  anyone  who wants to meet...
I wont go to gay bars because I only rarely have M/M relations.
ME; white,6'1""m215 lb,6in cut,normal guy artistic bent, 
YOu: I prefer someonewho is VERY masc. & who likes giving anal.....
,anonflfkgkgk kkfjfjk lfllfkgk kkfjfk kkfjfk ymous lldldlglgkgkgk kkfkfkkkf kkkdkdkk","2014-09-15T17:10:03-0500","2014-09-15T17:23:21-0500"," 0","m4m"
"239","http://austin.craigslist.org","ppp","4669765729","http://austin.craigslist.org/cas/4669765729.html","4669765729","Sep 15","VERY REAL, HUNG FMR MALE MODEL HOSTING MILF COUPLE IN HOTEL","27","cas","casual encounters","Austin hotel","I am very real and will be visiting Austin 9/16- 9/19 staying at hotel near conference center! I am looking for a very sexy woman or couple to come by and have some kinky fun. I am a former male model now a business professional in town for a conference. I'm 6'2 185 lbs lean in good shape with a great 8"" cock! Please include a picture of you bc I am not desperate just looking for fun in a town I know nobody so no worries about discretion. I love women of all ages and sizes just like pretty women. Please no black couples just a preference every other race is good!! Let's go at it all night! I'll message everyone back stating yes or no!","2014-09-15T17:10:32-0500","2014-09-15T17:10:33-0500"," 0","m4mw"
"240","http://austin.craigslist.org","ppp","4669768972","http://austin.craigslist.org/cas/4669768972.html","4669768972","Sep 15","Bi","23","cas","casual encounters","North","Looking to test the waters and swap head. Maybe more if it's feeling right. 
I'm 6'0, 255lb, brown hair, blue eyes, bearded/hairy/masc. I'm only comfortable sending cock pics for privacy reasons, so be ok with that. 
Would prefer someone white, size/age doesn't matter. Send cock pics (and face if you want) and stats in your first email. 
I cannot host. You will have to host or we'll have to do this in one of our cars.","2014-09-15T17:12:30-0500","2014-09-15T17:12:30-0500"," 0","m4m"
"241","http://austin.craigslist.org","ppp","4669769193","http://austin.craigslist.org/mis/4669769193.html","4669769193","Sep 15","Adorable blonde wedding photographer","39","mis","missed connections","Westlake CC","You took my picture even though I wasn't a guest.  
You are so adorable I could melt, or die.  
I'd really like to know you.","2014-09-15T17:12:38-0500","2014-09-15T17:12:38-0500"," 0","m4w"
"242","http://austin.craigslist.org","ppp","4669770394","http://austin.craigslist.org/cas/4669770394.html","4669770394","Sep 15","Monday Night Release","23","cas","casual encounters","Austin","I am educated, a gentleman, personable, respectful  and have a good head on my shoulders. I am just looking to punch a girls ticket. It's tough making a good read off of people here but I think you'll be able to see straight through me.  I enjoy kayaking and the Austin nightlife, concerts, and hill country. 
Let me know if we can help each other out :)","2014-09-15T17:13:23-0500","2014-09-15T17:13:23-0500"," 0","m4w"
"243","http://austin.craigslist.org","ppp","4669772192","http://austin.craigslist.org/m4m/4669772192.html","4669772192","Sep 15","Looking for visitors at their hotel","40","m4m","men seeking men",NA,"I'm a bimwm.
Looking for discreet, sane, DDF and HWP visitors who would like to host a little fun in their hotel rooms this evening.
I'm married and very, very closeted. Not interested in being out at all.
I won't trade face pics. Won't happen.
I cannot host.
I am tall, good-looking nicely hung and thick. I'm a versatile bottom. I like to fuck a nice tight ass, but I'm happier on my back, legs in the air, getting fucked deep and hard until we're both cumming.
I only play safe. That's non-negotiable. 
So, if you're in town for a few days and want to get naked and have some fun, let me know, buddy.","2014-09-15T17:14:27-0500","2014-09-15T17:14:27-0500"," 0",NA
"244","http://austin.craigslist.org","ppp","4669774116","http://austin.craigslist.org/m4m/4669774116.html","4669774116","Sep 15","Want to play out my tag team fantasy","25","m4m","men seeking men","central","I have always wanted to be tag teamed by multiple guys. Use my mouth, my ass, into getting facials, open for whatever. 
I am 5'8 135 masc, discrete. Looking for similar, clean ddf (420 is fine). Race isn't an issue
Send pics in first response, can host or travel here","2014-09-15T17:15:37-0500","2014-09-15T17:15:37-0500"," 0",NA
"245","http://austin.craigslist.org","ppp","4669774152","http://austin.craigslist.org/cas/4669774152.html","4669774152","Sep 15","I want a pretty PANTIE BOI to dress in pretty LINGERIE",NA,"cas","casual encounters","south austin","I think the title states it all.  Are you one?
My definition of pretty is; very young (18+), cute, smooth and slim/fit
When? now
Where? my place
Discretion is a must.","2014-09-15T17:15:38-0500","2014-09-15T17:15:38-0500","10","m4m"
