"","cityurl","subcl","post_id","post_link","post_data_id","post_date_raw","post_title","post_price","post_subcl","post_subcltype","post_loc","post_text","post_date","post_last_update","post_pics","post_type"
"168","http://visalia.craigslist.org","ppp","4662214248","http://visalia.craigslist.org/m4m/4662214248.html","4662214248","Sep 10","TOTAL BOTTOM FOR STR8/BI/CUR. guys looking for head & ass",NA,"m4m","men seeking men","PORTERVILLE hosting only","NOW, AFTER 6:00 p. m.., THURSDAY 9/11....   Total 559bottom 3here 6for 1Str8/Bi/Curious 5TOP 7guys 1who5 want to fuck tight ass, get head, rimmed, balls sucked. . . Have you been wanting to fuck, but been ""cut off"" or just to busy to find the opportunity?   LOOKING FOR A HUNG ST8/BI/CURIOUS TOP GUY TO USE ME.....
Are you tired with all the money you have to spend to fuck? Problem solved if you are you a single, have g/f, or married Str8/ Curious TOTAL Top guy who has the need5to get serviced? You like to get head? maybe get rimmed? Fuck a clean, tight hole? I am NOT looking for any reciprocation . . .
I'm a total bottom guy, looking or in-shape guys, who are clean (take a shower first), discreet, disease free, HIV negative, between 23 and 39 who are in good shape, height and weight proportionate, with a nice hard cock, and Latino/White/ Portuguese/Italian/ Puerto Rican.... Love tats, so come show yours off! HOSTING GUYS ONLY. NSA, 1 time only, or on a regular basis if you want. . . 
Total bottom guy here, hosting str8/bi/curious horny-as-fuck Top guys, NOT LOOKING FOR ANY RECIPROCATION HERE, like to suck, rim, get fucked. Love to rim a sweet, clean ass, lick and suck balls. Tatted guys are a big plus !!!! Love the tats, so cum and show them off ! I have the condoms, lube and videos....
I'm 55, 6', 190, Discreet, Disease free - clean tight ass, HIV Neg... I have my own place, videos, lube, condoms...... total bottom guy, looking or in-shape guys, who are clean (take a shower first), discreet, disease free, HIV negative, between about 21 and 45 who are in good shape, height and weight proportionate, with a nice hard cock, and Latino/White/ Portuguese/Italian/ Puerto Rican. HOSTING GUYS ONLY. NSA, 1 time only, or on a regular basis if you want. . . 
OK if you're a ""tough"" Thug and DL on the streets... just be yourself with me... I host only - so you need to be mobile and to fit the general description. Give me a text / call; if interested, you will have to call me for my address..
Not here for sexting, or phone sex... so text / call me!!! I don't do emails - too many spammers! NO underage, illegal, etc. I don't send out my pics, so don't ask - but you can send yours... IF interested, after texting, you will need to call for address. And no pay for play so don't even ask.","2014-09-10T16:53:44-0700","2014-09-11T17:52:07-0700"," 0",NA
"169","http://visalia.craigslist.org","ppp","4662219745","http://visalia.craigslist.org/cas/4662219745.html","4662219745","Sep 10","Total bottom guy for str8/bi/curious top guys",NA,"cas","casual encounters","Porterville HOSTING on west side","NOW, THURSDAY MORNING AFTER 1:30 A.M, and after, as schedules permit, so keep contact information... : 559bottom 3here 6for 1Str8/Bi/Curious 5TOP 7guys 1who5 want to fuck tight ass, get head, rimmed, balls sucked. . . Have you been wanting to fuck, but been ""cut off"" or just to busy to find the opportunity?   LOOKING FOR HUNG ST8/BI//CURIOUS TOP GUYS TO USE ME.....
Are you tired with all the money on dates, or hoops you have to jump through to get head and to fuck? Problem solved if you are you a single, have g/f, or married Str8/ Curious TOTAL Top guy who has the need5to get serviced? You like to get head? maybe get rimmed? Fuck a clean, tight hole? I am NOT looking for any reciprocation . . .
I'm a total bottom guy, looking or in-shape guys, who are clean (take a shower first), discreet, disease free, HIV negative, between 23 and 39 who are in good shape, height and weight proportionate, with a nice hard cock, and Latino/White/ Portuguese/Italian/ Puerto Rican.... Love tats, so come show yours off! HOSTING GUYS ONLY. NSA, 1 time only, or on a regular basis if you want. . . 
Total bottom guy here, hosting str8/bi/curious horny-as-fuck Top guys, NOT LOOKING FOR ANY RECIPROCATION HERE, like to suck, rim, get fucked. Love to rim a sweet, clean ass, lick and suck balls. Tatted guys are a big plus !!!! Love the tats, so cum and show them off ! I have the condoms, lube and videos....
I'm 55, 6', 190, Discreet, Disease free - clean tight ass, HIV Neg... I have my own place, videos, lube, condoms...... total bottom guy, looking or in-shape guys, who are clean (take a shower first), discreet, disease free, HIV negative, between about 21 and 45 who are in good shape, height and weight proportionate, with a nice hard cock, and Latino/White/ Portuguese/Italian/ Puerto Rican. HOSTING GUYS ONLY. NSA, 1 time only, or on a regular basis if you want. . .  I want to eat your ass, suck your  cock and balls, and have you and a buddy fuck my tight hole..
OK if you're a ""tough"" Thug and DL on the streets... just be yourself with me... I host only - so you need to be mobile and to fit the general description. Give me a text / call; if interested, you will have to call me for my address..
Not here for sexting, or phone sex... so text / call me!!! I don't do emails - too many spammers! NO underage, illegal, etc. I don't send out my pics, so don't ask - but you can send yours... IF interested, after texting, you will need to call for address. And no pay for play so don't even ask.","2014-09-10T16:57:39-0700","2014-09-11T01:46:36-0700"," 0","m4m"
"170","http://visalia.craigslist.org","ppp","4662232480","http://visalia.craigslist.org/cas/4662232480.html","4662232480","Sep 10","Drinks & 420 ladies","23","cas","casual encounters","Visalia Tulare Exeter Lindsay","Checking this out see if it actually works bored and looking to do something tonight 420 friendly english and spanish music fuck it lets just have a good time pic for pic 
I'm real it's 5:04 97 degrees outside hot as hell outside haa, if the ad is still up means I'm still looking","2014-09-10T17:07:05-0700","2014-09-10T17:07:05-0700"," 0","m4w"
"171","http://visalia.craigslist.org","ppp","4662255665","http://visalia.craigslist.org/cas/4662255665.html","4662255665","Sep 10","Casado Bisexual","47","cas","casual encounters","Visalia","Soy un hombre varonil casado buscando bisexual varonil hombres.Yo mama y posible mas. Edad de 30 y ariba no gordo's y que no usan drogas. No Mandan fotos.","2014-09-10T17:24:49-0700","2014-09-10T17:24:49-0700"," 0","m4m"
"172","http://visalia.craigslist.org","ppp","4662268547","http://visalia.craigslist.org/cas/4662268547.html","4662268547","Sep 10","Long Term FWB Wanted!","43","cas","casual encounters","Porterville","Women Only!!
Seeking Long Term FWB.  Married or Single Woman, ages 18 to 40, height & weight proportionate, no drugs and no diseases.  Any Race Ethnic background welcome.
Me:  White, 43 yrs., 6'3"" tall, 225 lbs., brown hair (not balding), blue eyes, mustache and goatee.  I'm drug and disease free.  I don't have any tattoo's.  My cock is six (6) inches, circumcised and shaved.  I'm very clean.  I have condoms and lubricant (lube) if needed. 
I have my own private place in Porterville in a safe neighborhood.  
No picture from you .... No reply from me.  To weed out spam change the subject to ""Sept. 11th.""","2014-09-10T17:34:41-0700","2014-09-10T17:34:41-0700"," 2","m4w"
"173","http://visalia.craigslist.org","ppp","4662269246","http://visalia.craigslist.org/m4w/4662269246.html","4662269246","Sep 10","Girlfriend for the week...?","50","m4w","men seeking women","tulare/visalia","Am going to be in town all week 9/15-21st for work, Looking for for someone sweet easy going fun to be with that'd like to get together for dinner dates & just have a good time with each other while i'm in town. I'm white 5'10 175 easy going fun romantic stable guy..very light drinker & non-smoker, if interested let me know.","2014-09-10T17:35:12-0700","2014-09-10T17:35:12-0700"," 0",NA
"174","http://visalia.craigslist.org","ppp","4662302458","http://visalia.craigslist.org/cas/4662302458.html","4662302458","Sep 10","daddy who dry humped me","28","cas","casual encounters","Visalia","We met near the COS parking lot and you brought me into a small room.  We got naked and you fed me your big cock while you played with my nipples.  You then bent me over the table and tongue fucked me and rubbed your cock around my asshole until you sucked me off.  You were older.  I'm looking to do that again and have you train my ass for your cock.  HMU if it's you","2014-09-10T18:01:18-0700","2014-09-10T18:01:18-0700"," 0","m4m"
"175","http://visalia.craigslist.org","ppp","4662305170","http://visalia.craigslist.org/cas/4662305170.html","4662305170","Sep 10","Looking for a mouth and a dark room",NA,"cas","casual encounters","visalia","Title says it all.  I walk in, strip, and go into a dark room where we can't see each other.  You have porn playing and I lay back while you rim my hole.  I'll come in your mouth when I'm ready.
I'm 28 yrs old, 6"" cut, clean, and shaved.  I prefer older but it doesn't matter because I prefer anonymous.","2014-09-10T18:03:25-0700","2014-09-10T18:03:25-0700"," 0","m4m"
"176","http://visalia.craigslist.org","ppp","4662312069","http://visalia.craigslist.org/cas/4662312069.html","4662312069","Sep 10","seeking blonde woman",NA,"cas","casual encounters","Visalia","Any blondes out here want to fuck a tall athletic Hispanic male with a big uncircumcised dick? Message me your kik name","2014-09-10T18:08:59-0700","2014-09-10T18:08:59-0700"," 0","m4ww"
"177","http://visalia.craigslist.org","ppp","4662320718","http://visalia.craigslist.org/cas/4662320718.html","4662320718","Sep 10","Nothing serious just fun first","37","cas","casual encounters","Visalia","I am a handsome white man looking for a woman that wants to have fun, is a friend with benefits(that leads into more), curvy, loves kids, and is ambitious. I want a friend, lover, and a hopefully a mate. I am in rush or expect anything. Latin woman drive me crazy, but I have had only Latin women. Drop me line, if we are just f.w.b, I can host and am discrete. I don't judge or hold expectation on anyone,we are who we are!!!","2014-09-10T18:16:12-0700","2014-09-10T18:16:12-0700"," 3","m4w"
"178","http://visalia.craigslist.org","ppp","4662331007","http://visalia.craigslist.org/cas/4662331007.html","4662331007","Sep 10","Bootycall and I wanna have a 3 sum","25","cas","casual encounters","Visalia","My bootycall and I are looking for a female to join us. If you would rather he watch while us females play, that's fine too. Send me a pic and I'll send you one.","2014-09-10T18:24:54-0700","2014-09-10T18:24:54-0700"," 0","mw4w"
"179","http://visalia.craigslist.org","ppp","4662374850","http://visalia.craigslist.org/cas/4662374850.html","4662374850","Sep 10","Chub CS",NA,"cas","casual encounters",NA,"Older looking for some fun I'm a bttm married very discreet, clean, drug free. Can't host maybe you can or? If wanting a pic S-2-R Ready to serve at 10 pm and please contact before 11 pm via text or email fivefiveninefour6zerozerozerosix9","2014-09-10T19:02:44-0700","2014-09-10T19:02:44-0700"," 0","m4m"
"180","http://visalia.craigslist.org","ppp","4662375255","http://visalia.craigslist.org/cas/4662375255.html","4662375255","Sep 10","Are you horny and alone at your motel?",NA,"cas","casual encounters",NA,"Mature chub bttm will suck, swallow, snuggle, rim, etc with similar age group or with those that like older guys who don't bring the BS like a lot of the younger ones do. Be able to host or ? After 1030 pm.","2014-09-10T19:03:04-0700","2014-09-10T19:03:04-0700"," 0","m4m"
"181","http://visalia.craigslist.org","ppp","4662402194","http://visalia.craigslist.org/w4m/4662402194.html","4662402194","Sep 10","Prince Charming","25","w4m","women seeking men","Visalia","Looking to meet a nice guy with a good head on his shoulder. I'm a single mom that works and goes to school. I don't have time for games. I'm not looking for a quick hook up or bootycall. Message me back with a bit about yourself and a pic. Put your favorite football team in the subject. I won't respond to bootycall or penis pics.","2014-09-10T19:27:55-0700","2014-09-10T19:27:55-0700"," 0",NA
"182","http://visalia.craigslist.org","ppp","4662466518","http://visalia.craigslist.org/cas/4662466518.html","4662466518","Sep 10","Come play with us tonight!","31","cas","casual encounters","Lindsay/Exeter","Come play with us tonight. We are hosting. We don't want a lot of back and forth. Let us know your stats and possibly a pic. Then let's get together and see where the night takes us. We have an empty house and need some friends to fill it. We are in our early 30s, average build, in the visalia area. We are 420 friendly. Age, race, body type does not matter.  Talk to you soon. :)","2014-09-10T20:35:10-0700","2014-09-10T23:29:15-0700"," 0","mw4mw"
"183","http://visalia.craigslist.org","ppp","4662481024","http://visalia.craigslist.org/cas/4662481024.html","4662481024","Sep 10","fwb ladies","26","cas","casual encounters","visalia","Hey ladies I'm looking for a girl or girls to have fun with I'm a curve girl I'm 5'3 I live in visalia I have my own apartment I m single I love to have fun love to go out n go dancing to the moves mall I drink sometimes I don't smoke but I'm ok if u do I just want yo have a girl to talk to n see where it goes from there so plz no man or couples plz just ladies plz send a pic n I would to thanks :)","2014-09-10T20:52:21-0700","2014-09-10T20:52:21-0700"," 0","w4w"
"184","http://visalia.craigslist.org","ppp","4662500865","http://visalia.craigslist.org/cas/4662500865.html","4662500865","Sep 10","I need a cock to suck on , im mobile","21","cas","casual encounters","Exeter","Whats up dudes , im very hard and I want a dick to suck !! I haven't had sex in like one year so yeah if u wanna do me , im gonna be very tight !!! Kik me  kaulitz559
I get out of work at 11pm 
plz be around my age , no old guys please","2014-09-10T21:18:28-0700","2014-09-10T21:18:28-0700"," 0","m4m"
"185","http://visalia.craigslist.org","ppp","4662546186","http://visalia.craigslist.org/cas/4662546186.html","4662546186","Sep 10","Looking for Tranny or fem boy",NA,"cas","casual encounters","Visalia","Looking for a tranny or fem boy under 30! I got my own place hit me up for fun! Send stats or pics and let's get this going","2014-09-10T22:32:06-0700","2014-09-10T22:32:06-0700"," 0","m4t"
"186","http://visalia.craigslist.org","ppp","4662564495","http://visalia.craigslist.org/cas/4662564495.html","4662564495","Sep 11","any girl welcome","18","cas","casual encounters","visalia","Hello im new to visalia and im looking for a fuck buddy to take my hung clean cock no age or race restrictions looking for a good clean hook up im clean so you be clean too please email me with a pic and response if youare interested 
You must be able to host","2014-09-10T23:11:51-0700","2014-09-10T23:11:51-0700"," 0","m4w"
"187","http://visalia.craigslist.org","ppp","4662579395","http://visalia.craigslist.org/mis/4662579395.html","4662579395","Sep 10","Dinuba AM/PM",NA,"mis","missed connections","Dinuba","I went there earlier You Work there. I kept getting in your way but you said ""I don't mind you in my way"" we talked a bit. Hmu and tell me what I was driving.  Long shot","2014-09-10T23:51:28-0700","2014-09-10T23:51:28-0700"," 0","m4w"
"188","http://visalia.craigslist.org","ppp","4662591931","http://visalia.craigslist.org/cas/4662591931.html","4662591931","Sep 11","Naked Pedi Anyone?",NA,"cas","casual encounters","Visalia","I am in search of Women (not men) who would like their feet and toes pampered. I have a fascination with feet & toes. I want to grind and sand your heels to beauty and perfection. Only condition is you must be willing to be fully nude during session. No games! Just be willing to be nude and have your tootsies pampered. Age 25 & over. Race, height, weight unimportant. Please put ""tootsies"" in subject line of your response so I know you are serious.","2014-09-11T00:35:01-0700","2014-09-11T00:35:01-0700"," 0","m4w"
"189","http://visalia.craigslist.org","ppp","4662595195","http://visalia.craigslist.org/cas/4662595195.html","4662595195","Sep 11","Lets Smoke and have some fun","34","cas","casual encounters","North Visalia","My boy(38) and I(35) got some shit, smoke you out for some favs :)  and give u some you get the idea lol :P  Pic for Pic And yes we both look good.  We got a place and vehicle hmu or we can come to your place. asap :) before its gone lol !!!","2014-09-11T00:47:28-0700","2014-09-11T00:47:28-0700"," 0","m4w"
"190","http://visalia.craigslist.org","ppp","4662595636","http://visalia.craigslist.org/cas/4662595636.html","4662595636","Sep 11","fuck around",NA,"cas","casual encounters",NA,"Let's fuck around an cum together or on each other we can even event shit if you want open to ideas please be serious when replying no time for bullshit want to have fun be 30 or older unless your mature and not some idiot kid","2014-09-11T00:49:11-0700","2014-09-11T00:49:11-0700"," 0","m4m"
"191","http://visalia.craigslist.org","ppp","4662623593","http://visalia.craigslist.org/cas/4662623593.html","4662623593","Sep 11","Total bottom to give head/get fucked by Tatted Str8/Curious TOP guys",NA,"cas","casual encounters","Hosting in Porterville","Available NOW Thursday, after 6:00 p.m.     Total 559bottom 361looking 57for 15straight/curious hung and Tatted total TOP guys who want head, get ass rimmed, and to fuck a tight ass.  I love str8/curious thugs/gangbangers who can be themselves as I service their cocks with my mouth and ass... and if u like getting rimmed.... let me know...
I'm a total bottom HOSTING in Porterville, not looking for any reciprocation.  Clean, Discreet, Disease-free/HIV Negative, and I have videos, lube, condoms...I am hosting NOW, on west side of Porterville... Looking for Straight/ Curious TOP Latino/White top guys who need service now !  You need to be 21 - 35, hung, clean/disease free/HIV Negative and Mobile... I'm 55, 6', 190, white, TOTAL cock-loving Bottom.  
Call/text me.  No Underage, nothing illegal, no sexting... looking for real-time Cock and Cum","2014-09-11T02:51:16-0700","2014-09-11T17:53:46-0700"," 0","m4m"
"192","http://visalia.craigslist.org","ppp","4662714470","http://visalia.craigslist.org/m4m/4662714470.html","4662714470","Sep 11","morning head for you.","44","m4m","men seeking men","visalia/tulare","Looking for a Dick to suck. Maybe more.
This is a rare treat for me so please be clean. No drugs and very discreet. Drop me a line and let me know what you would like to do. A pic would be helpful
You host.
I've tried this a few times and nothing but flakes or fakes. You host please.","2014-09-11T05:50:17-0700","2014-09-11T05:50:17-0700"," 0",NA
"193","http://visalia.craigslist.org","ppp","4662728974","http://visalia.craigslist.org/cas/4662728974.html","4662728974","Sep 11","discrete str8 hispanic in motel","30","cas","casual encounters","tulare","559 straight hispanic male looking 838 for a bomb bj...I have a room and will keep it dark...3191  no talking..just you giving me a bomb bj and sucking and licking anywhere you want....not into doing anything else.  If you swallow even better...need this asap","2014-09-11T06:04:35-0700","2014-09-11T06:04:35-0700"," 0","m4m"
"194","http://visalia.craigslist.org","ppp","4662729964","http://visalia.craigslist.org/cas/4662729964.html","4662729964","Sep 11","Alone in motel","31","cas","casual encounters","tulare","31 hispanic male alone in motel.  Just Chillin 559 and seeing who wants to kick it 838.  Maybe have a drink or two 3191.  Text.  5'6  dark black hair, brown eyes.  Average build","2014-09-11T06:05:33-0700","2014-09-11T06:05:33-0700"," 0","m4w"
"195","http://visalia.craigslist.org","ppp","4662754226","http://visalia.craigslist.org/cas/4662754226.html","4662754226","Sep 11","First Time","23","cas","casual encounters","Visalia/Tulare","Hello I'm looking for a trans that wants to show me what it's like to be with one. I've considered myself straight but recently have been wanting to fuck a trans I'm not sure if I'll be comfortable to let you fuck me just yet but we'll see how it goes. I'm not looking for a cross dresser this is for an actual trans or in the process if you're interested in helping me out reply with ""Cherry Popper"" and pic no pic will get no replies.","2014-09-11T06:26:55-0700","2014-09-11T06:26:55-0700"," 0","m4t"
"196","http://visalia.craigslist.org","ppp","4662756295","http://visalia.craigslist.org/cas/4662756295.html","4662756295","Sep 11","Mature Professional white couple seeks submissive girl","4245","cas","casual encounters","Visalia","We are both white professional types, female in early 40s and sexy and male mid 40s and attractive. We are discrete,  clean and have great hygiene and expect the same. 
Looking for a submissive girl that's open-minded. We would love to find a relatively inexperienced female that's very sexual that wants to be trained to be a naughty cumslut. We are both dominant but kind and would bring you along at whatever pace you feel comfortable with just have a desire to get kinky in the future and be open-minded. Any naughty girls need a naughty Daddy and Mommy to teach them how to be a naughty sexy Lil cumslut? 
We can host in Visalia. Looking for ongoing.","2014-09-11T06:28:36-0700","2014-09-11T06:28:36-0700"," 0","mw4w"
"197","http://visalia.craigslist.org","ppp","4662762310","http://visalia.craigslist.org/cas/4662762310.html","4662762310","Sep 11","FREE MASSAGE","37","cas","casual encounters","VISALIA","LOOKING TO GIVE A WOMEN A FREE MASSAGE. I AM NOT A PROFESSIONAL BUT I AM VERY GOOD AT WHAT I DO. THIS DOES NOT HAVE TO BE SEXUAL. WILLING TO PROVIDE A MASSAGE TO YOUR COMFORT LEVEL WHATEVER THAT MAY BE. IM REAL AND VERY CLEAN. SO IF YOUR INTERESTED OR EVEN A LITTLE CURIOUS GET BACK TO ME .ILL BE FREE ALL MORNING TOMORROW UNTIL THE AFTERNOON. TO PROVE IM REAL BOTH MALLS IN VISALIA ARE LOCATED ON MOONEY!!! HOPE TO HEAR FROM YOU SOON!!!","2014-09-11T06:33:18-0700","2014-09-11T06:33:18-0700"," 0","m4w"
"198","http://visalia.craigslist.org","ppp","4662764997","http://visalia.craigslist.org/cas/4662764997.html","4662764997","Sep 11","Professional couple seeks young hung submissive male","4245","cas","casual encounters","Visalia","Mature white couple in 40s seeking younger,  hung submissive male to dominate and use in an ongoing fashion. We are very clean,  have great hygiene and are discrete and expect the same from you. We can host in Visalia. She's in early 40s and he's in mid 40s. Both professional types. You must be open-minded,  submissive and willing to be used and be mommy and daddys Lil boytoy,  mostly hers but you must be very open-minded discrete and clean. Respond with stats and/or pic","2014-09-11T06:35:24-0700","2014-09-11T06:35:24-0700"," 0","mw4m"
"199","http://visalia.craigslist.org","ppp","4662809456","http://visalia.craigslist.org/cas/4662809456.html","4662809456","Sep 11","need my dick sucked",NA,"cas","casual encounters","visalia","Need a blow really bad, in visalia..........only clean hot tranny only!!!! I will not respond if ur a guy or dnt send pic...text 1nine10four98four13one or kick me at godlike66","2014-09-11T07:07:15-0700","2014-09-11T07:07:15-0700"," 0","m4t"
"200","http://visalia.craigslist.org","ppp","4662810979","http://visalia.craigslist.org/cas/4662810979.html","4662810979","Sep 11","fuck buddies??","22","cas","casual encounters","by hospital","Hey I'm 22 Hispanic looking for a sex partner in visalia, I don't have much experience and would love if someone could teach me lol. Plz only serious replys and no guys!!!!! Text me only Cuz my call service don't work......1910four98four131.....I'll answer back asap! Thank you or kick me godlike66","2014-09-11T07:08:16-0700","2014-09-11T07:08:16-0700"," 0","m4w"
"201","http://visalia.craigslist.org","ppp","4662811046","http://visalia.craigslist.org/m4m/4662811046.html","4662811046","Sep 11","chubby bottom looking for a top","26","m4m","men seeking men","Visalia","filipino bottom, 26 yo male, Really into making out, giving head, giving oral, body contact, fore-play, and I love to bottom, play safe only
Send me a message, no calls, only txt or emails with stats and/or pic and i'll send you one back here at 3 2 one - 68four - 6zero7five","2014-09-11T07:08:19-0700","2014-09-11T07:08:19-0700"," 0",NA
"202","http://visalia.craigslist.org","ppp","4662823281","http://visalia.craigslist.org/cas/4662823281.html","4662823281","Sep 11","forced to strip and play","42","cas","casual encounters","visalia","looking to be forced to strip and made to stand there and let you do as you please you must host 5/10 180.lbs white med build smooth 6.5 cut low hangers.","2014-09-11T07:16:22-0700","2014-09-11T07:16:22-0700"," 0","m4m"
"203","http://visalia.craigslist.org","ppp","4662825020","http://visalia.craigslist.org/cas/4662825020.html","4662825020","Sep 11","need dom stud","42","cas","casual encounters","visalia","hey in need of a dom guy to pull off my briefs and do as he pleases 5-10 180.lbs white 6cut you host free until 4pm.","2014-09-11T07:17:29-0700","2014-09-11T07:17:29-0700"," 0","m4m"
"204","http://visalia.craigslist.org","ppp","4662969529","http://visalia.craigslist.org/cas/4662969529.html","4662969529","Sep 11","Find me on kik ;)","24","cas","casual encounters","My place","Any of you wonderful ladies looking for a nice thick 9"" cock to full fill all of your sexual needs. Email me or kik me at thedee69 pic4pic","2014-09-11T08:41:16-0700","2014-09-11T08:41:16-0700"," 0","m4w"
