"","cityurl","subcl","post_id","post_link","post_data_id","post_date_raw","post_title","post_price","post_subcl","post_subcltype","post_loc","post_text","post_date","post_last_update","post_pics","post_type"
"328","http://eastnc.craigslist.org","ppp","4631734622","http://eastnc.craigslist.org/cas/4631734622.html","4631734622","Sep 12","Your bound fantasy","43","cas","casual encounters","Wilson","I arrive at your place and bind your breasts so they are nice and tender after a short time. At the door I blindfolded you so you do not knowwhat is going to happen. Inside you have prepared a table/ottoman which is ready for me to tightly restrained you to.You answer the door completely naked and shaved,waiting for your breaststo be tightly bound with colored rubber bands around your nipples. I guide you to the play area and tell you to lie back with your head hanging upside down over the edge. Your hands are attached below so they are out of the way. Your legs are kept free so that they can be pulled up over your head later. Your bound breasts are pointing upward so that they do not drop to the sides as you lie on your back. Now that you are prepared, the fun begins. This is set up like an assembly line. I whisper in your ear, ""are you ready for a ride?"" ""Yes sir,"" you reply with just a little fear. Apassionate kiss tells you that the fun has begun. While kissing I moves my hands to your ever so tender nipples which have been turning a nice shade of purple. Squeezing them between my fingers you clinch with excitement. You try to pull away from my kiss, but I am agressively kissing harder and harder. After a few minutes, I abruptly stop kissing only to bring my mouth and teeth to your nipple.You pull at your arms but find that the restraints are just enough to hold you; tight and restrictive. Your nipples are burning as I nibble on each side. With your head hanging over the side you are at a perfect level to suck a cock. Your head upside down gives it a unique feeling. Nothing is ordinary, everything is extra special. I place my hard cock into your mouth as I draw back and forth Just as I draw near to cumming I stop so that I can explore more areas. I make my way down to your belly button. You feel the warmth of my breath. You am very ticklish and find that my tongue wiggling in your hole makes you squirm. But you are at my mercy. From a distance you hear a buzzing sound. It is your vibrator that has been turned on and you're sure that you are really in for it. The buzz gets louder and you concluded that its now pretty close to you. It brushes up against your inner thigh and you quickly close your legs to avoid it to go near your pussy. I abruptly pinch your nipple telling you to open your legs. you have no choice but to obey as our nipple cannot take the pain. I move down towards the bottom of the table and lift your legs onto my shoulders. you hear rattling in the distance, as you feel a large ice cube being placed inside your pussy. This will make your insides nice and chilly for me later. You hear the buzzing again and then feel your vibrator on your clit. you jump with excitement. ""One"" I say and then remove the wand. Placing it again on your button counting to two and removing it once again. This scenario continues until I reaches ;by then you should have orgasmed. If you happen to cum early you must endour it until I reach . But I'm sure you will have at least one climax, maybe more. The ice cube is sure to be melted which feels wonderful as I places my hard cock inside you. Your legs pushed over you head allow for the deepest penetration. The coldness on my cock is such an erotic feeling. You hear me moan with pleasure as I release my load into your tight pussy. Now that we both have cum.","2014-08-22T12:47:21-0400","2014-09-12T15:19:05-0400"," 0","m4w"
"329","http://eastnc.craigslist.org","ppp","4632206730","http://eastnc.craigslist.org/cas/4632206730.html","4632206730","Sep 11","Sweet Cute & Freaky TS","23","cas","casual encounters","Greenville nc","What's up this ya girl shay here visting Greenville NC again , looking for lot of fun wit some cute guys I'm the girl you been looking for I love me a freaky dude check my pics out & make ya call 
919-NineOneSix-8514 
Kik me : WavyCrockett89 
No Bullshitting","2014-08-22T16:51:52-0400","2014-09-11T20:05:39-0400"," 8","t4m"
"330","http://eastnc.craigslist.org","ppp","4632470650","http://eastnc.craigslist.org/cas/4632470650.html","4632470650","Sep 11","Women do u want pleasure?","25","cas","casual encounters","Greenville","Hey how are you ladies doing on this Friday? Would you like to spend the night having some fun with a college student? Look no further. Must be able to host and time isn't free but fairly priced. Available until  2:30 today. A condom will be used. Your pic gets mine. I'm real email for number must be in greenville","2014-08-22T19:40:46-0400","2014-09-12T11:17:36-0400"," 0","m4w"
"331","http://eastnc.craigslist.org","ppp","4632586225","http://eastnc.craigslist.org/cas/4632586225.html","4632586225","Sep 11","whats up tonite","46","cas","casual encounters","goldsboro","I am a white guy looking for a  guy to suck off and swallow your load,  maybe more
Let me know your stats and pic if you have one to trade, otherwise i want respond!!
white guy here, average build, you want be disappointed","2014-08-22T21:13:12-0400","2014-09-11T20:26:29-0400"," 0","m4m"
"332","http://eastnc.craigslist.org","ppp","4632739454","http://eastnc.craigslist.org/cas/4632739454.html","4632739454","Sep 12","virgin ass hole needs small/Thin dick 4 to 7 inches","42","cas","casual encounters","Goldsboro-kinston","Want a guy with small dick to take it easy on me and fuck my virgin ass. No small talk, I come in, we swap bj's then you put on condom and fuck me. I have never had i dick in my ass but have finger in ass while GF suck me off. I want a small size man that will let me have control of how much goes in take it easy till i get use to it. send stats and pic Tell me how u would fuck me 
MUST BE STD FREE AND DISCREET
prefer BI/srt guys","2014-08-22T23:50:03-0400","2014-09-12T11:05:20-0400"," 0","m4m"
"333","http://eastnc.craigslist.org","ppp","4633211565","http://eastnc.craigslist.org/cas/4633211565.html","4633211565","Sep 12","Anyone from Atlantic Beach to Emerald Isle Seeking NSA Adult fun?",NA,"cas","casual encounters",NA,"Anyone from AB to Emerald Isle seeking NSA Adult fun,Respond here. Male in good shape seeking open minded fun woman to play.","2014-08-23T11:30:11-0400","2014-09-12T09:25:08-0400"," 0","m4w"
"334","http://eastnc.craigslist.org","ppp","4633694582","http://eastnc.craigslist.org/cas/4633694582.html","4633694582","Sep 12","young kat hosting any black guys looking to hang out",NA,"cas","casual encounters","wayne co","Bored this evening looking for black guys to hang outvtoday , i can host or travel. Im in my 20s black guy masc discreet dl avg build clean cut haircut educated looking for guys masc dl to chill talk look at couple movies listen to some mudic maybe ride out just enjoy the company of another male
Dont hmu if you arent free to chill now 
Leave location age race in subject line
In reply lets set something up.....older black men to front of line","2014-08-23T15:48:48-0400","2014-09-12T08:54:46-0400"," 0","m4m"
"335","http://eastnc.craigslist.org","ppp","4635113550","http://eastnc.craigslist.org/m4w/4635113550.html","4635113550","Sep 12","Discreet friendship","32","m4w","men seeking women","Greenville","I have recently come to the conclusion that life is way to short to keep wanting things with out attempting to make them a reality.  I am a frustrated married man that longs for the passion that I once knew.  My wife and I are going through some rough times and sticking it out, at least for now, for our son.  The feelings that we once had for each other have faded and I have reached the point where I want to find someone that is in a similar situation.  I am not looking to play head games or create drama for anyone but I would love to have an outlet, even it is mostly online if we can not meet often, for the sensual desires that we all have.  I am not the kind of guy that is looking to meet someone tonight or to have a one time thing.  I want to find a woman that is seeking those butterflies that she once knew or just wants to explore more of her desires.  Life is too short to have dreams and not try them because of fear of what someone else might think, lets be each others outlet.  Perhaps we could meet once or twice a month when we both have the time but we could also email or chat to share stories, fantasies or whatever else we want to talk about.  Well I hope I have done a good job explaining what I am looking for.  Here is a bit about me. 
around 6ft tall, 165lbs in great shape.  I am professional, well educated and very personable.  I don't smoke, don't do drugs and drink socially.  I think for this to work well I would like to find someone in or very close to Greenville.  if you are interested then let me know and we can go from there.","2014-08-24T16:19:45-0400","2014-09-12T06:47:05-0400"," 0",NA
"336","http://eastnc.craigslist.org","ppp","4635549332","http://eastnc.craigslist.org/cas/4635549332.html","4635549332","Sep 12","Looking for a soccer mom girl next door.... lets explore ur fantasy's","45","cas","casual encounters","JOCO","Your husband works 9-5 and your kids start school soon, leaving you with a few hours of alone time every day. Why not fill that time with a little something for yourself? I'm fit, good looking, discreet and available. If you're feeling under appreciated, let me hold you in my strong arms and remind you what it feels like to be desired. We can explore every fantasy you have, and make you feel like a sexy goddess. All very discreet... this will be your naughty secret. I love the soccer mom girl next door look, don't be shy! If this is something you want, all you have to do is reply.","2014-08-24T21:47:50-0400","2014-09-12T15:19:26-0400"," 0","m4w"
"337","http://eastnc.craigslist.org","ppp","4635899625","http://eastnc.craigslist.org/cas/4635899625.html","4635899625","Sep 12","Pregnant? Missing that special attention?","43","cas","casual encounters","Pikeville/Goldsboro","You will understandably be nervous, we will begin and progress very slowly. I want you to think of this experience in terms of a marathon NOT a sprint. 
I will instruct you to lay down as I caress every inch of your back from your neck to your toes and all areas between.
I will begin with your neck and gradually migrate down your arms and back, yet returning regularly to your neck muscles, creating a migration of my hands over all of your tense muscles until you gradually begin to relax. 
I will ask you to close your eyes and let your mind wander to places that make you feel warm and comfortable. Over time my hands will expand their migration to include your sides, stomach, upper legs and inner thighs, but avoiding those most private and sensitive areas for much later. 
I suspect you will at times become frustrated at the slow deliberate pace, but it is critical to building to the intensity level of the experience. 
You will turn over when asked and I will repeat the process on your front, but again bypassing those most sensitive places to save them for last. Depending on your ability to remain focused I may have you wear a blind fold to ensure your imagination is free of distractions. 
When I am comfortable you are fully ready I will move to the most sensitive areas. This will include multiple circular movements around your key centers, each circle progressively smaller to again bring focus. You will find you legs slowly opening, to offer greater access, begging for my attention to be narrowed and centered on your most private and sensitive places. 
I will be constantly watching and feeling your responses and may at times move back away from your most sensitive places to prolong and build your experience taking you near the edge again and again. 
This is the key to ensuring your full release. Close your eyes and let your imagination take you through this description and on to your vision of the perfect conclusion. 
Interested????","2014-08-25T08:46:26-0400","2014-09-12T15:19:19-0400"," 0","m4w"
"338","http://eastnc.craigslist.org","ppp","4636490742","http://eastnc.craigslist.org/m4m/4636490742.html","4636490742","Sep 12","ECU guys?","19","m4m","men seeking men","greenville","Young college kid looking to experiment a little
wanna try JO,swapping blow jobs and maybe topping
i'm 19,brown hair,150lbs,brown eyes,about 5'8
i'm asian,so hope your cool with that
I have a nice dick and ass for ya...lol
Looking for other college guys but will consider others
if in shape and good looking.Get back at me and describe 
yourself and send a few pics my way so i can have a look","2014-08-25T14:13:52-0400","2014-09-12T14:10:41-0400"," 2",NA
"339","http://eastnc.craigslist.org","ppp","4636524324","http://eastnc.craigslist.org/cas/4636524324.html","4636524324","Sep 12","looking to give a nice wet bj","40","cas","casual encounters","bailey/wilson/rm","hey whats up like the title says latino chub here 200lbs  5ft 4in  also enjoy being a bottom ddd free i dont smoke or drink and not oppose to it  so hmu if u r interested pls b real no fakes I can't host u must host or no a place for car head I don't p4p and I don't go to other sites","2014-08-25T14:30:22-0400","2014-09-12T08:36:02-0400"," 0","m4m"
"340","http://eastnc.craigslist.org","ppp","4637176759","http://eastnc.craigslist.org/cas/4637176759.html","4637176759","Sep 12","who wants to play?","45","cas","casual encounters","between rocky mount and wilson","Average sized cock (7"")  with well above average balls, trying to find a willing recipient (s) Send some pics, I can reply with a couple as well. looking for this week. Put ""want cock"" in beginning or be deleted.","2014-08-25T20:54:02-0400","2014-09-12T05:12:13-0400"," 0","m4ww"
"341","http://eastnc.craigslist.org","ppp","4637296638","http://eastnc.craigslist.org/cas/4637296638.html","4637296638","Sep 12","Looking for couples are female 65+ years old","42","cas","casual encounters","Johnston/Wayne/Lenor","Hi there. I am a man (42 years old), and I am looking for a much older woman to have some bedroom fun. I am looking for a much older woman to have some bedroom fun and pleasurable times. Are there any women are couples 65-75 years old (or older) that would like the pleasurable company of a 42 year old man? I have never been with a much older woman before, and would love for you to be my first grandma lover.","2014-08-25T22:28:45-0400","2014-09-12T11:04:41-0400"," 0","m4mw"
"342","http://eastnc.craigslist.org","ppp","4638731552","http://eastnc.craigslist.org/cas/4638731552.html","4638731552","Sep 12","Discreet clean pussy","30","cas","casual encounters","greenville","30 white male.  5'11 average body.  Nice looking with a nice cock.  Clean and 110% disease free here. Lots of stamina.  Love oral.  Looking for some good clean fun.  Daytime play only.  Size not an issue...really don't have a type.  I love pleasing women in all age shapes and sizes.","2014-08-26T19:18:56-0400","2014-09-12T08:02:06-0400"," 0","m4w"
"343","http://eastnc.craigslist.org","ppp","4638827492","http://eastnc.craigslist.org/cas/4638827492.html","4638827492","Sep 12","any FTM guys in Greenville?","28","cas","casual encounters","gvegas","Any female to male transexuals around gvegas that like to hook up with guys?  Hit me up.  I've been with one and fucking loved it.  Clean ddf and good looking here.  Pic shows type of guy I'm searching for...","2014-08-26T20:27:41-0400","2014-09-12T08:01:42-0400"," 0","m4t"
"344","http://eastnc.craigslist.org","ppp","4639113351","http://eastnc.craigslist.org/cas/4639113351.html","4639113351","Sep 12","looking for a dude to gag me and bust down my throat","30","cas","casual encounters","Greenville","Hey masculine white guy very easy going have 420 and beer looking for another guy 35 and under to come chill.. Pic for reply.. tattoos huge turn on","2014-08-27T01:12:30-0400","2014-09-12T01:34:16-0400"," 0",NA
"345","http://eastnc.craigslist.org","ppp","4639231873","http://eastnc.craigslist.org/cas/4639231873.html","4639231873","Sep 12","Younger Girls for Older Mature Men","45","cas","casual encounters","Wilson","My friends describe me as a good looking guy, tall dark and handsome type, outgoing, charming, witty, etc... I'm self employed, intelligent, and can hold a conversation. 6 foot, athletic/slim build and larger than average if you know what I mean. 
Any college age /younger girls out there for a daddy figure? Maybe for some role play, bend you over my knee for a good spanking for disobedience, being a bad girl, or maybe you just always had a fantasy of taking care of daddy. Anything goes. Any race or body type welcome. Put ""father"" in the subject line and then tell me what your fantasy or role play is.  18 to 28","2014-08-27T07:22:35-0400","2014-09-12T11:06:33-0400"," 0","m4w"
"346","http://eastnc.craigslist.org","ppp","4639232474","http://eastnc.craigslist.org/cas/4639232474.html","4639232474","Sep 12","Horny Stepdad looking for a horny Stepdaughter","44","cas","casual encounters","Goldsboro","Thanks for looking at my ad. I take it you have the same fantasy as me. That's cool, cause I love this fantasy and want to meet a girl that wants to role play daddy/daughter. I'm 6' 210# very fit built, 7.5"" cut and thick cock. I'm very clean, easy going daddy that is very oral and long-lasting. You should be older than 18. What I prefer is a small breasted and shaved female but OPEN to all. Please put Daddy in the subject box to weed out the spam, tell me about yourself and any limits you may have. A pic would be nice too. I'm very discreet so if you are in a relationship I'm cool with that. This is strictly role play sex and lots of oral sex too.","2014-08-27T07:23:49-0400","2014-09-12T11:05:36-0400"," 0","m4w"
"347","http://eastnc.craigslist.org","ppp","4639233285","http://eastnc.craigslist.org/cas/4639233285.html","4639233285","Sep 12","BBW 300+ PLEASE","45","cas","casual encounters","Goldsboro/Wilson","I would like to meet up with some women that are larger than the typical sized lady. BBW or SSBBW women who like their size confident not shy. I have always been attracted to that body type. Iam average size 5'11"" 190 . Please be ddf. I can come to you. Have pics so if you send some will return a pic. Hope to hear from my big sexy ladies. I love to please. m4mw m4ww m4w","2014-08-27T07:25:29-0400","2014-09-12T11:05:00-0400"," 0","m4w"
"348","http://eastnc.craigslist.org","ppp","4639276550","http://eastnc.craigslist.org/cas/4639276550.html","4639276550","Sep 12","Looking for extra work","40","cas","casual encounters","wilson, rocky mount, tarboro, surrounding area","I am looking for side work to do, just let me know what you need and we can possibly work things out. I can clean house in the nude. Hope to hear back from you as I really need some help. Thanks for reading this post.","2014-08-27T08:30:17-0400","2014-09-12T12:13:28-0400"," 0","m4m"
"349","http://eastnc.craigslist.org","ppp","4640394282","http://eastnc.craigslist.org/cas/4640394282.html","4640394282","Sep 11","WANTING A CHUB","38","cas","casual encounters","GREENVILLE","Looking to hook up with a chub to give some good head,  Will blow you till you shoot your hot load cross my face. Clean discreet and drug free.  Can host.  Hit me up.","2014-08-27T19:36:06-0400","2014-09-11T19:10:24-0400"," 0","m4m"
"350","http://eastnc.craigslist.org","ppp","4641700307","http://eastnc.craigslist.org/m4m/4641700307.html","4641700307","Sep 12","Young looking for older","20","m4m","men seeking men","Greenville","Younger black guy here, college student, 20 years old. Good looking, 6'. In shape. 8in and cut. Looking for older men, the older and hairier the better. I can host. Let me know if interested. Looking for today if possible. Could maybe be an ongoing thing if we click.
I'm a very easy going and kind person. Very respectful. I'd consider myself to be very versatile... Into most things sexual with the exception of pain and skats... 
Anywho... I'm looking as long as the ad is up.
PS: NOT looking ""generosity"" or Any sort of payment. I just enjoy the company of an older man.","2014-08-28T16:29:39-0400","2014-09-12T10:08:59-0400"," 0",NA
"351","http://eastnc.craigslist.org","ppp","4642096346","http://eastnc.craigslist.org/m4m/4642096346.html","4642096346","Sep 11","just moved to seaboard looking or safe fun","35","m4m","men seeking men","seaboard","Am in seaboard for work attractive vers guy. Play safe. Wanting a a masculine top or vers guy to chill with with avg to athletic build. Am med brown complexion 5'9 195 thick. 7.5 cut, play safe  hit me up if you are interested.","2014-08-28T21:12:35-0400","2014-09-11T19:24:04-0400"," 3","m4m"
"352","http://eastnc.craigslist.org","ppp","4643722098","http://eastnc.craigslist.org/cas/4643722098.html","4643722098","Sep 11","need nightcap","39","cas","casual encounters","greenville","On the downlow guy here looking for a way to wind the evening down...what better way than getting into some hot oral.  Clean discreet and drug free.  Can host.  NSA....I service you till you cumm...we do whatever turns you on","2014-08-29T22:31:10-0400","2014-09-11T23:32:06-0400"," 0","m4m"
"353","http://eastnc.craigslist.org","ppp","4643751207","http://eastnc.craigslist.org/cas/4643751207.html","4643751207","Sep 11","I am looking for a top",NA,"cas","casual encounters","Trenton/new bern","thick252 black bottom226 looking a9308 FWB....someone that really wants a real friendship, pls be discreet and any race ddf, drama free 18-45 and mature...put MLK in subject line please includes stats or pic in first email..kik..reddboy310","2014-08-29T23:03:45-0400","2014-09-11T23:20:48-0400"," 0","m4m"
"354","http://eastnc.craigslist.org","ppp","4644014097","http://eastnc.craigslist.org/m4w/4644014097.html","4644014097","Sep 12","A  great  day !","62","m4w","men seeking women","Greenville","I choose who I work for! I will need a public meeting to discuss if we should continue or not! I will answer any questions you have at all ! I will be candid and forthright in every answer! Please ask rather than prejudge anything on your mind! I have references by text or email if you require them after we have met for those that are serious ! If you are a good judge of character and accept visible proof of my abilities they may not be necessary! I am both capable and caring and personally affected by your successes! If prepared at this point to continue then please send your pic (does not need your face in it) and cell number and I do have time this week even though I am near capacity! 
I am a very real older man with a very real talent at this and willing to sit and talk for hours if necessary to you about this in a public place near my home in Greenville!I do not want your money . If you do not think I am an honest and sincere and talented and proven man then we will part friends from that public place in Greenville! It is not for all that apply and I have been extremely successful for more than 4 dozen SBs so far! 
I love telling my story ! Please respond either way! Carry this conversation to fruition and your TOTAL educated knowledgeable decision! Make no pre-judgements!
 I am local and this is not a scam to go to some site! I am very good at this! Your best interest is my primary goal !
I am 100% successful at getting you offers that will fill your needs and beyond in every case! We interview in public for an hour or more until you are comfortable!
I do not accept all that apply! Only the correct attitude is acceptable!
You interview the potential SDs and and you decide in every case!
A very real and personalized system that we make fit your agenda! Customized if you will -just for your unique circumstances! 
We will find you what you need!
We will train you for your interviews !
We will personalize your profile!
I will be your biggest advocate!
I will do everything necessary to promote your well being ,safety and prosperity! 
If you allow it I will be your very real new best friend!
I can find you rent ,car and spending money and sometimes even more !
Your happiness and safety are what keep me very motivated!","2014-08-30T08:43:46-0400","2014-09-12T09:17:27-0400"," 0",NA
"355","http://eastnc.craigslist.org","ppp","4644385521","http://eastnc.craigslist.org/m4w/4644385521.html","4644385521","Sep 12","Looking for love and friendship! But even more than that!","59","m4w","men seeking women","Greenville","Looking for a woman ,small to medium and good looking for more than just friendship as time goes on. I am 62 yr old all but divorced white male, retired and looking for a sane woman. Have already done crazy and a loveless marriage as well for 15 yrs! . I have brown/graying hair and would like someone who is fun and witty. Please include a pic and some of your likes and dislikes. Thanks for your time. I am looking a quick start relationship and not a long dating cold one ! I have limitations that include I am exclusively oral and would have you know that up front! You and I should click quickly or move on as I have done my time in Purgatory! She told me I was the most kind and giving man she had ever known when I left her after 39 yrs! b I am starved for intimacy and hope you are as well!","2014-08-30T12:56:54-0400","2014-09-12T09:23:25-0400"," 0",NA
