"","cityurl","subcl","post_id","post_link","post_data_id","post_date_raw","post_title","post_price","post_subcl","post_subcltype","post_loc","post_text","post_date","post_last_update","post_pics","post_type"
"203","http://sfbay.craigslist.org","ppp","4669550275","http://sfbay.craigslist.org/eby/cas/4669550275.html","4669550275","Sep 15","Attached Woman Wanted","62","cas","casual encounters","alameda","Attached Woman Wanted, 40 to 60 years old who wishes to do more. The kids are in school, or gone, husband would rather play golf, or always away on trips, and your yearning for some companionship, a man's touch, your passion isn't dead, so.
Share a note, erotica, a call, a text, a cup of coffee, and hopefully each other now and then.
Me, attached, 5'6, dark hair, native, who wants more of the same. No pros, druggies or bots, prefer White or Asian, Native, Hispanic, or European a size 12 and under, but English speaking, D&D Free. Put the city you live in in subject line.
Send a current (this year) face or clothed photo of yourself and a bit about yourself. I know this is a stretch but, you wouldn't be reading this ad if you weren't looking, so take the leap and write back.","2014-09-15T13:07:12-0700","2014-09-15T13:07:12-0700"," 0","m4w"
"204","http://sfbay.craigslist.org","ppp","4669550779","http://sfbay.craigslist.org/sfc/m4m/4669550779.html","4669550779","Sep 15","Dedicated DEEP Throat Cocksucker","60","m4m","men seeking men","noe valley","I'm available all afternoon today.  I LOVE sucking cock. I'm proven at nine inches and would welcome more. Both more men and more inches. :)
I'm also available Fridays, evenings and weekends, and throughout the week with advance notice.
I'm VERY oral and tactile and hoping for a regular connection. I'm also a great kisser (and cuddler if you're also inclined). Regardless of your sexual orientation, if you're looking for a little bromance, a safe getaway, or some attention centered on you getting a great blow job and oral attention, you should look no further.
I'm attracted to lithe/athletic/defined men of all orientations. Anyone who is seven inches or larger and loves getting sucked is welcome. I want to share my skills with men who love a great blow job and appreciate a true deep throat. Whether you are single, married, gay, straight or bisexual, just know I'm discreet.
I'm 6', 175, 60, HIV negative, DDF, no PNP. 
Send your photos and description if you're interested in meeting, otherwise I won't respond.","2014-09-15T13:07:30-0700","2014-09-15T13:08:31-0700"," 2","m4m"
"205","http://sfbay.craigslist.org","ppp","4669551021","http://sfbay.craigslist.org/sby/cas/4669551021.html","4669551021","Sep 15","Young guy for hookup","18","cas","casual encounters","cupertino","Hey, I'm a young guy looking for other young guys. I just wanna meet up and hookup. We can make out, handjobs, blowjobs, rim, I'm a top so if we get that far I can do that. But you don't need to be a bottom. If you are a total top I can just blow you. Whatever works, just I don't bottom. I can't host, but am open to anywhere else. Text me or email me with a pic and stats ( I'll respond faster via text) Looking for now!
Four o eight seven seven five four one three five","2014-09-15T13:07:38-0700","2014-09-15T13:07:38-0700"," 5","m4m"
"206","http://sfbay.craigslist.org","ppp","4669551454","http://sfbay.craigslist.org/sfc/cas/4669551454.html","4669551454","Sep 15","Fuck my ass after I suck your cock~","24","cas","casual encounters","pacific heights","I'm looking for someone with a thick, solid cock to let me suck them, and then fuck my tight ass for as long as they want...
I'm 170lbs, caucasian, 6.5in cut, drug free, disease free, clean and sane. you must be as well.
no recip required or desired. safe play only. I can host or travel- would prefer close by.
only e-mails with cock pics will receive replies and/or pics from myself. no pic, no reply.
im looking for as long as this is up!","2014-09-15T13:07:51-0700","2014-09-15T13:07:51-0700"," 0","m4m"
"207","http://sfbay.craigslist.org","ppp","4669552229","http://sfbay.craigslist.org/sfc/m4m/4669552229.html","4669552229","Sep 15","DL Jack Off Buddy",NA,"m4m","men seeking men","castro / upper market","Looking for another discreet dude, who likes to strip down, show off, and beat off, with a bud.
On the DL here, not looking for sex, just some low key 'bate time. 43 here, good looking, fit, 6ft, 185lbs, trimmed facial, pics to share. 420 and porn friendly. Need you to host.","2014-09-15T13:08:15-0700","2014-09-15T13:09:00-0700"," 0","m4m"
"208","http://sfbay.craigslist.org","ppp","4669553149","http://sfbay.craigslist.org/eby/m4m/4669553149.html","4669553149","Sep 15","Need to sniff/lick RIPE ASS today","38","m4m","men seeking men","berkeley","5-10 150lb slim white dude here, ate some ass this morning and horny for more.
Looking for someone with a nice sweaty/ripe morning butt. I wanna push my face in and sniff/lick like crazy. Get high sniffing your butt scent. Love to make you moan while I worship your ass. Relax while I work my tongue in and clean you good. 
Also love to suck cock and drink piss and cum.
LATINOS/asians/indians+++ 
Can host in Berkeley","2014-09-15T13:08:43-0700","2014-09-15T13:08:43-0700"," 0",NA
"209","http://sfbay.craigslist.org","ppp","4669554335","http://sfbay.craigslist.org/scz/cas/4669554335.html","4669554335","Sep 15","Bi curious",NA,"cas","casual encounters","santa cruz","Hi guys
I'm straight but wanna explore with a hung guy
I'm fit and clean masculine and muscular
I love watching porn
I wanna hang with a chill guy","2014-09-15T13:09:21-0700","2014-09-15T13:09:21-0700"," 0","m4m"
"210","http://sfbay.craigslist.org","ppp","4669555061","http://sfbay.craigslist.org/sfc/cas/4669555061.html","4669555061","Sep 15","Discreet Visitor Looking to Host Lunch Time JO/Oral","38","cas","casual encounters","financial district","Discreet suit/tie visitor looking to host another discreet dude now for JO, maybe oral.
Worked out, hairy chest, thick cut cock.
Can host at corp apt.
Send a pic and stats and lets do it.","2014-09-15T13:09:43-0700","2014-09-15T13:09:44-0700"," 0","m4m"
"211","http://sfbay.craigslist.org","ppp","4669555596","http://sfbay.craigslist.org/eby/cas/4669555596.html","4669555596","Sep 15","Army soldier for mutual masturbation",NA,"cas","casual encounters",NA,"Army soldier here for fun. I can travel. Looking to be watched while I stroke myself or just play and have fun. Let me know if you are interested. Women and couples only. NO MEN! Please send a FACE pic.","2014-09-15T13:10:01-0700","2014-09-15T13:10:01-0700"," 3","m4w"
"212","http://sfbay.craigslist.org","ppp","4669555621","http://sfbay.craigslist.org/eby/cas/4669555621.html","4669555621","Sep 15","Bottom Guy Here, I'm looking for A Top guy now","42","cas","casual encounters","danville / san ramon","Good Looking Bottom guy here, I'm looking for a Top guy to come over and get me on all fours, get you nice and hard then slide yourself in until you bust, if your interested, then reply with your picture or stats for mine. Very discreet here too, be clean,dff.","2014-09-15T13:10:02-0700","2014-09-15T13:10:02-0700"," 0","m4m"
"213","http://sfbay.craigslist.org","ppp","4669556083","http://sfbay.craigslist.org/eby/m4m/4669556083.html","4669556083","Sep 15","Bottom Guy Here, I'm looking for A Top guy now","42","m4m","men seeking men","danville / san ramon","Good Looking Bottom guy here, I'm looking for a Top guy to come over and get me on all fours, get you nice and hard then slide yourself in until you bust, if your interested, then reply with your picture or stats for mine. Very discreet here too, be clean,dff.","2014-09-15T13:10:17-0700","2014-09-15T13:10:17-0700"," 0",NA
"214","http://sfbay.craigslist.org","ppp","4669556090","http://sfbay.craigslist.org/sfc/m4m/4669556090.html","4669556090","Sep 15","Tall Athlete seeking massage","28","m4m","men seeking men","mission district","Would love to have a strong massage today with possibility for more. Young, athletic, seeking older and masculine men to be sensual. Love being in underwear, briefs.
Hit me up for pics and we can go from there. Free this afternoon.","2014-09-15T13:10:17-0700","2014-09-15T13:10:17-0700"," 0",NA
"215","http://sfbay.craigslist.org","ppp","4669557046","http://sfbay.craigslist.org/eby/cas/4669557046.html","4669557046","Sep 15","Army soldier for mutual masturbation",NA,"cas","casual encounters",NA,"Army soldier here for fun. I can travel. Looking to be watched while I stroke myself or just play and have fun. Let me know if you are interested. Women and couples only. NO MEN! Please send a FACE pic.","2014-09-15T13:10:47-0700","2014-09-15T13:10:47-0700"," 3","m4mw"
"216","http://sfbay.craigslist.org","ppp","4669557263","http://sfbay.craigslist.org/eby/m4m/4669557263.html","4669557263","Sep 15","let's party and get naked","41","m4m","men seeking men","walnut creek","looking for a good lkng guy that wants to have some fun today. party, stroke, suck, probably not into fucking, but open to lots. safe only. hmu w/your stats and a little about what you're into. Tall, lean (six foot, one seventy five#), masc and gl wm, 41, scruffy, clean and hiv neg. Got a face pic to trade and prefer to host in Pleasant Hill. If you're REALLY hot I could travel too.  :)  thanks!","2014-09-15T13:10:53-0700","2014-09-15T13:10:53-0700"," 0",NA
"217","http://sfbay.craigslist.org","ppp","4669558129","http://sfbay.craigslist.org/pen/stp/4669558129.html","4669558129","Sep 15","Whose up for MNF this evening","23","stp","strictly platonic","south san francisco","Any women up for Monday Night Football tonight? I work in SSF and will be getting out of the gym around 5 or 6pm. Looking for someone who is also single to watch the game with. Age isn't an issue (even if you're over 40, it's fine, really). And if you aren't single, well then we'll figure it out haha.
A picture would be a good start. And I don't know if I want this to be strictly platonic or not. If there is mutual attraction, I sure would be open to something. FWB, or whatnot.
And a quick bit about me... Since I am at work right now, I don't have any pictures on my laptop to add here. But, if you email me, I can send my number and can definitely text a picture. To give you an idea of me... I am 5'10'', about 155 lbs, healthy and in great shape (since I go to the gym every weekday after work), brown skin, dark hair. And I am outgoing, not pushy, and not looking for drama.
Anyway, I don't know the SSF area too well since I live much closer to the south bay. So if you have a spot in mind, or if you want to host even better. Let me know if you are interested.","2014-09-15T13:11:22-0700","2014-09-15T13:11:22-0700"," 0","m4w"
"218","http://sfbay.craigslist.org","ppp","4669558285","http://sfbay.craigslist.org/nby/m4m/4669558285.html","4669558285","Sep 15","Nice day to play around outside watch the clouds go by on my...","58","m4m","men seeking men","russian river","deck garden. 
Very pvt and secure.Guerneville.
Kiss, hug, grope, fondle, jack etc. 
Romp like pigs in heat.
Smoke some, get relaxed and horny.
Then we can go back to my play room
that overlooks it and flip fuck in my sling.
So be versatile or top is good but not all bottom.
Nights like this don't come around to often.
Lets go for it.
Contact with stats and picture will help speed things.
Prefer bareback.
HIV poz","2014-09-15T13:11:27-0700","2014-09-15T13:11:27-0700"," 0",NA
"219","http://sfbay.craigslist.org","ppp","4669558831","http://sfbay.craigslist.org/eby/m4m/4669558831.html","4669558831","Sep 15","fun discreet bottom looking for a reg top fuck buddy","26","m4m","men seeking men","dublin / pleasanton / livermore","hi,
always horny and its been awhile... well I decided to seek out a reg buddy.
Im 26 
white male,
green eyes, dark hair, 5'8 and about 160lb.
clean, safe and discreet.
your face pic gets you mine.
I can host sometimes but also like to travel to ya.
so get back to me.
thanks","2014-09-15T13:11:44-0700","2014-09-15T13:11:44-0700"," 0",NA
"220","http://sfbay.craigslist.org","ppp","4669558849","http://sfbay.craigslist.org/sby/cas/4669558849.html","4669558849","Sep 15","Inshape bi wm biz traveler looking for later tonight","41","cas","casual encounters","san jose north","6'3 200 masc ddfree professional bi dwm arriving around 10pm this evening.  Looking to host a fit, ddfree bi wm, 21-40 yo. I'm into oral, vers bottom, making out. Please be masc, gl and good shape. No fats or fems. Put ""SJ Bi"" in the subject line. I'll only be able to check email periodically since I'm traveling. Thanks","2014-09-15T13:11:45-0700","2014-09-15T13:11:45-0700"," 3","m4m"
"221","http://sfbay.craigslist.org","ppp","4669559656","http://sfbay.craigslist.org/eby/cas/4669559656.html","4669559656","Sep 15","straight as can be","22","cas","casual encounters","concord / pleasant hill / martinez","Hello today is Sept 15th 2014 and a clear day. So now that you know I'm real I'll start with my stats 22 years old very handsome with a nice body .no fat on me . I'm 175 lbs 5 foot 11 inches. I'm looking to get sucked ,rimmed, and possible fuck you if you are passable. Please be clean and no drugs. Send pics and stats. Hopefully you can host I can host but would have to be quiet. Also down for a threesome. 
w4m t4m mw4m","2014-09-15T13:12:11-0700","2014-09-15T13:12:11-0700"," 0","m4t"
"222","http://sfbay.craigslist.org","ppp","4669560174","http://sfbay.craigslist.org/sfc/cas/4669560174.html","4669560174","Sep 15","lets play","24","cas","casual encounters","inner sunset / UCSF","hey Id like to meet a lady friend for some fun. I can host and travel and am open to most stuff depending on our chemistry.","2014-09-15T13:12:28-0700","2014-09-15T13:12:28-0700"," 0","m4t"
"223","http://sfbay.craigslist.org","ppp","4669560536","http://sfbay.craigslist.org/sfc/m4m/4669560536.html","4669560536","Sep 15","NEG bottom hosting thick dick bareback tops","45","m4m","men seeking men","inner sunset / UCSF","Got wheels? Come over and fuck me ~ rough and raw! Dump your load inside me! [Close to the N Judah, too]
White, Latino, Middle Eastern VERBAL, bigger and stocky, furry and scruffy boys DEFINITELY HMU
Please be clean ~ showered and honest about your status. Neg and undetectable stud friendly
This is for NOW. NO PNP, poppers cool.

Your stats, location and pics in FIRST EMAIL; others deleted. Mine are posted.","2014-09-15T13:12:40-0700","2014-09-15T13:12:40-0700"," 6",NA
"224","http://sfbay.craigslist.org","ppp","4669560583","http://sfbay.craigslist.org/eby/cas/4669560583.html","4669560583","Sep 15","","24","cas","casual encounters","Berkeley","This cub needs a woman who can take everything that I have to give. My sex drive is ridiculous, and it seems like no woman can actually keep up with me. Doesn't matter how old you are as long as you're sexy, kinky, and actually have two brain cells to rub together.
I can't host, but have a car and a motorcycle. My ideal experience would be drinks, laughs and mind-blowing sex, followed by some 420 and serious intellectual conversation. I'm very oral, so be clean and trim down there (I don't need hairless, though). Giving toe-curling cunnilingus is my absolute favorite thing!
I'll probably fill all your check boxes, unless you are materialistic or only find very athletic body types attractive. Not that I'm nonathletic; I'm a martial artist and no weakling by any means. Being thin works for me. I just don't have a single thing that I feel the need to compensate for: I drive a '99 camry because it's cheap and bulletproof, I wear plain, comfortable clothing, and I shave my head.
I will want to see a recent neg test first. I would hope you would want to see mine as well. Happy to work around your schedule and be discreet if necessary.
Ask me if you want to know more. Reply with your favorite band/type of music in the subject line and pictures, please!","2014-09-15T13:12:42-0700","2014-09-15T13:12:42-0700"," 0","m4w"
"225","http://sfbay.craigslist.org","ppp","4669560585","http://sfbay.craigslist.org/eby/cas/4669560585.html","4669560585","Sep 15","DL Basketbaall","20","cas","casual encounters","vallejo / benicia","DL discrete masc verse bottom 9cut 
std free hiv negative clean
can host or travel be mobile no fems
Generous welcomed 
no endless emails send full stats & pics
Sevenzero7six2one548four","2014-09-15T13:12:42-0700","2014-09-15T13:12:42-0700"," 4","m4m"
"226","http://sfbay.craigslist.org","ppp","4669560953","http://sfbay.craigslist.org/eby/cas/4669560953.html","4669560953","Sep 15","Looking for a girl that likes small dicks","24","cas","casual encounters","oakland east","Hi I'm looking for a girl that enjoys a guy with a small dick 5inches I like freaky girls I'm very passionate and like to fuck alot I'm open to any race must be disease free like I am 420 okay but nothing else.","2014-09-15T13:12:53-0700","2014-09-15T13:20:55-0700"," 0","m4w"
"227","http://sfbay.craigslist.org","ppp","4669563150","http://sfbay.craigslist.org/eby/m4m/4669563150.html","4669563150","Sep 15","White boy for fun","26","m4m","men seeking men","oakland lake merritt / grand","Hi there,
White boy 26 here, looking to practice his oral skills. I`m clean, discreet, D&D free. 5`11, 190lbs, fit. 6.5 uncut
You enjoy sloppy BJS from white boys, are be clean, discreet, respectful and def. D&D free. Prefer dicks smaller than 8 since i am not very experienced. 
Drop me a line and pic if interested and I`ll respond with the same.","2014-09-15T13:14:04-0700","2014-09-15T13:14:04-0700"," 0",NA
"228","http://sfbay.craigslist.org","ppp","4669563323","http://sfbay.craigslist.org/sfc/cas/4669563323.html","4669563323","Sep 15","Sub Bottom Wanted","50","cas","casual encounters","ingleside / SFSU / CCSF","Come over and Kiss, suck and get fucked, tied up, spanked and clothes pinned. I'm 6'1"" 195lbs 7. Cut. Please reply with pic and stats.  Sub Bottoms come play!!!","2014-09-15T13:14:10-0700","2014-09-15T13:14:10-0700"," 2","m4m"
"229","http://sfbay.craigslist.org","ppp","4669563564","http://sfbay.craigslist.org/eby/m4m/4669563564.html","4669563564","Sep 15","Home Alone","52","m4m","men seeking men","oakland hills / mills","Gay Black kicked back guy looking to suck, fuck or flip. Stocky, sexy and skilled ;)
Would be cool to have a walking bud near King Estates too","2014-09-15T13:14:17-0700","2014-09-15T13:14:17-0700"," 0",NA
"230","http://sfbay.craigslist.org","ppp","4669563709","http://sfbay.craigslist.org/eby/cas/4669563709.html","4669563709","Sep 15","KirkerCreek Protein","49","cas","casual encounters","pittsburg / antioch","I live in the Kirker Creek complex and am married but I also massively love the taste of cum. I would love to hook up with another resident married or single that would like to jack off and shoot their load directly in my mouth or on their body and let me clean you up with my tongue. Please only reply if you are also a resident on the property.","2014-09-15T13:14:22-0700","2014-09-15T13:14:22-0700"," 0","m4m"
"231","http://sfbay.craigslist.org","ppp","4669563902","http://sfbay.craigslist.org/sby/cas/4669563902.html","4669563902","Sep 15","Hi I'm tgirl lookin chicos traviesos","38","cas","casual encounters","san jose north","Hola busco chicos que deciendan fantaciar con una chica como yo soy tgirl muy complaciente y divertida si me invitar a bailar estaria mejor any age between 21 to 60 any race ok send me pic firs email.","2014-09-15T13:14:28-0700","2014-09-15T13:25:08-0700"," 2","t4m"
"232","http://sfbay.craigslist.org","ppp","4669564406","http://sfbay.craigslist.org/scz/cas/4669564406.html","4669564406","Sep 15","Looking For Some Sweet Pussy","52","cas","casual encounters","watsonville","Ok  ladies  where  are  you and  I do  know  that  it  has been a while  for some of  you since a man has gone down on  you and eatting  your pussy for you and sucked on  that clit too,And we can't leave out  your  boobs too,So  if  you  fit into this area and would like me to come over to  your place and suck on your  clit and lick  your pussy and your  boobs,Age don't matter,If looks  don't matter to you at all,Please get back  to me and be free after 12-am thats when I get off work,  
SO  I  do hope  to here back  from some one   soon.Don't be  shy  now ok.","2014-09-15T13:14:44-0700","2014-09-15T13:14:44-0700"," 2","m4w"
"233","http://sfbay.craigslist.org","ppp","4669564852","http://sfbay.craigslist.org/sby/m4w/4669564852.html","4669564852","Sep 15","bi male looking for sensual couple","46","m4w","men seeking women","san jose south","Asian  looking for woman or couple for fun that i have fanncy  any races, you must be 19  years and over , YOU HOST STD/HIV neg no drugs
me 130 lbs, nice body, smooth, hiv neg bug free  If you interested sent stats and pics","2014-09-15T13:14:59-0700","2014-09-15T13:14:59-0700"," 0","m4m"
"234","http://sfbay.craigslist.org","ppp","4669565484","http://sfbay.craigslist.org/sfc/cas/4669565484.html","4669565484","Sep 15","Where can I possibly find a kinky sensual FWB?","27","cas","casual encounters","inner sunset / UCSF","Feel free to drop me a line if you're interested in an intelligent, attentive, attractive, and endowed (8 inches) fellow for some amazing encounters.
Hope to talk soon!
kik dzjdp","2014-09-15T13:15:19-0700","2014-09-15T13:15:19-0700"," 0","m4w"
"235","http://sfbay.craigslist.org","ppp","4669565785","http://sfbay.craigslist.org/eby/cas/4669565785.html","4669565785","Sep 15","Daddy/uncle for 18","42","cas","casual encounters","fairfield / vacaville","Hello ;-)
As the title says, I'm an early 40's white man looking for a much younger woman for occasional intimate play. I'm married and want to find a young woman to give me what I'm not getting at home. Your status does not matter as long as you are ok with mine. I desire discretion and will return it 100%. 
I'm fit and healthy and expect the same in return. I'm not into any drugs, diseases, or drama. Hopefully you feel likewise. 5'9"", 155lbs, short greying hair, blue eyes, hairy chest. I exercise 3-4 times per week. You will not find a lazy guy with a beer gut here. Now I just need some regular sexercise. lol  I'm white. Your race or ethnic background makes no difference. An attractive woman is attractive no matter the background. I'm way more concerned about your attitude and how we click then your skin tone. 
I'm open minded in terms of what type of play you also desire. As long as we communicate and are honest with each other, things should be great.
Your turn now. Tell me about yourself and what made you respond. If you feel comfortable sending a pic, please do.","2014-09-15T13:15:29-0700","2014-09-15T13:15:29-0700"," 0","m4w"
"236","http://sfbay.craigslist.org","ppp","4669565815","http://sfbay.craigslist.org/scz/cas/4669565815.html","4669565815","Sep 15","Wheres That Sweet Pussy  AT  Yummy","52","cas","casual encounters","watsonville","I  am looking  for  some sweet pussy  to eat and lick until  you cum  good,I also love to  suck on some nice boobs no matter  what  size,If looks don't matter  to  you and you can be free  afte  midnight on  any  day  of  the  week,Please get back  to me,Agdon't matter  to me,I am 100% mexican,Or  if  you just  want some one to keep  you  company at night  for  while please  let me know,I am trying to  make friends and also  have  fun  too,So  if  your looking  for the  same with out  worried about what i look like,See  I am  that man  that  don't or wont  go by looks but  by  whats  in  your  heart,So  I do  hope to  here from some one  soon. I  will  do  my best to make you happy  some how.","2014-09-15T13:15:31-0700","2014-09-15T13:15:31-0700"," 0","m4w"
"237","http://sfbay.craigslist.org","ppp","4669566541","http://sfbay.craigslist.org/sby/cas/4669566541.html","4669566541","Sep 15","Amazing head now from hot guy.","30","cas","casual encounters","milpitas","Very attractive strait guy here who loves giving head. Looking for a tgirl who would like head right now. Just looking to suck and swallow for u. Anything else is ok too if u want it. I'm mobile and ready now. Hurry","2014-09-15T13:15:54-0700","2014-09-15T13:15:54-0700"," 0","m4t"
"238","http://sfbay.craigslist.org","ppp","4669567292","http://sfbay.craigslist.org/eby/m4m/4669567292.html","4669567292","Sep 15","DL BBaaller","20","m4m","men seeking men","vallejo / benicia","DL discrete masc 6'1 180 verse bottom 9cut 
std free hiv negative clean
can host or travel be mobile no fems
Generous welcomed 
no endless emails send full stats & pics
707sixtwoone54eightfour","2014-09-15T13:16:20-0700","2014-09-15T13:16:20-0700"," 3",NA
"239","http://sfbay.craigslist.org","ppp","4669568705","http://sfbay.craigslist.org/eby/cas/4669568705.html","4669568705","Sep 15","Hosting tonite","27","cas","casual encounters","San Pablo","Hey
If you are in a rush but in the mood and around then area then you can use my mouth then go. Only clean dd free discreet guys. Married ts hosting to from eight pm. Pics for address. You need to be clean and dd free.","2014-09-15T13:17:04-0700","2014-09-15T13:17:04-0700"," 0","w4m"
"240","http://sfbay.craigslist.org","ppp","4669569867","http://sfbay.craigslist.org/eby/cas/4669569867.html","4669569867","Sep 15","top CD 4 CD TS or Femme","40","cas","casual encounters","fremont / union city / newark","totally new to this and looking for someone to explore some safe fun with.
non passable just dress in panties and lingerie. want to find someone to dress with and explore.
touching, stroking, fingering and maybe fucking. you must host. you must be clean and std free and ok with the use of condoms for anything more that touching and stroking","2014-09-15T13:17:41-0700","2014-09-15T13:17:41-0700"," 0","t4t"
