"","cityurl","subcl","post_id","post_link","post_data_id","post_date_raw","post_title","post_price","post_subcl","post_subcltype","post_loc","post_text","post_date","post_last_update","post_pics","post_type"
"139","http://austin.craigslist.org","ppp","4669635543","http://austin.craigslist.org/m4m/4669635543.html","4669635543","Sep 15","Let's hang out!","28","m4m","men seeking men","north austin","Stressed out? Need to relax? Let me help you out! I'm a nice looking black male looking to relax your body. I'm 5 feet 11 200 pounds with a nice shaved body. I can host or travel, but would prefer to host. If I sound like the guy for you hit me up. Thanks for reading. Ttys!! I do charge a fee for my service. Looking for now.","2014-09-15T15:53:41-0500","2014-09-15T15:53:41-0500"," 0",NA
"140","http://austin.craigslist.org","ppp","4669635684","http://austin.craigslist.org/m4w/4669635684.html","4669635684","Sep 15","Blonde for single dad?","25","m4w","men seeking women","RR/Austin","I'm looking for a woman who would like to hang out with a single dad. 
I do not mind if you have kids already. 
I am not interested in race or age, I would just like somebody to hang out with, go out, and just chill out. 
I would like to meet someone maybe later tonight, if not maybe this weekend. 
I am glad to send a pic. If you ask for a pic, I expect one too. 
Please only reply if you're serious about meeting. 
We can talk, and text first if that's what you want.","2014-09-15T15:53:46-0500","2014-09-15T15:53:46-0500"," 0",NA
"141","http://austin.craigslist.org","ppp","4669636921","http://austin.craigslist.org/cas/4669636921.html","4669636921","Sep 15","Need a horny woman tonight:)","36","cas","casual encounters","Austin","I'm looking for some great NSA sex tonight. Just got into town, gonna be here a couple of weeks. I have a very nice room off riverside and airport blvd, so I can host. I'm DDF, a total gentleman, and 8"" long and strong! Age and race are not a factor, all I ask is that you be disease free and sane:) all woman welcomed, just be real and no prostitutes please!","2014-09-15T15:54:27-0500","2014-09-15T15:54:27-0500"," 7","m4w"
"142","http://austin.craigslist.org","ppp","4669636928","http://austin.craigslist.org/cas/4669636928.html","4669636928","Sep 15","Need a 3rd to help fuck my FWB",NA,"cas","casual encounters",NA,"Hey Guys - Please realize I'm probably going to get a ton of responses, and try and respond with all the info etc. so I can consider you.
We are looking for a guy:
Goodlooking
25-40 years old
In decent shape or better
Dominant (but respectful and non-crazy)
Clean std free and OK playing safe with condoms
At least 6+ inches
Be able to perform in a MMF threesome
**Please be available Wednesday night at a minimum. Ideally, you would be available Tuesday, Wednesday and Thursday night**
I will give you additional details and pics when you respond. This will take place at our hotel. Trust me, she's incredibly hot and you won't be disappointed. We will both be taking turns on her, taking her at the same time, and fulfilling a big fantasy for her.
Please respond with one or two pics - at least 1 face pic. Tell me about you, your experience with 3somes and anything else that will help me decide. Please also tell me if you'd be ok being the ""backup"" option incase the guy we pick bails. Let me know your availability. I don't care if you're single or not, but you need to be available without having to get home to your wife/gf. If you are in town on business, that's great.
I will get back to everyone that follows directions and meets the criteria, even if it is just to say no thanks.","2014-09-15T15:54:27-0500","2014-09-15T15:54:27-0500"," 0","mw4m"
"143","http://austin.craigslist.org","ppp","4669637725","http://austin.craigslist.org/cas/4669637725.html","4669637725","Sep 15","morning wood?","44","cas","casual encounters","lakeway","very good looking guy...mid-40s...would like to service a lady with my morning wood...head downtown every AM from Lakeway with an 8"" hard on and would love to simply swing by a willing, sexy, horny woman's place and visit a short while...we can truly start the day off right...
I'm in shape and normal with an insatiable sex drive....let's hook up!","2014-09-15T15:54:53-0500","2014-09-15T15:54:53-0500"," 0","m4w"
"144","http://austin.craigslist.org","ppp","4669637812","http://austin.craigslist.org/cas/4669637812.html","4669637812","Sep 15","Looking for a guy that is real","57","cas","casual encounters","manchaca","I looking for a cool hook up some that would be will to play with a older guy I open mind I am 6 foot 200 pounds brown hair blue eyes I have my own house my own car and I am able to host anytime during the day or even at night bisexuals respect straight guys that are willing to want to hang out are mess around with a gay guy and my remakes I do have two roommates that are gay that we do not mess with each other's partners are so called tricks we respect each other there's no photos please do not ask for any X-rated ones","2014-09-15T15:54:56-0500","2014-09-15T15:54:56-0500"," 2","m4m"
"145","http://austin.craigslist.org","ppp","4669637938","http://austin.craigslist.org/cas/4669637938.html","4669637938","Sep 15","Rough humiliating role play?","46","cas","casual encounters","Georgetown","Do you want to be taken advantage of? Totally used by a man, have toys or objects shoved into all holes? Tied down and used?  I am looking to come to your place early tomorrow morning and take complete advantage of you. I am a big and tall burly man, average looking and d/d free.  So if there is a woman interested in something like this, email with ""Use me"" in the subject line and let's make the arrangements.  Pic for pic, no men.","2014-09-15T15:55:01-0500","2014-09-15T15:55:01-0500"," 0","m4w"
"146","http://austin.craigslist.org","ppp","4669640987","http://austin.craigslist.org/cas/4669640987.html","4669640987","Sep 15","ISO hot and passable","30","cas","casual encounters","Central south","Just looking for a hot passable transsexual for fun. Be disease free and cool with DL. 8inch uncut curved, if you enjoy the pics hit me up! ParTy friendly, send clear pic","2014-09-15T15:56:40-0500","2014-09-15T15:56:40-0500"," 3","m4t"
"147","http://austin.craigslist.org","ppp","4669644025","http://austin.craigslist.org/cas/4669644025.html","4669644025","Sep 15","heading home? let me know if you want to get your dick sucked","27","cas","casual encounters","south austin","My place is fine or I can come to your place if you would like that better. You don't have to suck mine unless you want to. I think hairy guys are hot but I also don't have a problem with guys that are smooth. White guys are a plus and I am not into asian or black guys. Please be in good shape. You should send a picture if you want to get a response and meet.","2014-09-15T15:58:25-0500","2014-09-15T15:58:45-0500"," 0","m4m"
"148","http://austin.craigslist.org","ppp","4669644680","http://austin.craigslist.org/m4m/4669644680.html","4669644680","Sep 15","Blk  top lookin 2 travel","24","m4m","men seeking men","Hutto/Pf/ N/ATX","blk 24 yr I'm 185 I'm 6'1 have 9 inch top here lookin to travel to you I do have face pics 
You:white or Latino 19 - 40 age fit ready to handle this 9 inch 
I'm average in body weight lookin for now 
Hit me up :)","2014-09-15T15:58:46-0500","2014-09-15T16:01:33-0500"," 0","m4m"
"149","http://austin.craigslist.org","ppp","4669646770","http://austin.craigslist.org/cas/4669646770.html","4669646770","Sep 15","drain loaded men now",NA,"cas","casual encounters","north central","Sucking here hung men
Me- wht, masc, DDF, 6, 195, 6c, thirsty mouth, hot ass
Anon, w me wearing a hood, blindfolded
Like it when guys moan and or verbal
Also like my nips played w whike I drain u
No loads, cock refused, you must be clean
Safe and Clean here, gay, straight and bi welcomed
Please provide pic of cock or stats
Hit me back sir, will send u directions
Looking still if post is up
Looking for a hot time now","2014-09-15T15:59:58-0500","2014-09-15T15:59:58-0500"," 0","m4m"
"150","http://austin.craigslist.org","ppp","4669647912","http://austin.craigslist.org/cas/4669647912.html","4669647912","Sep 15","need a bj","31","cas","casual encounters","south","Pretty simple. Looking to bust a nut soon. Love getting blown! May return the favor if you got a pic. I cannot host. Hit me up.","2014-09-15T16:00:37-0500","2014-09-15T16:00:37-0500"," 0","m4m"
"151","http://austin.craigslist.org","ppp","4669653799","http://austin.craigslist.org/cas/4669653799.html","4669653799","Sep 15","Discrete public foot worship?","27","cas","casual encounters","Austin","Me: cute, athletic guy with a huge foot fetish
You: woman who likes her feet worshipped and is into semi-public kinky stuff
I'd love to meet a woman in public and discretely suck her toes. Quiet isle at the grocery store? Home Depot? The mall? public park bench? I'm open to anything as long as it's semi-discrete. You slip off your shoes and i'll take your toes in my mouth, give your feet a nice foot massage, that kind of thing.
Totally real and 100% serious, if you are into the idea hit me up!","2014-09-15T16:04:00-0500","2014-09-15T16:04:00-0500"," 0","m4w"
"152","http://austin.craigslist.org","ppp","4669656213","http://austin.craigslist.org/cas/4669656213.html","4669656213","Sep 15","Hello ladys",NA,"cas","casual encounters",NA,"I have always wanted to be with tg girl i think they are so awesome and gorgouse for so many reasons. They are strong and independent women. If its a one night stand or to see if it could lead to something more im there.","2014-09-15T16:05:22-0500","2014-09-15T16:05:22-0500"," 0","m4t"
"153","http://austin.craigslist.org","ppp","4669656782","http://austin.craigslist.org/m4m/4669656782.html","4669656782","Sep 15","Freeballing downtown","30","m4m","men seeking men","On capmetro to south","Off work apx 430pm. Headed to bus stop 4th/colo. , freeballing in thin gymshorts. Semi hard in cockrings and showing it off! Any other freeballers in area? Show off our swinging dicks?! Not looking for anything but a little eye candy and public showoff. Meet me out DT!","2014-09-15T16:05:42-0500","2014-09-15T16:05:42-0500"," 0","m4m"
"154","http://austin.craigslist.org","ppp","4669657646","http://austin.craigslist.org/w4m/4669657646.html","4669657646","Sep 15","Dinner tonight?","40","w4m","women seeking men",NA,"Looking for someone to who would like to go out to dinner tonight. I am tired of eating by myself and would like a good conversation. Please send me a picture so I will know who will join me.","2014-09-15T16:06:11-0500","2014-09-15T16:06:11-0500"," 0",NA
"155","http://austin.craigslist.org","ppp","4669659523","http://austin.craigslist.org/w4m/4669659523.html","4669659523","Sep 15","EMPTY HOME SO !!!","23","w4m","women seeking men","austin","My house is totally empty, just me living here, but if you want me to drive over I can.
I'm a pretty easy going person, no drama in my life.","2014-09-15T16:07:14-0500","2014-09-15T16:07:14-0500"," 0",NA
"156","http://austin.craigslist.org","ppp","4669661356","http://austin.craigslist.org/cas/4669661356.html","4669661356","Sep 15","In town for the weekend!",NA,"cas","casual encounters",NA,"I'm coming into town this weekend and hoping to find a girl to have a some casual fun with. I'm 5'9 and In great shape. I love pleasing my partner and enjoy everything about sex. Send me a picture and I'll send a full one in return.","2014-09-15T16:08:15-0500","2014-09-15T16:08:15-0500"," 0","m4w"
"157","http://austin.craigslist.org","ppp","4669662035","http://austin.craigslist.org/m4m/4669662035.html","4669662035","Sep 15","Str8 Bi Athletic VGL Coach for Athletic 21 25 yo","45","m4m","men seeking men","Downtown Austin","Hey coach here Looking for ball players to try out for ball practice :)- Tuesday night or Wednesday Thursday so if you swing a big bat :)
Me
way above average very good looking masculine athletic Str8 man with big thick cock and I have a Bi side I also live with a girl must be discreet, I am suit n tie guy here on biz often I like to edge your cock suck your dick and rim/tongue your ass, massage your whole body professional style free, I will fuck your ass until you are moaning with pleasure, and or will 69 real good, safe sex only be Hiv- and dff like me, no stinky ass here you be clean too :)
I am visiting in marriott hotel can host you near 280 and 459 
no face pics be discreet
You
Must be a young athletic man 18 to 30 who who likes a mans touch
You be into coach dad type fun
Prefer white. also consider others with nice athletic body
HWP with muscle college guy +++ Kissing is also a big plus 
If you can't send me your age, weight, and height with a couple front body pics you will be deleted from my email 
Your chance of making the team improves with more pics and description of your skills
Catcher / Bottom is a big plus but not required
you like sucking cock, 69, and shower play 
First timer ok but tell me before you show up please","2014-09-15T16:08:39-0500","2014-09-15T16:08:39-0500"," 4",NA
"158","http://austin.craigslist.org","ppp","4669662037","http://austin.craigslist.org/cas/4669662037.html","4669662037","Sep 15","Be the center of attention",NA,"cas","casual encounters","Austin","If you've ever wanted to be the center of attention for a group of men, this is the perfect opportunity. We're in town this week for work and want to have a sexy hostess keep us company during the Thursday Night Football game. We'd love you to have a sexy outfit (maybe even a cheerleader uniform) and you can get us beers/drinks, give massages, lapdances, blowjobs etc. We'd like you to put on a little halftime show for us, and then when the game is over we can have as much fun as you're up for.
Put the number of guys you are up for in the subject line to eliminate spam. I have a buddy lined up already, but can easily invite 3-5 more guys depending on what you're up for.","2014-09-15T16:08:39-0500","2014-09-15T16:08:39-0500"," 0","mm4w"
"159","http://austin.craigslist.org","ppp","4669662069","http://austin.craigslist.org/m4m/4669662069.html","4669662069","Sep 15","Free balling or understall","30","m4m","men seeking men","Downtown or arboretum","I'm 30 years old, 6'1 very fit 185 lbs, normal professional guy, well hung. Looking to go for a run and see other hung guys free balling, maybe step off the trail and get hard and show off, maybe more. Not a must, but if you're fit, hung, hairy and uncut hit me up. I'm open minded and  low pressure, ddf neg is a must though.","2014-09-15T16:08:41-0500","2014-09-15T16:08:41-0500"," 2",NA
"160","http://austin.craigslist.org","ppp","4669665524","http://austin.craigslist.org/cas/4669665524.html","4669665524","Sep 15","Let's have some fun!!!","30","cas","casual encounters","marble falls","I'm 30 white 5' 11"" average build ddf... In town working for a while and looking for some fun while I'm here... I can host... No real preference just be 21+ and ready to have some fun and I'm cool with thick chicks so don't be shy ladies ;) reply with a pic and put ""fun"" in the subject","2014-09-15T16:10:38-0500","2014-09-15T16:10:38-0500"," 0","m4w"
"161","http://austin.craigslist.org","ppp","4669666030","http://austin.craigslist.org/stp/4669666030.html","4669666030","Sep 15","Looking  for my wing","39","stp","strictly platonic","san marcos","Im just going to throw it out there. I am a 39 year old professional Hispanic male. Im new to the area, I am originally from California. I love San Marcos cause its not as crowded as Austin and im tired of big city living. Im very fun and easy to get along with. Unfortunately, I have a busy work week and a demanding career. So its hard to meet new people sometimes as I am learning. I find that having a female friend as I have had in the past, is sometimes a lot more open and genuine. I am very open and very attentive too a true friends issues. Like they say. . . ""what are friends for?"" So what am I looking for? I am looking for a friend first, a female friend who can hang out on weekends or sometimes during the week. Whether its for dinner and drinks or a small road trip or just hang out and watch a movie and talk. I miss those types of friends and want to be the same friend in return. 
I am also wanting to meet someone that is not judgmental, cute, fun and honest.  I like to laugh and try new things. I am looking for someone that we can go out and will be there by my side whether I meet another woman, she will have my back and I hers. If she meets someone, I have her back as well and give her my opinion and I take her opinion. If she is ever hurt or needs a someone to talk too, vent, yell at, cry, throw stuff at (pillows only) drink with, get a another guy jealous (joking, but open to that) etc.. I got this. 
On the other hand, if this person turns out to be the one I fall for.. then an LTR is ok with me. But really, I find that if you are friends first, it only makes the foundation of the LTR even more stronger. Ladies, please send a pic and put favorite hangout spot on subject line to weed out spam. Its only fair, cause you all ask us guys the same. ","2014-09-15T16:10:54-0500","2014-09-15T16:10:54-0500"," 0","m4w"
"162","http://austin.craigslist.org","ppp","4669667516","http://austin.craigslist.org/cas/4669667516.html","4669667516","Sep 15","man contact","40","cas","casual encounters","south central austin","Staying at the Hampton located at 4141 Governors Row.  Looking for a buddy for kissing, stroking and cumin.  Six feet one inches tall, 208 pounds, 8"" cut.  Black guy, easy on the eyes, here on business","2014-09-15T16:11:44-0500","2014-09-15T16:11:44-0500"," 0","m4m"
"163","http://austin.craigslist.org","ppp","4669668013","http://austin.craigslist.org/m4w/4669668013.html","4669668013","Sep 15","Looking  for my wing","39","m4w","men seeking women","san marcos","Im just going to throw it out there. I am a 39 year old professional Hispanic male. Im new to the area, I am originally from California. I love San Marcos cause its not as crowded as Austin and im tired of big city living. Im very fun and easy to get along with. Unfortunately, I have a busy work week and a demanding career. So its hard to meet new people sometimes as I am learning. I find that having a female friend as I have had in the past, is sometimes a lot more open and genuine. I am very open and very attentive too a true friends issues. Like they say. . . ""what are friends for?"" So what am I looking for? I am looking for a friend first, a female friend who can hang out on weekends or sometimes during the week. Whether its for dinner and drinks or a small road trip or just hang out and watch a movie and talk. I miss those types of friends and want to be the same friend in return. 
I am also wanting to meet someone that is not judgmental, cute, fun and honest.  I like to laugh and try new things. I am looking for someone that we can go out and will be there by my side whether I meet another woman, she will have my back and I hers. If she meets someone, I have her back as well and give her my opinion and I take her opinion. If she is ever hurt or needs a someone to talk too, vent, yell at, cry, throw stuff at (pillows only) drink with, get a another guy jealous (joking, but open to that) etc.. I got this. 
On the other hand, if this person turns out to be the one I fall for.. then an LTR is ok with me. But really, I find that if you are friends first, it only makes the foundation of the LTR even more stronger. Ladies, please send a pic and put favorite hangout spot on subject line to weed out spam. Its only fair, cause you all ask us guys the same. ","2014-09-15T16:12:01-0500","2014-09-15T16:12:01-0500"," 0","woman (friends) or LTR"
"164","http://austin.craigslist.org","ppp","4669668260","http://austin.craigslist.org/stp/4669668260.html","4669668260","Sep 15","Just looking to hang this weekend","32","stp","strictly platonic","Austin","age :32body :heavystatus :single
Hello I am going to be in Austin this weekend for PRIDE... I was suppose to go with a friend but she is unable to attend. I am looking for a person or a group of people that would like to attend PRIDE... Drinks Friday and/or parade Saturday... Either way I am going... So if you are interested please email me... I am a real chill person I have been to Austin a few times and will be back again when I can... So if you are interested in a friendship more than just a one day hang I would be cool with that...
I don't know what you would like to know about me... I am a Libra, AA, dreads, hazel/green eyes, about 5'6'' and heavier set... This isn't like a hook up deal but I just figure you may want to know a little more about who you are emailing...
Hit me up let me know and we will go from there... I am not a social butterfly but I can hold a conversation and stuff. LOL","2014-09-15T16:12:11-0500","2014-09-15T16:12:11-0500"," 0","w4m"
"165","http://austin.craigslist.org","ppp","4669669908","http://austin.craigslist.org/m4m/4669669908.html","4669669908","Sep 15","new to austin and curious? want a blowjob on the DL?","27","m4m","men seeking men","riverside/east central austin","27 y/o masc/discreet dude hosting guys that want to come over to the riverside area, drop their pants, get head, cum, and go. send pics, stats, and be discreet and disease-free. discretion is absolutely guaranteed. if i see you out and about, i don't know you, and i expect the same. i strive to make you feel comfortable. 
if you're down to jack me off, suck me off, or sit on my cock, just do it without asking. it gets big really fast. first pic is me getting my fat dick sucked by a curious guy who loved it.
i'm open to anyone in shape, disease-free guys, but really get hard for straight/curious guys","2014-09-15T16:13:07-0500","2014-09-15T16:13:07-0500"," 2",NA
"166","http://austin.craigslist.org","ppp","4669670833","http://austin.craigslist.org/cas/4669670833.html","4669670833","Sep 15","freaky white ts iso monster","30","cas","casual encounters","46TH/harmon","Looking for now Hung young BBC
 Ima white ts thick where I should be pretty titties and A fat juicy booty that bounces like jello...looking for now Anything goes for the (gen)tleman who knows how to To show appreciation for skills ima curl ur toes witH 
ASK FOR PICS THEY WON'T POST MY PICS
REPLY WITH DICK PROOF AND NUMBER","2014-09-15T16:13:38-0500","2014-09-15T17:04:01-0500"," 0","t4m"
"167","http://austin.craigslist.org","ppp","4669671342","http://austin.craigslist.org/m4w/4669671342.html","4669671342","Sep 15","I want to do things differently","52","m4w","men seeking women","RR","Hello, 
I am single, white, tall, slim, clean, med to short salt and pepper hair, intelligent and dry sense of humor I suppose. I laugh more on the inside.. haha! I am a clean person but did get hsv2 from a now ex girlfriend who was not totally up front with me. After taking a break after being with her I am ready to get back out there and share my life again. Being single gave me a chance to be more sure now of what I am looking for. 
The person I would like to find would first also have hsv2 or have a natural immunity(is that even possible?). Yes I take the pills but I don't want to spread anything, having it is bad enough even though I have not had any outbreaks in years. I am hoping you would also be younger than me,  submissive, hwp or no more than 20 pounds overweight for your body size. Thats because I like to walk, have lengthy sex sessions, and flip you over in bed if necessary(haha) and I want you to keep up if you join me. Also its a preference. 
I am ultimately looking for something long term but lets meet first, have some fun sex, get to know each other, then see if long term is in the future. Be real, a person can be the furthest from bf material but when paired with the right complementary personality all things are possible. 
I am experienced, nicely hung, oral, strong hands, rough and gentle, fun, educated, adventurous, ready to try new things or improve on some old ones, can host or travel, may be interested in some role play if you tell me whats on your mind. When you write me tell me about you, what you are looking for, likes, dislikes, what you look like, what interested you in my ad, and if you send a pic to me I will return mine.
I have stepped up, now it's your turn. I will respond to all messages that look real. If I don't respond to you don't get mad, maybe put a little effort in your message and tell me more about you so I know you are real.","2014-09-15T16:13:56-0500","2014-09-15T16:13:56-0500"," 0","hsv+"
"168","http://austin.craigslist.org","ppp","4669674530","http://austin.craigslist.org/cas/4669674530.html","4669674530","Sep 15","Naked Office Fun",NA,"cas","casual encounters","N-RR-GT","Catchy title right?
Married White Male looking for safe Married White Male or Bi White Male for just that...Naked Office Fun
I have a nice package to suck on and if you do too, I will recip
I am hwp very discreet safe and ddf and expect exactly the same
Mature mwm here with nice body 
Please tell me about you
Safe Discreet place to play with planning
Thanks","2014-09-15T16:15:45-0500","2014-09-15T16:15:45-0500"," 0","m4m"
"169","http://austin.craigslist.org","ppp","4669674695","http://austin.craigslist.org/cas/4669674695.html","4669674695","Sep 15","bbw needs sexy cpl or guy to fuck tonight",NA,"cas","casual encounters","You host","Looking for tonight only. Cute bbw, multi orgasmic. Ddf and dtf. Latina, size 12. Big boobs, love them sucked. You must host. Pic 4 pic.
I'm insatiable and need a guy to touch me, finger me, then slide it in after I deep throat. If you are a couple, I'm bi and love giving oral.","2014-09-15T16:15:50-0500","2014-09-15T16:15:50-0500"," 0","w4mw"
